"Product Name","ASIN","Author ID"
"Heartwood (A Read with Jenna Pick): A Novel","1668063603","B001JPCAKS"
"Heartwood (A Read with Jenna Pick): A Novel","1668063603","B001JPCAKS"
"Life as No One Knows It: The Physics of Life's Emergence","0593191897","B0D815SS8H"
"Life as No One Knows It: The Physics of Life's Emergence","0593191897","B0D815SS8H"
"Turbulence: A Novel","1982122730","B0034Q3JWI"
"Turbulence: A Novel","1982122730","B0034Q3JWI"
"The Woman in Suite 11: A Novel","B0DJM99D77","B00OA8QDT0"
"The Woman in Suite 11: A Novel","B0DJM99D77","B00OA8QDT0"
"The Last One at the Wedding: A Novel","1250895782","B001JAQ60S"
"The Last One at the Wedding: A Novel","1250895782","B001JAQ60S"
"The Maid's Secret: A Maid Novel (Molly the Maid Book 3)","B0D9F3KFPM","B096BLV2JQ"
"The River Is Waiting (Oprah's Book Club): A Novel","B0DHDF2RDL","B000APITZS"
"The River Is Waiting (Oprah's Book Club): A Novel","B0DHDF2RDL","B000APITZS"
"The Game","0470835842","B001HOE4GE"
"The Game","0470835842","B001HOE4GE"
"Aldo Leopold: A Sand County Almanac & Other Writings on Conservation and Ecology (LOA #238) (Library of America)","B00BUP18U0","B000APZ3MU"
"The Rider","1582342903","B000APEA88"
"The Rider","1582342903","B000APEA88"
"The Wedding People: A Novel","B0CJ839C56","B003WOQQN6"
"The Emperor of Gladness: Oprah's Book Club: A Novel","059383187X","B004ODUZ2M"
"On the Calculation of Volume (Book I): Shortlisted for the 2025 International Booker Prize","0811237257","B001JY4CN2"
"Run for the Hills: From the NYT Bestselling Author of Nothing to See Here","0063317516","B002BMMH9C"
"Flesh: A Novel","198212279X","B0034Q3JWI"
"Tilt: A Novel","B0CWFMT5SC","B0DBSGHCGM"
"Careless People: A Cautionary Tale of Power, Greed, and Lost Idealism","B0DY9TZD8Z","B0F1T6SMJP"
"Audition: A Novel","059385232X","B00OYSYUXC"
"The Hedgehog’s Dilemma","B0D57LWBM6","B001JOFG9G"
"The Murder Show","1250325722","B07567W7ZV"
"I See You've Called in Dead: A Novel","B0DC7V6RMG","B00DQELE1G"
"CABIN: Off the Grid Adventures with a Clueless Craftsman","1250285704","B0DNNGW486"
"Kills Well with Others","0593638514","B001H6IPEY"
"The Passenger Seat","1771966300","B0DVL3364Y"
"Rental House: A Novel","0593545540","B071PCWBZV"
"Fifty in Reverse: A Novel","1982152672","B001H6L9EW"
"Hansons Marathon Method: Run Your Fastest Marathon the Hansons Way","B0CDDCJ6P2","B007RB8HMI"
"Martin Dressler: The Tale of an American Dreamer (Vintage Contemporaries)","B004089I6A","B000AQ3L6Y"
"The Botany of Desire: A Plant's-Eye View of the World","B000FC1H14","B000AQ74HQ"
"Beartooth: A Novel","1954118023","B0745475Y6"
"Peak Performance: Elevate Your Game, Avoid Burnout, and Thrive with the New Science of Success","162336793X","B00II9FUTG"
"Peak Performance: Elevate Your Game, Avoid Burnout, and Thrive with the New Science of Success","162336793X","B01M3U4B75"
"Banana: The Fate of the Fruit That Changed the World","1594630380","B001HMLH3O"
"The Ghost Map: The Story of London's Most Terrifying Epidemic and How It Changed Science, Cities, and the Modern World","1594489254","B000APC0M6"
"Out of Thin Air: Running Wisdom and Magic from Above the Clouds in Ethiopia: Winner of the Margaret Mead Award 2022","1472975324","B08CGQDGPJ"
"The Incomplete Book of Running","1451696248","B07JM29N6S"
"North Woods: A Novel","0593597036","B001IQZBKY"
"Somebody's Fool: A novel (North Bath Trilogy)","0593317890","B000AQ0EIM"
"My Year of Running Dangerously: A Dad, a Daughter, and a Ridiculous Plan","0399175474","B01LW5001G"
"James (Pulitzer Prize Winner): A Novel","0385550367","B001H6L4QK"
"Memoirs of Hadrian (FSG Classics)","0374529264","B000APPC2Q"
"Memoirs of Hadrian (FSG Classics)","0374529264","B00JN47IK4"
"Fast Girl: A Life Spent Running from Madness","0062346229","B01DR0E0AU"
"No Room at the Morgue","B081M4F8GH","B001JOZR1S"
"Stoner (New York Review Books Classics)","B003K15IF8","B00TTO3JVA"
"Dead Money: A Novel","0593726707","B0DFJ3D95L"
"The Miraculous from the Material: Understanding the Wonders of Nature","0593701488","B000APY6Q4"
"Frostbite: How Refrigeration Changed Our Food, Our Planet, and Ourselves","B0CJTKZCTR","B0BHM4J6RZ"
"The Bones of Bascom Hall (A Nora Barnes and Toby Sandler Mystery)","B0DMDYK6Y6","B00THH3EBY"
"Everything Is Predictable: How Bayesian Statistics Explain Our World","1668052601","B07TBKPJBP"
"Hansons Half-Marathon Method: Run Your Best Half-Marathon the Hansons Way","B00JV2H5I8","B007RB8HMI"
"The Last Ranger: A novel","B0BL6YQ61Y","B001ITVQ14"
"Embers of the Hands: Hidden Histories of the Viking Age","1324089237","B0DGL8W2JS"
"The Wide Wide Sea: Imperial Ambition, First Contact and the Fateful Final Voyage of Captain James Cook","B0CC1J32NG","B001IGUQVI"
"The Wide Wide Sea: Imperial Ambition, First Contact and the Fateful Final Voyage of Captain James Cook","0385544766","B001IGUQVI"
"Godwin: A Novel","0593701321","B001JP3S2M"
"Blackouts: A Novel","B0BQGDMFH6","B004SWIOXG"
"To the Limit: The Meaning of Endurance from Mexico to the Himalayas","1399403427","B08CGQDGPJ"
"The Secret Lives of Booksellers and Librarians: True Stories of the Magic of Reading (Heroes Among Us Book 4)","B0CDWDLCNS","B000APZGGS"
"Orbital: A Novel (Booker Prize Winner)","B0BZ5Y513V","B01A2MQ9DM"
"The God of the Woods: A Novel","B0CL1YQLB5","B001JS60D8"
"The Heart in Winter: A Novel","0385550596","B006GQUIEK"
"Burn: A novel","0593801628","B001ITVQ14"
"Martyr!: A novel","0593537610","B01MTJENUW"
"The God of the Woods: A Novel","0593418913","B001JS60D8"
"Getting to Know Death: A Meditation","1639734449","B000AQ6YCC"
"The Ministry of Time: A Novel","1668045141","B0C3D86WW7"
"Safe Enough: Crime Stories by the Author of Jack Reacher","B0CW1J3Y5G","B000APO0PQ"
"Blood Test: A Comedy","0593700856","B000AQ4H12"
"That Librarian: The Fight Against Book Banning in America","B0CQFXKTPW","B0CZ9VHZ8Y"
"The Life Impossible: A Novel","B0CGZFPKTZ","B001IO8C1Q"
"Checkout 19: A Novel","B097XBXQ1T","B01HRTCFVS"
"The Sequel: A Novel (The Book Series 2)","B0CQHM2KL5","B001HCV342"
"Here One Moment","0593798600","B00459IA54"
"We Solve Murders: A Novel","B0CQJHF3HQ","B074KL81KM"
"Creation Lake: A Novel","1982116528","B001JS1P24"
"The Kind Worth Killing: A Novel","0062267523","B00E5TKWX2"
"A Talent for Murder: A Novel","0063205033","B00E5TKWX2"
"A (Very) Short History of Life on Earth: 4.6 Billion Years in 12 Pithy Chapters","B092T8QDYW","B001IO9QAC"
"Invitation to a Banquet: A History of Chinese Food","B0BWGKNK7G","B001IGLRVG"
"I Cheerfully Refuse","B0CH1NHWNW","B001JS1KFQ"
"The Midnight Feast: An NPR Best Book of the Year","B0CL3FMNKJ","B00LMBVZNC"
"End of Story: An Enthralling Thriller with a Suspenseful Plot, Get Lost in the Pages and Unravel the Mystery","B078R46LCY","B074BPQ4X3"
"The Hunter: A Novel","B0C7729CF8","B001H6IGWU"
"The Hunter: A Novel","0593493435","B001H6IGWU"
"The Pale Blue Eye: A Novel","B000GCFX6S","B001ILKG5O"
"The Demon of Unrest: A Saga of Hubris, Heartbreak, and Heroism at the Dawn of the Civil War","B0CDKLBD2W","B000AQ6KV2"
"Who Owns This Sentence?: A History of Copyrights and Wrongs","B0C97F8KPY","B00E8LWLYK"
"Outsider: An Old Man, a Mountain and the Search for a Hidden Past","B0B7NZHCKR","B0C2CXGGMV"
"The Winner: A Novel","0063353598","B003AE8M76"
"Still Waters: A Novel","1250325692","B07567W7ZV"
"The Body in Question: A Novel","B07RT71Z48","B001H6IEK4"
"One Perfect Couple","B0CL5G23ZF","B00OA8QDT0"
"The Golden Spoon: A Novel","B0B3Y9JVMK","B0BKH721LX"
"The Ferryman: A Novel","B0B8GZ58DK","B001H6J17E"
"Balloon Dog","B09X34KMRM","B000APMXVE"
"The Aosawa Murders","B07QN87LQB","B003UW4BO6"
"I Hope This Finds You Well: A Novel","B0CJ9TSSYB","B0D34BLRX8"
"Tokyo Ueno Station (National Book Award Winner): A Novel","B081914PR7","B001JXPK0C"
"Tokyo Ueno Station (National Book Award Winner): A Novel","B081914PR7","B004N9BVNO"
"A Travel Guide to the Middle Ages: The World Through Medieval Eyes","B0C97G1ZR6","B001JS9SQY"
"A Young People's History of the United States (For Young People Series)","B003B4IW2U","B000AQ01MQ"
"The Heaven & Earth Grocery Store: A Novel","B0BPNP7YQB","B000AP9SB2"
"The Covenant of Water (Oprah's Book Club)","B0BJSGV831","B000AP9LZ0"
"The Day Tripper: A Powerful Time Travel Redemption Story of Small Actions Leading to Big Consequences","B0C4PX8RD7","B086Z2XSNC"
"Shape: The Hidden Geometry of Information, Biology, Strategy, Democracy, and EverythingElse","B08PF965W9","B001K8IUCG"
"Wandering Stars: A novel","B0C772ZLMQ","B077TXLDMQ"
"The Upstairs Delicatessen: On Eating, Reading, Reading About Eating, and Eating While Reading","B0BQGHJM5L","B003F4Z8SC"
"Salvation of a Saint: A Detective Galileo Novel (Detective Galileo Series Book 2)","B007RMYE9M","B003UVVURI"
"Zero at the Bone: Fifty Entries Against Despair","B0BQGJVCMT","B001JS1YMA"
"The Fury","B0BXTB6HSN","B07CZQY3KT"
"Ordinary Grace: A Novel","B008J2G5Y6","B001H6KG50"
"Scenes from a Childhood — WINNER OF THE 2023 NOBEL PRIZE IN LITERATURE","B07BX82VS9","B001JOR0S6"
"The Clementine Complex","B0BTZRQHJM","B07SXS7HMW"
"Everyone on This Train Is a Suspect: A Novel (The Ernest Cunningham Mysteries Book 2)","B0C6KMGND1","B07WWSMVWC"
"Northwoods: A Novel","B0C7RPT9B3","B0C9BXTVBR"
"I Know What You Did: A Novel","B0BJP5QFFM","B07KX9J53B"
"Heart Sutra","B0B72HGHW8","B0034NEPV0"
"You Dreamed of Empires: A Novel","B0C1YCKNK1","B001JWX44M"
"Northwoods: A Novel","B0C7RQ8Y2F","B0C9BXTVBR"
"The Devotion of Suspect X: A Detective Galileo Novel (Detective Galileo Series Book 1)","B0044781ZQ","B003UVVURI"
"Prophet Song: A Novel (Booker Prize Winner)","B0CLQVQSVL","B00BT0KC94"
"Someone Who Will Love You in All Your Damaged Glory: Stories","B07HDT9JFX","B07S62ZK9K"
"None of This Is True: A Novel","B0BDMPQ2FC","B001IO9ULM"
"Diary of a Void: A Novel","B09LHBX5KV","B099H1YJ74"
"None of This Is True: A Novel","1982179007","B001IO9ULM"
"The MANIAC","0593654471","B086XCPPPK"
"True North: A Novel","B0C592RHNC","B08D3JXR4C"
"The Librarianist: A Novel","B0BH4QWM85","B001JRWCWM"
"Martyr!: A novel","B0C3C886FY","B01MTJENUW"
"The Restaurant Inspector","B0927NRBFB","B08YMR4JVG"
"The Guest List: A Novel","B07WG8L7WC","B00LMBVZNC"
"The Killing Hills (The Mick Hardin Novels Book 1)","B08TF1VTGX","B000AQ4FOQ"
"Aliss at the Fire — WINNER OF THE 2023 NOBEL PRIZE IN LITERATURE","B09RMQJCZJ","B001JOR0S6"
"Shutter Island","B000JMKNV0","B00LMXVRD8"
"Good Bad Girl: A Novel","B0BST5X6GS","B01N7B9IFJ"
"Hello Beautiful (Oprah's Book Club): A Novel","B0B7R4Q5DJ","B001K8VW5S"
"The Day of the Jackal","0553266306","B000APF22Q"
"Ninth House (Ninth House Series Book 1)","B07LF64DZ2","B005ZZ8XQS"
"The Soulmate: A Novel","B09Y467GZY","B00MII822U"
"Everyone in My Family Has Killed Someone: A Novel (The Ernest Cunningham Mysteries Book 1)","B09Y94K74X","B07WWSMVWC"
"Blood Meridian: Or the Evening Redness in the West","0679728759","B000APT0OW"
"Babel: Or the Necessity of Violence: An Arcane History of the Oxford Translators’ Revolution—An Historic Fantasy of Dark Academia, Perfect for Fans of ... Fiction and Nineteenth Century England","B09MD95S5V","B0788VXRHP"
"Lay Your Body Down: A Novel of Suspense","B09721CTG1","B08V91P1Y9"
"The Plotters: A Novel","B07CWDMQ45","B01B9S511O"
"Smarter Not Harder: The Biohacker's Guide to Getting the Body and Mind You Want","B0B399L6KP","B00A1VAH5Q"
"Four Thousand Weeks: Time Management for Mortals","B08FGV64B1","B004DJDK1U"
"Yellowface: A Chilling Novel of Racism and Cultural Appropriation from the author of Katabasis","B0B9SN8K6H","B0788VXRHP"
"Wellness: A Novel (Oprah's Book Club)","B0BR511292","B01FBNAT06"
"The Mystery Guest: A Maid Novel (Molly the Maid Book 2)","B0C5LRCM2F","B096BLV2JQ"
"Fast After 50: How to Race Strong for the Rest of Your Life","1937715264","B001JP0ANM"
"The Spy Who Came in from the Cold: A George Smiley Novel (George Smiley Novels Book 3)","B006CUDDUG","B000APC3LO"
"The Spy Who Came in from the Cold: A George Smiley Novel (George Smiley Novels Book 3)","B006CUDDUG","B005Q05URM"
"I Have Some Questions for You: A Novel","B09ZRWP8DS","B004GZJEM0"
"The Longest Race: Inside the Secret World of Abuse, Doping, and Deception on Nike's Elite Running Team","1982179147","B004GR3HW6"
"Beastie Boys Book","0812995546","B07JLWB4QT"
"Beastie Boys Book","0812995546","B0DHH3KH9F"
"North Woods: A Novel","B0BPX7SF89","B001IQZBKY"
"Chain Gang All Stars: A Read with Jenna Pick: National Book Award Finalist","B0B5ST3XX4","B07C45XZH3"
"Starter Villain","B0B9KVXCQ6","B001IGJOCA"
"Breaking and Entering","B0BKH7G2X8","B001HCYQG4"
"Slow Horses (Slough House Book 1)","B004HW7DZ2","B001JP3TOY"
"Trust (Pulitzer Prize Winner)","B09BV2JNWV","B00U9P6ROO"
"No One Will Miss Her: A Dark and Compelling Mystery with a Devious Plot, Get Ready to Unravel the Secrets!","B08SMFSLVQ","B005QU9U00"
"The Sullivanians: Sex, Psychotherapy, and the Wild Life of an American Commune","B0BBC769LV","B000AP7XGO"
"Somebody's Fool: A novel (North Bath Trilogy Book 3)","B0BKKVQPLB","B000AQ0EIM"
"The Rise: A Short Story","B0CBW58P3J","B000AQ6XQE"
"The Fraud: A Novel","B0BP66G6B7","B001D0P4CA"
"How Can I Help You","B0BJNKTFGH","B003GBCHVU"
"The Last Devil to Die: A Thursday Murder Club Mystery (Thursday Murder Club Mysteries Book 4)","B0BQLKNTYR","B074KL81KM"
"The Vaster Wilds: A Novel","B0BTVBH6G3","B001JS4QVG"
"The Girl in the Eagle's Talons: A Lisbeth Salander Novel (The Girl with the Dragon Tattoo (Lisbeth Salander / Millennium) Book 7)","B0BLY7J9DC","B0C5RWKXF3"
"What You Are Looking For Is in the Library: A Touching Narrative of Self-Discovery, Community Bonds and the Joys of Reading in Tokyo's Libraries","B0BT82YGGF","B09XVCS578"
"Small World: A Novel","B08T6CL58V","B001JP2P1W"
"The Golden Couple: A Novel","B092T947PJ","B002FYZBVM"
"The Golden Couple: A Novel","B092T947PJ","B07C9RJK1F"
"Ella Minnow Pea: A Novel in Letters","0385722435","B001IGQK2W"
"How Minds Change: The Surprising Science of Belief, Opinion, and Persuasion","B093R2CP2V","B005T65KZA"
"Path Lit by Lightning: The Life of Jim Thorpe","B09JPFYQY2","B000APJ88U"
"Tom Lake: A Reese’s Book Club Pick","B0BL126WSH","B000AQ6QAW"
"Good Family","1250810175","B07567W7ZV"
"The School of Hard Talks: How to Have Real Conversations with Your (Almost Grown) Kids","1632174707","B0BGMKHJ73"
"I Am Homeless If This Is Not My Home: A novel","B0BG13PH57","B000APWFEY"
"National Geographic Guide to National Parks of the United States, 8th Edition (National Geographic Guide to the National Parks of the United States)","B016TG0SAK","B000AP861U"
"National Geographic Guide to National Parks of the United States, 8th Edition (National Geographic Guide to the National Parks of the United States)","B016TG0SAK","B001JP2H5G"
"One by One","B084G9Z5C3","B00OA8QDT0"
"The Art Thief: A True Story of Love, Crime, and a Dangerous Obsession","0525657320","B004MKZKYA"
"Rabbits for Food","B07GD51NCJ","B000APURZS"
"Choosing to Run: A Memoir","0593186648","B0BC994267"
"Zero Days","B0BHTN6TL6","B00OA8QDT0"
"Small Mercies: A Detective Mystery","B0B7NDZNDV","B00LMXVRD8"
"Going Zero: A Novel","006322707X","B001K85M6S"
"Code Name Blue Wren: The True Story of America's Most Dangerous Female Spy—and the Sister She Betrayed","B09XBGYWSR","B0BJ7QV1Y1"
"Gone to the Wolves: A Novel","0374603332","B001H9RT48"
"My Murder: A Novel","B0BHCXVWGT","B00KQHE69I"
"How to Survive: Self-Reliance in Extreme Circumstances","B08D4QJRY2","B07Q5QCB2W"
"The Celebrants: A Read with Jenna Pick: A Novel","B0B9WRWFH6","B076HBY6PY"
"The Dirty Tricks Department: Stanley Lovell, the OSS, and the Masterminds of World War II Secret Warfare","1250280249","B0BCC93C3F"
"The Trackers: A Search for a Fugitive in Depression-Era America","B0B6JSJQLH","B000AQ73IQ"
"The It Girl","1982155264","B00OA8QDT0"
"Apples Never Fall","B08PG6CKZJ","B00459IA54"
"We Share the Sun: The Incredible Journey of Kenya's Legendary Running Coach Patrick Sang and the Fastest Runners on Earth","B0B3Y4RYX6","B0BZTC13ZJ"
"The Appeal: A Novel","B098433CGQ","B08FRJK6WG"
"Mrs. Ted Bliss","B00AG8GXVQ","B000APUV9U"
"The Marriage Portrait: Reese's Book Club: A novel","B09RTYQW2S","B001H6IT1S"
"Birnam Wood: A Novel","B09Y46DSD7","B0034O4XWA"
"Lapvona: A Novel","B09GW3P1KJ","B00MC7025W"
"Blaze Me a Sun: A Novel About a Crime (Halland Suite)","B09XL59MJX","B00JDWVMKS"
"The Invisible Life of Addie LaRue","B084357H23","B00MLKA3WM"
"In the Woods (Dublin Murder Squad, Book 1)","B000U913EI","B001H6IGWU"
"Saturday Night at the Lakeside Supper Club: A Novel","B0B6Z3LN2D","B010XYMBEK"
"All the Living and the Dead: From Embalmers to Executioners, an Exploration of the People Who Have Made Death Their Life's Work","B09CNFH5WG","B00U9P1RHQ"
"The Wager: A Tale of Shipwreck, Mutiny and Murder","0385534264","B001YDEZJO"
"The Wager: A Tale of Shipwreck, Mutiny and Murder","B0B6Z4SVTH","B001YDEZJO"
"Outlive: The Science and Art of Longevity","B0B1BTJLJN","B00NB4VX76"
"Outlive: The Science and Art of Longevity","B0B1BTJLJN","B0BL8JY16Q"
"Pineapple Street: A GMA Book Club Pick: A Novel","B0B3HPSFJ7","B07KX6QLCH"
"Runner's World Run Less Run Faster: Become a Faster, Stronger Runner with the Revolutionary 3-Runs-a-Week Training Program","B087BQ7GK3","B001JP2G5M"
"Stolen","B0B3Y8DJFJ","B0B75GSX7V"
"How Not to Kill Yourself: A Portrait of the Suicidal Mind","B0B1Y1ZKFX","B001IOH5B4"
"Palm Beach, Finland","B07HB5DKQX","B009SQPAZM"
"The Man Who Died","B075SPBQDV","B009SQPAZM"
"Running for My Life: One Lost Boy's Journey from the Killing Fields of Sudan to the Olympic Games","B007D1TKAU","B00DWWVFW0"
"The Kind Worth Saving: A Novel","B0B3989NDF","B00E5TKWX2"
"River Woman, River Demon: A Novel","B09YNV5V75","B01M0NL4ZY"
"Tomorrow, and Tomorrow, and Tomorrow: A novel","B09JBCGQB8","B001IGJWR2"
"Killers of a Certain Age","B09N6VX4K7","B001H6IPEY"
"You're Saying It Wrong: A Pronunciation Guide to the 150 Most Commonly Mispronounced Words--and Their Tangled Histories of Misuse","0399578080","B001H6OGO2"
"You're Saying It Wrong: A Pronunciation Guide to the 150 Most Commonly Mispronounced Words--and Their Tangled Histories of Misuse","0399578080","B001H6Q67M"
"The Last Mona Lisa: A Novel","B08QXTPXPH","B001IU2Q94"
"How the Word Is Passed: A Reckoning with the History of Slavery Across America","B08KQ4W18H","B06XGRHX69"
"66 Metres: A chilling thriller that will keep you on the edge of your seat! (Nadia Laksheva Spy Thriller Series, Book 1)","B01HLY0Z0W","B01KWTDN7U"
"Wrong Place Wrong Time: A Novel","B09NW4FN2R","B06XQTJLJ5"
"The Boy from the Woods: Wilde, Book 1","B07ZPDRVYF","B000APCH7Y"
"The Boy from the Woods","B07TYBQJBM","B000APCH7Y"
"The Master & Margarita","B08KH4LZDM","B000APW544"
"Index, A History of the: A Bookish Adventure from Medieval Manuscripts to the Digital Age","B098TZ17NC","B092N1DY5V"
"The Mosquito Bowl: A Game of Life and Death in World War II","B09FK32FY3","B000APV4KA"
"Super-Infinite: The Transformations of John Donne","B09NTK9WDQ","B00QN3VAFW"
"The Sympathizer: A Novel (Pulitzer Prize for Fiction)","B00PSSG4MM","B001HD1IPU"
"A Gentleman in Moscow: A Novel","B01COJUEZ0","B004MW8MG6"
"Demon Copperhead: A Pulitzer Prize Winner","B09QMHZ53K","B000APW2FQ"
"Random","B0B2F5J32D","B000AP7XAA"
"Godspeed","B08NT2VSWF","B00F5Z1RAM"
"Randomize: Forward collection","B07X7K7DVS","B00G0WYW92"
"Randomize (Forward collection)","B07VDJBKNJ","B00G0WYW92"
"World's Greatest Running Lessons: 50 Lessons to Elevate Your Running","B0B33PJZJT","B00J22QXS0"
"World's Greatest Running Lessons: 50 Lessons to Elevate Your Running","B0B33PJZJT","B09YS1XQ3H"
"If Nietzsche Were a Narwhal: What Animal Intelligence Reveals About Human Stupidity","B09QKTFZGR","B00BTIZYL2"
"Night of the Living Rez","B09NH4DJBP","B0B3JWMBQG"
"Nöthin' But a Good Time: The Uncensored History of the '80s Hard Rock Explosion","B08BYBNGMW","B004MVO4PK"
"Nöthin' But a Good Time: The Uncensored History of the '80s Hard Rock Explosion","B08BYBNGMW","B092731SBP"
"The Idiot: A Novel","B01HNJIJ3U","B0039K50N0"
"The Passenger","B09T9D8QY7","B000APT0OW"
"Small Game: A Novel","B09R21YVLM","B01M1J578F"
"The Icepick Surgeon: Murder, Fraud, Sabotage, Piracy, and Other Dastardly Deeds Perpetrated in the Name of Science","0316496502","B003JDD0RA"
"No One Left to Come Looking for You: A Novel","B09RX2WQ3M","B001HPNK8G"
"The Mosquito Bowl: A Game of Life and Death in World War II","0062879928","B000APV4KA"
"The Boys in the Boat: Nine Americans and Their Epic Quest for Gold at the 1936 Berlin Olympics","B00AEBETU2","B001JRTQ3K"
"Indigenous Continent: The Epic Contest for North America","B0B193DJYK","B00MQIFXE2"
"Sugar Street","080216000X","B000APHHVU"
"In Fifty Words!: Micro Fictions","B07WK8JZ9N","B004XPMPCO"
"If I Survive You","B09NTJPTKN","B0B8F2VRDL"
"Lost & Found: A Memoir","B09285Y1V4","B0032DEMD8"
"Heart of a Dog","B0BH8GTQYX","B000APW544"
"Heart of a Dog","B0BH8GTQYX","B001IR1S8C"
"Liberation Day: Stories","0525509593","B000APEZ74"
"The Bullet That Missed: (The Thursday Murder Club 3)","0241512425","B074KL81KM"
"Running Smart: How Science Can Improve Your Endurance and Performance","0262542447","B098B1YKZM"
"The Girl in His Shadow: A Novel","B08DHDY24D","B006VXT9M0"
"The Girl in His Shadow: A Novel","B08DHDY24D","B091MGSVY6"
"The Man Who Died Twice: A Thursday Murder Club Mystery (Thursday Murder Club Mysteries Book 2)","B08YRM9NBM","B074KL81KM"
"A Slow Fire Burning: A Novel","B08PC3SZHX","B0034Q4SHS"
"Nine Lives: A Novel","B097769VDM","B00E5TKWX2"
"Iron Lake (20th Anniversary Edition): A Novel (Cork O'Connor Mystery Series Book 1)","B000FC0QBQ","B001H6KG50"
"Five Decembers","B08THH7R49","B08ZQY954D"
"Bomb Shelter: Love, Time, and Other Explosives","B09841WSGD","B00IUQJ5GQ"
"When I'm Gone, Look for Me in the East: A Novel","B095MPSYWY","B001KHY706"
"The Thursday Murder Club: A Novel (Thursday Murder Club Mysteries Book 1)","B084M663VB","B074KL81KM"
"The 5 Love Languages: The Secret to Love that Lasts","B00OICLVBI","B01IAEQ73Q"
"Less (Winner of the Pulitzer Prize): A Novel (The Arthur Less Books Book 1)","B01MSICPW3","B001IGOPVU"
"My Year Abroad: A Novel","B08HL86V91","B001JXNQAS"
"Outline","0571233627","B000AQ4VN6"
"Crossroads: A Novel","B08N8Z99MK","B00458HQ7S"
"Do Hard Things: Why We Get Resilience Wrong and the Surprising Science of Real Toughness","006309861X","B00II9FUTG"
"River of the Gods: Genius, Courage, and Betrayal in the Search for the Source of the Nile","B09BTJNJCX","B001ILFMH6"
"The Guide: A novel","B08P98PVY2","B001K1DY74"
"Imagine Me Gone","B0151YQYYU","B001K7Z3D6"
"The Angel of Rome: And Other Stories","006286811X","B000APTHRC"
"Train Dreams","1250007658","B000AQ3FL0"
"The Plant-Based Athlete: A Game-Changing Approach to Peak Performance","B08J3YYP2M","B00D7I143O"
"The Plant-Based Athlete: A Game-Changing Approach to Peak Performance","B08J3YYP2M","B095RNXKW6"
"The Paris Apartment: A Novel","B098QS47D3","B00LMBVZNC"
"Stupid Things I Won't Do When I Get Old: A Highly Judgmental, Unapologetically Honest Accounting of All the Things Our Elders Are Doing Wrong","B08KL58Q4X","B001HMRN7S"
"The Rover","B00S05Q7JK","B001JS8R52"
"The Rover (Kindle Single)","B00JX43A0G","B001JS8R52"
"Anthem","B093ZQCS29","B000APUZA0"
"Immune: A Journey into the Mysterious System That Keeps You Alive","B08XTNHRR5","B092MT758M"
"The Silent Patient","B07D2C6J4K","B07CZQY3KT"
"Broken Ice: A Novel (Nils Shapiro Book 2)","B0756J4NRG","B07567W7ZV"
"The Swimmers: A novel (CARNEGIE MEDAL FOR EXCELLENCE WINNER)","B095MMJYSR","B001KDOKLG"
"Sweat: A History of Exercise","1620402289","B001HMRWEC"
"The Shallows: A Nils Shapiro Novel (Nils Shapiro, 3)","1250191319","B07567W7ZV"
"Sea of Tranquility: A novel","B099DRHTLX","B002BMMGK2"
"Gone to Dust: A Novel (Nils Shapiro Book 1)","B01NBJMMRR","B07567W7ZV"
"Several People Are Typing: A GMA Book Club Pick","B08PY1XTB8","B0941Y1B9T"
"The Maid: A GMA Book Club Pick: A Novel (Molly the Maid 1)","B091Y4KGFH","B096BLV2JQ"
"Hidden Valley Road: Inside the Mind of an American Family","B07TZYFR71","B00D7JVI98"
"The Plot: A Novel (The Book Series 1)","B08JKC299M","B001HCV342"
"Give a Girl a Knife: A Memoir","B01LWWK7WR","B00E60T7LS"
"Old Yeller (Perennial Classics)","B004TE79F2","B001H6OCW8"
"Riverman: An American Odyssey","B098PXP11K","B099BLBQYW"
"Madhouse at the End of the Earth: The Belgica's Journey into the Dark Antarctic Night","B08FH9BV7N","B08H5R4LMJ"
"The Cartographers: A Novel","B08G1NJK2R","B0755NH654"
"Dreamland (YA edition): The True Tale of America's Opiate Epidemic","B07TVRR6GR","B001JSD7RU"
"300 Arguments: Essays","1555977642","B001JRRLZ0"
"Princeton Review AP European History Premium Prep, 2022: 6 Practice Tests + Complete Content Review + Strategies & Techniques (2022) (College Test Preparation)","0525570659","B00GBT2FQQ"
"When We Cease to Understand the World","B08QM8VHRT","B086XCPPPK"
"The Prince of Tides: A Novel","0553381547","B000APY5TW"
"Under the Banner of Heaven : A Story of Violent Faith","0330419129","B000AQ8WPY"
"Lit: A Memoir","0060596988","B000AQ2MH8"
"Atlas of the Invisible: Maps & Graphics That Will Change How You See the World","1846149711","B00NGF3ANK"
"Atlas of the Invisible: Maps & Graphics That Will Change How You See the World","1846149711","B0756CT9KZ"
"Check These Out: One Librarian's Catalog of the 200 Coolest, Best, and Most Important Books You'll Ever Read","B0108VD2L4","B00I6V26GQ"
"How You Can Run Faster Effortlessly","B00HYQEJAK","B078NSV4DY"
"Better Off Dead: A Jack Reacher Novel","B08SBMCSQQ","B000APO0PQ"
"Better Off Dead: A Jack Reacher Novel","B08SBMCSQQ","B08ZL6PLM5"
"Appleseed: A Novel","B08L3P3VGQ","B003ZFUN36"
"Broken Open: Mountains, Demons, Treadmills And a Search for Nirvana","B07N2X3ST6","B076P93L6Z"
"The Lincoln Highway: A Novel","B08WRH53MY","B004MW8MG6"
"The Lions of Lucerne (Scot Harvath Book 1)","B000FC0R7O","B001IO9TO0"
