"Product Name","ASIN","Ownership Type","Ownership Subtype"
"The Thirst: A Harry Hole Novel (Harry Hole Series Book 11)","B01M1FJTB5","Not Interested","GR"
"Blitzed: Drugs in the Third Reich","B01IAS9G94","Not Interested","GR"
"FEAR & LOATHING IN LAS VEGAS : SAVAGE JOURNEY TO HEART OF AMER DREAM","B01BITNA5S","Not Interested","GR"
"Before the Fall","B0196KVVGQ","Not Interested","GR"
"The Stranger by Albert Camus (1989) Paperback","B01181UBSU","Not Interested","GR"
"When Breath Becomes Air: Pulitzer Prize Finalist","B00XSSYR50","Not Interested","GR"
"Not Available","B00L0F018U","Not Interested","GR"
"When Runnning Was Young and So Were We: collected works of a sportswriter from the golden age of American running","B00JX5EWFC","Not Interested","GR"
"Bark: Stories (Vintage Contemporaries)","B00F1W0DWC","Not Interested","GR"
"Trouble Boys: The True Story of the Replacements","B00B3M3VMI","Not Interested","GR"
"The Iliad By Homer Fagles Robert Knox Bernard MacGregor Walker","B00A2KEJ5A","Not Interested","GR"
"Worth Dying For: A Jack Reacher Novel","B009IJ0GSA","Not Interested","GR"
"Deep Down (A Jack Reacher short story) (Jack Reacher Short Stories Book 3)","B008DVVLYW","Not Interested","GR"
"The Enemy - 1st Edition/1st Printing","B007H8WG7S","Not Interested","GR"
"Nickel and Dimed","B0075OQY3Q","Not Interested","GR"
"Othello (Folger Shakespeare Library)","B006U1QW78","Not Interested","GR"
"The Sun Also Rises","B005PYJ9S0","Not Interested","GR"
"Why We Run: A Natural History","B001O7ESCE","Not Interested","GR"
"Vineland","3499136287","Not Interested","GR"
"Hell's Angels","222109073X","Not Interested","GR"
"Not Available","1940056551","Not Interested","GR"
"How Bad Do You Want It?: Mastering the Psychology of Mind over Muscle","1937715418","Not Interested","GR"
"Poverty Creek Journal (Tupelo Press's Life in Art)","193679750X","Not Interested","GR"
"A Hologram for the King","193636574X","Not Interested","GR"
"Heart of Darkness (Green Integer)","1892295490","Not Interested","GR"
"Again to Carthage","1891369776","Not Interested","GR"
"Plato: Crito (Greek Texts)","1853994693","Not Interested","GR"
"The Trip to Echo Spring: Why Writers Drink","1847677940","Not Interested","GR"
"The Corrections","1841156736","Not Interested","GR"
"Cherry","178733094X","Not Interested","GR"
"Ghost Wall","1783784458","Not Interested","GR"
"Ego is the Enemy: The Fight to Master Our Greatest Opponent","1781257027","Not Interested","GR"
"The Way of the Runner: A Journey into the Fabled World of Japanese Running","1681771217","Not Interested","GR"
"Running the Dream: One Summer Living, Training, and Racing with a Team of World-Class Runners Half My Age","164313762X","Not Interested","GR"
"The Rise of the Ultra Runners: A Journey to the Edge of Human Endurance","1643131354","Not Interested","GR"
"The Passion Paradox: A Guide to Going All In, Finding Success, and Discovering the Benefits of an Unbalanced Life","1635653436","Not Interested","GR"
"Milk!: A 10,000-Year Food Fracas","1632863820","Not Interested","GR"
"American Fire: Love, Arson, and Life in a Vanishing Land","1631490516","Not Interested","GR"
"The North Water: A Novel","1627795944","Not Interested","GR"
"Hunter's Moon: A Novel in Stories","162779476X","Not Interested","GR"
"Runner's World Train Smart, Run Forever: How to Become a Fit and Healthy Lifelong Runner by Following The Innovative 7-Hour Workout Week","1623367468","Not Interested","GR"
"My Marathon: Reflections on a Gold Medal Life","1623367247","Not Interested","GR"
"Chasing the Scream: The First and Last Days of the War on Drugs","1620408902","Not Interested","GR"
"Running Is My Therapy: Relieve Stress and Anxiety, Fight Depression, Ditch Bad Habits, and Live Happier","1615194444","Not Interested","GR"
"The Messiah Method: The Seven Disciplines of the Winningest College Soccer Program in America","1613790252","Not Interested","GR"
"Pedestrianism: When Watching People Walk Was America's Favorite Spectator Sport","1613743971","Not Interested","GR"
"Against Football: One Fan's Reluctant Manifesto","161219415X","Not Interested","GR"
"I Swear I'll Make It Up to You: A Life on the Low Road","1610395581","Not Interested","GR"
"Fates and Furies: A Novel","1594634475","Not Interested","GR"
"The Girl on the Train","1594633665","Not Interested","GR"
"The Kite Runner","159463193X","Not Interested","GR"
"The Brief Wondrous Life of Oscar Wao (Pulitzer Prize Winner)","1594489580","Not Interested","GR"
"How Not to Be Wrong: The Power of Mathematical Thinking","1594205221","Not Interested","GR"
"The Poison Squad: One Chemist's Single-Minded Crusade for Food Safety at the Turn of the Twentieth Century","1594205140","Not Interested","GR"
"Redeployment","1594204993","Not Interested","GR"
"Eats, Shoots & Leaves: The Zero Tolerance Approach to Punctuation","1592402038","Not Interested","GR"
"The Sports Gene: Inside the Science of Extraordinary Athletic Performance","1591845114","Not Interested","GR"
"Comfortable with Uncertainty: 108 Teachings on Cultivating Fearlessness and Compassion","1590300785","Not Interested","GR"
"Running with the Buffaloes: A Season Inside with Mark Wetmore, Adam Goucher, and the University of Colorado Men's Cross-Country Team","1585748048","Not Interested","GR"
"Ultramarathon Man: Confessions of an All-Night Runner","1585424803","Not Interested","GR"
"Oedipus Rex: Literary Touchstone Edition","1580495931","Not Interested","GR"
"Today We Die a Little!: The Inimitable Emil Zátopek, the Greatest Olympic Runner of All Time","1568585497","Not Interested","GR"
"Stephen Florida","1566894646","Not Interested","GR"
"Water for Elephants: A Novel","1565125606","Not Interested","GR"
"Wittgenstein's Mistress","1564782115","Not Interested","GR"
"A Christmas Carol (Great Stories)","1561797464","Not Interested","GR"
"The Yellow Wall-Paper","1558611584","Not Interested","GR"
"Royal City Volume 1: Next of Kin","153430262X","Not Interested","GR"
"The Adventures of Alexander Von Humboldt (Pantheon Graphic Library)","1524747378","Not Interested","GR"
"All The Answers","1501166433","Not Interested","GR"
"One of the Boys: A Novel","1501156160","Not Interested","GR"
"Mrs. Fletcher: A Novel","1501144022","Not Interested","GR"
"Zero K: A Novel","1501135392","Not Interested","GR"
"Heartland: A Memoir of Working Hard and Being Broke in the Richest Country on Earth","1501133098","Not Interested","GR"
"Loner: A Novel","1501107895","Not Interested","GR"
"The Happy Runner: Love the Process, Get Faster, Run Longer","1492567647","Not Interested","GR"
"Roughneck","1476773998","Not Interested","GR"
"Racing the Rain: A Novel","1476769869","Not Interested","GR"
"The Mars Room: A Novel","1476756554","Not Interested","GR"
"The Dorito Effect: The Surprising New Truth About Food and Flavor","1476724210","Not Interested","GR"
"The Children's Crusade: A Novel","1476710457","Not Interested","GR"
"Goodbye, Vitamin","1471159485","Not Interested","GR"
"Two Hours: The Quest to Run the Impossible Marathon","145168584X","Not Interested","GR"
"Faster Road Racing: 5K to Half Marathon","1450470459","Not Interested","GR"
"Point Omega: A Novel","1439169950","Not Interested","GR"
"Enter Night: Metallica: The Biography","1409112950","Not Interested","GR"
"Salt Sugar Fat: How the Food Giants Hooked Us","1400069807","Not Interested","GR"
"The Power of Habit: Why We Do What We Do in Life and Business","1400069289","Not Interested","GR"
"Blood, Bones & Butter: The Inadvertent Education of a Reluctant Chef","140006872X","Not Interested","GR"
"Behind the Beautiful Forevers: Life, Death, and Hope in a Mumbai Undercity","1400067553","Not Interested","GR"
"The Thousand Autumns of Jacob De Zoet, A Novel","1400065453","Not Interested","GR"
"The Immortal Life of Henrietta Lacks","1400052173","Not Interested","GR"
"Beloved: Pulitzer Prize Winner","1400033411","Not Interested","GR"
"The Secret History","1400031702","Not Interested","GR"
"African Samurai: The True Story of Yasuke, a Legendary Black Warrior in Feudal Japan","1335007784","Not Interested","GR"
"Maybe You Should Talk To Someone: A Therapist, HER Therapist, and Our Lives Revealed","1328662055","Not Interested","GR"
"Fire and Fury: Inside the Trump White House","1250158060","Not Interested","GR"
"Northmen: The Viking Saga, AD 793-1241","1250106141","Not Interested","GR"
"Marathon Man: My 26.2-Mile Journey from Unknown Grad Student to the Top of the Running World","1250016983","Not Interested","GR"
"The Nix: A novel","110194661X","Not Interested","GR"
"Field Guide To The North American Family","0977985091","Not Interested","GR"
"Running & Being: The Total Experience","0966631803","Not Interested","GR"
"Factotum","0876852630","Not Interested","GR"
"Pre: The Story of America's Greatest Running Legend, Steve Prefontaine","0875964575","Not Interested","GR"
"Pre: The Story of America's Greatest Running Legend, Steve Prefontaine","0875964575","Not Interested","NI"
"Howl and Other Poems (City Lights Pocket Poets Series)","0872863107","Not Interested","GR"
"Black Hawk Down: A Story of Modern War","0871137380","Not Interested","GR"
"10:04: A Novel","0865478104","Not Interested","GR"
"Who Is Rich?: A Novel","0812997980","Not Interested","GR"
"Lake Success: A Novel","0812997417","Not Interested","GR"
"Thunder & Lightning: Weather Past, Present, Future","0812993179","Not Interested","GR"
"The Largesse of the Sea Maiden: Stories","0812988639","Not Interested","GR"
"The Age of Miracles","0812983602","Not Interested","GR"
"The Sorrows of Young Werther (Modern Library Classics)","0812969901","Not Interested","GR"
"Running with Raven: The Amazing Story of One Man, His Passion, and the Community He Inspired","0806538422","Not Interested","GR"
"The Castle","0805211063","Not Interested","GR"
"We Sinners: A Novel","0805095330","Not Interested","GR"
"Being Mortal: Medicine and What Matters in the End","0805095152","Not Interested","GR"
"Night School","0804192979","Not Interested","GR"
"Personal (Jack Reacher)","0804178747","Not Interested","GR"
"The Martian: A Novel","0804139024","Not Interested","GR"
"Olympic Collision: The Story of Mary Decker and Zola Budd","0803290845","Not Interested","GR"
"History of Wolves: A Novel","0802125875","Not Interested","GR"
"Whose Puck Is It, Anyway?: A Season with a Minor Novice Hockey Team","0771007809","Not Interested","GR"
"Run Faster from the 5K to the Marathon: How to Be Your Own Best Coach","0767928229","Not Interested","GR"
"At Home: A Short History of Private Life","0767919386","Not Interested","GR"
"Treasure Island (Kingfisher Classics)","0753453800","Not Interested","GR"
"Barkskins: A Novel","0743288785","Not Interested","GR"
"Benjamin Franklin: An American Life","074325807X","Not Interested","GR"
"Chi Running: A Revolutionary Approach to Effortless, Injury-Free Running","074325144X","Not Interested","GR"
"Chi Running: A Revolutionary Approach to Effortless, Injury-Free Running","074325144X","Not Interested","LR"
"Not Available","0739467352","Not Interested","GR"
"The Parade","0735277524","Not Interested","GR"
"99: Stories of the Game","0735232628","Not Interested","GR"
"You're on an Airplane: A Self-Mythologizing Memoir","0735218196","Not Interested","GR"
"Range: Why Generalists Triumph in a Specialized World","0735214484","Not Interested","GR"
"The Daily Show with Jon Stewart Presents America (The Book): A Citizen's Guide to Democracy Inaction","0713998946","Not Interested","GR"
"The Rum Diary: A Novel","0684856476","Not Interested","GR"
"The Rum Diary: A Novel","0684856476","Not Interested","NI"
"Tender Is the Night (Cover May Vary)","068480154X","Not Interested","GR"
"The Order of Things: An Archaeology of the Human Sciences","0679753354","Not Interested","GR"
"All the Pretty Horses (The Border Trilogy, Book 1)","0679744398","Not Interested","GR"
"Darkness Visible: A Memoir of Madness","0679736395","Not Interested","GR"
"American Psycho","0679735771","Not Interested","GR"
"Notes from Underground (Vintage Classics)","067973452X","Not Interested","GR"
"The Rise & Fall of Great Powers","0679643656","Not Interested","GR"
"The Idiot (Modern Library Classics)","0679642420","Not Interested","GR"
"End Zone","0671820125","Not Interested","GR"
"The Outsiders","0670532576","Not Interested","GR"
"The Girl with the Dragon Tattoo: Book One Of The Millenium Trilogy (Millennium Series)","0670069019","Not Interested","GR"
"A Tale for the Time Being (ALA Notable Books for Adults)","0670026638","Not Interested","GR"
"Every Love Story Is a Ghost Story: A Life of David Foster Wallace","0670025925","Not Interested","GR"
"When the Killing's Done: A Novel","0670022322","Not Interested","GR"
"The Grapes of Wrath: 75th Anniversary Edition","067001690X","Not Interested","GR"
"Extremely Loud And Incredibly Close: A Novel","0618711651","Not Interested","GR"
"The Perfect Mile: Three Athletes, One Goal, and Less Than Four Minutes to Achieve It","0618562095","Not Interested","GR"
"The Devil in the White City: Murder, Magic, and Madness at the Fair That Changed America","0609608444","Not Interested","GR"
"Make Me: 20 (Jack Reacher)","0593073894","Not Interested","GR"
"The Affair","0593065700","Not Interested","GR"
"Gone Tomorrow","0593057058","Not Interested","GR"
"The Unbearable Lightness of Being","0571224385","Not Interested","GR"
"Evicted: Poverty and Profit in the American City","0553447432","Not Interested","GR"
"Weapons of Math Destruction: How Big Data Increases Inequality and Threatens Democracy","0553418815","Not Interested","GR"
"The House of the Spirits: A Novel","0553383809","Not Interested","GR"
"A Brief History of Time","0553380168","Not Interested","GR"
"Journey to the Centre of the Earth (Bantam Classics)","0553213970","Not Interested","GR"
"Eat & Run: My Unlikely Journey to Ultramarathon Greatness","0547569653","Not Interested","GR"
"What If?: Serious Scientific Answers to Absurd Hypothetical Questions","0544272994","Not Interested","GR"
"Stuff Matters: Exploring the Marvelous Materials That Shape Our Man-Made World","0544236041","Not Interested","GR"
"How Not to Die Alone","0525539883","Not Interested","GR"
"Stillness Is the Key","0525538585","Not Interested","GR"
"My Year of Rest and Relaxation: A Novel","0525522131","Not Interested","GR"
"The River: A novel","0525521879","Not Interested","GR"
"The Fault in Our Stars","0525478817","Not Interested","GR"
"Kitchens of the Great Midwest: A Novel","052542914X","Not Interested","GR"
"Killing Floor (Jack Reacher)","0515153656","Not Interested","GR"
"Running Blind (Jack Reacher)","0515143502","Not Interested","GR"
"Tripwire (Jack Reacher)","0515143073","Not Interested","GR"
"Die Trying (Jack Reacher)","0515142247","Not Interested","GR"
"Candide (Dover Thrift Editions)","0486266893","Not Interested","GR"
"Consider the Fork: A History of How We Cook and Eat","046502176X","Not Interested","GR"
"Atlas Shrugged","0452011876","Not Interested","GR"
"Dr. Jekyll & Mr. Hyde (Signet Classics)","0451528956","Not Interested","GR"
"I Am America (And So Can You!)","0446580503","Not Interested","GR"
"One Shot (Jack Reacher, No. 9)","0440246075","Not Interested","GR"
"The Hard Way (Jack Reacher)","0440246008","Not Interested","GR"
"Persuader (Jack Reacher)","0440245982","Not Interested","GR"
"The Call Of The Wild","0439227143","Not Interested","GR"
"Mockingjay (The Hunger Games)","0439023513","Not Interested","GR"
"Catching Fire (The Hunger Games)","0439023491","Not Interested","GR"
"Death of a Salesman","0435233076","Not Interested","GR"
"No Middle Name: The Complete Collected Jack Reacher Short Stories","0399593578","Not Interested","GR"
"Past Tense: A Jack Reacher Novel","0399593519","Not Interested","GR"
"The Midnight Line: A Jack Reacher Novel","0399593489","Not Interested","GR"
"Educated: A Memoir","0399590501","Not Interested","GR"
"Dave Hill Doesn't Live Here Anymore","0399166750","Not Interested","GR"
"Without Fail (Jack Reacher)","0399148612","Not Interested","GR"
"Echo Burning (Jack Reacher, No. 5)","0399147268","Not Interested","GR"
"Will My Cat Eat My Eyeballs?: Big Questions from Tiny Mortals About Death","039365270X","Not Interested","GR"
"The Driest Season: A Novel","0393634590","Not Interested","GR"
"Astrophysics for People in a Hurry","0393609391","Not Interested","GR"
"Good to Go: What the Athlete in All of Us Can Learn from the Strange Science of Recovery","0393357716","Not Interested","GR"
"The Death and Life of the Great Lakes","0393355551","Not Interested","GR"
"The Throwback Special: A Novel","0393353788","Not Interested","GR"
"Fools: Stories","039334889X","Not Interested","GR"
"Brewster: A Novel","0393348830","Not Interested","GR"
"Gulp: Adventures on the Alimentary Canal","0393348741","Not Interested","GR"
"Packing for Mars: The Curious Science of Life in the Void","0393339912","Not Interested","GR"
"The Elegant Universe: Superstrings, Hidden Dimensions, and the Quest for the Ultimate Theory","039333810X","Not Interested","GR"
"The Perfect Storm: A True Story of Men Against the Sea","0393337014","Not Interested","GR"
"Bonk: The Curious Coupling of Science and Sex","0393334791","Not Interested","GR"
"Running to the Edge: A Band of Misfits and the Guru Who Unlocked the Secrets of Speed","0385543743","Not Interested","GR"
"The Underground Railroad (Pulitzer Prize Winner) (National Book Award Winner) (Oprah's Book Club): A Novel","0385542364","Not Interested","GR"
"In the Kingdom of Ice: The Grand and Terrible Polar Voyage of the USS Jeannette","0385535376","Not Interested","GR"
"Love, Dishonor, Marry, Die, Cherish, Perish: A Novel","038553521X","Not Interested","GR"
"Birdseye: The Adventures of a Curious Man","0385527055","Not Interested","GR"
"The Lost City of Z: A Tale of Deadly Obsession in the Amazon","0385513534","Not Interested","GR"
"Station Eleven","0385353308","Not Interested","GR"
"Dept. of Speculation","0385350813","Not Interested","GR"
"The Invention of Nature: Alexander von Humboldt's New World","038535066X","Not Interested","GR"
"The Splendid and the Vile: A Saga of Churchill, Family, and Defiance During the Blitz","0385348711","Not Interested","GR"
"Cure: A Journey into the Science of Mind Over Body","0385348150","Not Interested","GR"
"Dataclysm: Who We Are (When We Think No One's Looking)","0385347375","Not Interested","GR"
"Never Go Back: A Jack Reacher Novel","0385344341","Not Interested","GR"
"61 Hours (Jack Reacher, Book 14)","0385340583","Not Interested","GR"
"Nothing to Lose (Jack Reacher, No. 12)","0385340567","Not Interested","GR"
"Bad Luck and Trouble (Jack Reacher, No. 11)","0385340559","Not Interested","GR"
"American Tabloid","037572737X","Not Interested","GR"
"A Raisin in the Sun","0375508333","Not Interested","GR"
"Rusty Brown (Pantheon Graphic Library)","0375424326","Not Interested","GR"
"The Information: A History, a Theory, a Flood","0375423729","Not Interested","GR"
"The Brothers Karamazov","0374528373","Not Interested","GR"
"Thinking, Fast and Slow","0374275637","Not Interested","GR"
"Severance: A Novel","0374261598","Not Interested","GR"
"Purity: A Novel","0374239215","Not Interested","GR"
"The Marriage Plot: A Novel","0374203059","Not Interested","GR"
"A Manual for Cleaning Women: Selected Stories","0374202397","Not Interested","GR"
"Impossible Owls: Essays","0374175330","Not Interested","GR"
"Freedom: A Novel","0374158460","Not Interested","GR"
"Paris, I Love You but You're Bringing Me Down","0374146683","Not Interested","GR"
"Early Work: A Novel","0374146128","Not Interested","GR"
"Amazing Decisions: The Illustrated Guide to Improving Business Deals and Family Meals","0374103763","Not Interested","GR"
"Me Talk Pretty One Day","0349113912","Not Interested","GR"
"Brief Interviews With Hideous Men","034911188X","Not Interested","GR"
"Weather (Vintage Contemporaries)","0345806905","Not Interested","GR"
"Anna Karenina (Movie Tie-in Edition): Official Tie-in Edition (Vintage Classics)","0345803922","Not Interested","GR"
"Running With the Kenyans: Passion, Adventure, and the Secrets of the Fastest People on Earth","0345528794","Not Interested","GR"
"Ill Will: A Novel","0345476042","Not Interested","GR"
"Not Available","0330369954","Not Interested","GR"
"Guantánamo Diary: Restored Edition","0316517887","Not Interested","GR"
"The Dinner Party: Stories","031646595X","Not Interested","GR"
"North: Finding My Way While Running the Appalachian Trail","0316433799","Not Interested","GR"
"Today Will Be Different","0316403431","Not Interested","GR"
"What Made Maddy Run: The Secret Struggles and Tragic Death of an All-American Teen","0316356549","Not Interested","GR"
"A Calling for Charlie Barnes","0316333530","Not Interested","GR"
"Sweetness #9","0316278777","Not Interested","GR"
"The Recovering: Intoxication and Its Aftermath","0316259616","Not Interested","GR"
"Where'd You Go, Bernadette: A Novel","0316204277","Not Interested","GR"
"The Tale of the Dueling Neurosurgeons: The History of the Human Brain as Revealed by True Stories of Trauma, Madness, and Recovery","0316182346","Not Interested","GR"
"Life After Life: A Novel","0316176486","Not Interested","GR"
"This Bright River: A Novel","0316129313","Not Interested","GR"
"The Goldfinch: A Novel (Pulitzer Prize for Fiction)","0316055433","Not Interested","GR"
"The Unnamed","0316034010","Not Interested","GR"
"Outliers: The Story of Success","0316017922","Not Interested","GR"
"Blink: The Power of Thinking Without Thinking","0316010669","Not Interested","GR"
"Middlesex: A Novel","0312422156","Not Interested","GR"
"Middlesex: A Novel","0312422156","Not Interested","NI"
"The Dog Stars","0307959945","Not Interested","GR"
"You May Also Like: Taste in an Age of Endless Choice","0307958248","Not Interested","GR"
"The Accidental Universe: The World You Thought You Knew","0307908585","Not Interested","GR"
"A Wanted Man: A Jack Reacher Novel","0307749606","Not Interested","GR"
"Natural Born Heroes: How a Daring Band of Misfits Mastered the Lost Secrets of Strength and Endurance","0307594963","Not Interested","GR"
"A Visit from the Goon Squad","0307592839","Not Interested","GR"
"Wild: From Lost to Found on the Pacific Crest Trail","0307592731","Not Interested","GR"
"Gone Girl","0307588378","Not Interested","GR"
"Dead Wake: The Last Crossing of the Lusitania","0307408868","Not Interested","GR"
"Quiet: The Power of Introverts in a World That Can't Stop Talking","0307352145","Not Interested","GR"
"The Road","0307265439","Not Interested","GR"
"Breath: The New Science of a Lost Art","0241289122","Not Interested","GR"
"War and Peace (Oxford World's Classics)","0192833987","Not Interested","GR"
"The Name of the Rose: including the Author's Postscript","0156001314","Not Interested","GR"
"My American Unhappiness","0151013446","Not Interested","GR"
"The Color Purple: A Novel","0143135694","Not Interested","GR"
"The New Me","0143133608","Not Interested","GR"
"Frankenstein: The 1818 Text (Penguin Classics)","0143131842","Not Interested","GR"
"White Noise: (Penguin Orange Collection)","0143129554","Not Interested","GR"
"The Odyssey (Penguin Classics)","0143039954","Not Interested","GR"
"Gravity's Rainbow (Penguin Classics Deluxe Edition)","0143039946","Not Interested","GR"
"The Adventures of Tom Sawyer (Penguin Classics)","0143039563","Not Interested","GR"
"The Scarlet Letter","0142437263","Not Interested","GR"
"Moby-Dick or, The Whale (Penguin Classics)","0142437247","Not Interested","GR"
"Cannery Row: (Centennial Edition)","014200068X","Not Interested","GR"
"East of Eden (Oprah Book Club Series)","0142000655","Not Interested","GR"
"A Tale of Two Cities (Penguin Classics)","0141439602","Not Interested","GR"
"Prisoner of Zenda, the (Penguin Popular Classics)","0140621318","Not Interested","GR"
"The Count of Monte Cristo (Penguin Classics)","0140449264","Not Interested","GR"
"The Red and the Black (Penguin Classics)","0140447644","Not Interested","GR"
"The Recognitions (Penguin Classics)","0140187081","Not Interested","GR"
"The Recognitions (Penguin Classics)","0140187081","Not Interested","NI"
"A Farewell To Arms","0099910101","Not Interested","GR"
"Who Moved My Cheese","0091883768","Not Interested","GR"
"The Relive Box and Other Stories","0062673394","Not Interested","GR"
"Commonwealth","0062491792","Not Interested","GR"
"Notorious RBG: The Life and Times of Ruth Bader Ginsburg","0062415832","Not Interested","GR"
"The Harder They Come: A Novel","0062390716","Not Interested","GR"
"Capture: Unraveling the Mystery of Mental Suffering","0062388517","Not Interested","GR"
"The Weather Machine: A Journey Inside the Forecast","0062368613","Not Interested","GR"
"The Terranauts: A Novel","0062349406","Not Interested","GR"
"Sapiens: A Brief History of Humankind","0062316117","Not Interested","GR"
"Beautiful Ruins: A Novel","0061928127","Not Interested","GR"
"We Live in Water: Stories","0061926620","Not Interested","GR"
"The Financial Lives of the Poets","0061916048","Not Interested","GR"
"Radioactive: Marie & Pierre Curie: A Tale of Love and Fallout","0061351326","Not Interested","GR"
"Savage Inequalities: Children in America's Schools","0060974990","Not Interested","GR"
"Kitchen Confidential Updated Edition: Adventures in the Culinary Underbelly (P.S.)","0060899220","Not Interested","GR"
"Genome: The Autobiography of a Species in 23 Chapters","0060894083","Not Interested","GR"
"Billy Lynn's Long Halftime Walk: A Novel","0060885599","Not Interested","GR"
"The Professor and the Madman: A Tale of Murder, Insanity, and the Making of the Oxford English Dictionary","0060839783","Not Interested","GR"
"Fast Food Nation: The Dark Side of the All-American Meal","0060838582","Not Interested","GR"
"Zen and the Art of Motorcycle Maintenance: An Inquiry into Values","0060589469","Not Interested","GR"
