"Product Name","ASIN","Ownership Type","Ownership Subtype"
"A Place of My Own: The Education of an Amateur Builder","0385319908","Not Interested","NI"
"I Feel Bad About My Neck: And Other Thoughts on Being a Woman","0307264556","Not Interested","NI"
"The Tulip: The Story of the Flower That Has Made Men Mad","1582340137","Not Interested","NI"
"Fermat's Enigma: The Epic Quest to Solve the World's Greatest Mathematical Problem","0385493622","Not Interested","GR"
"The Omnivore's Dilemma: A Natural History of Four Meals","1594200823","Not Interested","GR"
"Heat: An Amateur's Adventures as Kitchen Slave, Line Cook, Pasta-Maker, and Apprentice to a Dante-Quoting Butcher in Tuscany","1400041201","Not Interested","GR"
"A Photographer's Life: 1990-2005","0375505091","Not Interested","NI"
"Kate: The Woman Who Was Hepburn","0805076255","Not Interested","NI"
"Queen of Fashion: What Marie Antoinette Wore to the Revolution","0805079491","Not Interested","NI"
"Setting the Table: The Transforming Power of Hospitality in Business","0060742755","Not Interested","NI"
"Zero: The Biography of a Dangerous Idea","0140296476","Not Interested","LR"
"Bowerman and the Men of Oregon (The Story of Oregon's Legendary Coach & Nikes Co-founder)","1594861900","Not Interested","GR"
"Camping Made Easy (Made Easy Series)","0762707496","Not Interested","NI"
"The Triathlete's Training Bible","1931382425","Not Interested","NI"
"The Force of Reason","0847827534","Not Interested","NI"
"Olivia Helps with Christmas","1416907866","Not Interested","NI"
"Olivia Forms a Band","141692454X","Not Interested","NI"
"The Complete New Yorker: Eighty Years of the Nation's Greatest Magazine (Book & 8 DVD-ROMs)","1400064740","Not Interested","NI"
"Food Court Druids, Cherohonkees and Other Creatures Unique to the Republic","0452285623","Not Interested","LR"
"The End of Poverty: Economic Possibilities for Our Time","1594200459","Not Interested","NI"
"Radio On: A Listener's Diary","0312183011","Not Interested","NI"
"Death's Acre: Inside the Legendary Forensic Lab, The Body Farm, Where the Dead Do Tell Tales (includes 16 pages of B&W photos)","0399151346","Not Interested","NI"
"Walls and Mirrors: Mexican Americans, Mexican Immigrants, and the Politics of Ethnicity","0520202198","Not Interested","NI"
"What the Corpse Revealed","0312975732","Not Interested","NI"
"Dead Men Do Tell Tales: The Strange and Fascinating Cases of a Forensic Anthropologist","0385479689","Not Interested","NI"
"Mix Tape: The Art of Cassette Culture","0789311992","Not Interested","NI"
"Chance: A Guide to Gambling, Love, the Stock Market, and Just About Everything Else","1568583168","Not Interested","NI"
"Brown Bear, Brown Bear, What Do You See?","0805047905","Not Interested","NI"
"A Werewolf Problem in Central Russia and Other Stories","0811215431","Not Interested","NI"
"Counting Kisses: A Kiss & Read Book","068985658X","Not Interested","NI"
"Here's Your Hat What's Your Hurry: Stories","0380730790","Not Interested","NI"
"How Do Dinosaurs Eat Their Food?","0439241022","Not Interested","NI"
"The Hipster Handbook","1400032016","Not Interested","NI"
"Pendulum : Leon Foucault and the Triumph of Science","B0009W8ARE","Not Interested","NI"
"Entanglement","0452284570","Not Interested","NI"
"The Mystery of the Aleph: Mathematics, the Kabbalah, and the Search for Infinity","0743422996","Not Interested","NI"
"God's Equation: Einstein, Relativity, and the Expanding Universe","0385334850","Not Interested","NI"
"Not Available","B000EGF0Q4","Not Interested","NI"
"Baseball Prospectus 2006: The BP Team of Experts on Baseball Talent","0761139958","Not Interested","NI"
"Next Man Up: A Year Behind the Lines in Today's NFL","0316009644","Not Interested","NI"
"Idiot: Beating ""The Curse"" and Enjoying the Game of Life","030723763X","Not Interested","NI"
"A Tale of Two Cities: The 2004 Yankees-Red Sox Rivalry And The War For The Pennant","1592287042","Not Interested","NI"
"Mind Game: How the Boston Red Sox Got Smart, Won a World Series, and Created a New Blueprint for Winning","0761140182","Not Interested","NI"
"Loose Balls","0671749218","Not Interested","NI"
"The Last Shot: City Streets, Basketball Dreams","0618446710","Not Interested","NI"
"The Created Self: Reinventing Body, Persona, Spirit","0393321215","Not Interested","NI"
"50,001 Best Baby Names","1402204981","Not Interested","NI"
"The Best Baby Name Book in the Whole Wide World","0671544632","Not Interested","NI"
"20,001 Names For Baby","0380762277","Not Interested","NI"
"The Pregnancy Bible: Your Complete Guide to Pregnancy and Early Parenthood","155297796X","Not Interested","NI"
"First Cut: A Season in the Human Anatomy Lab","031219546X","Not Interested","NI"
"The Baby Book: Everything You Need to Know About Your Baby from Birth to Age Two (Revised and Updated Edition)","0316778001","Not Interested","NI"
"From First Kicks to First Steps : Nurturing Your Baby's Development from Pregnancy Through the First Year of Life","0071427864","Not Interested","NI"
"Dream Big (Olivia)","0740758187","Not Interested","NI"
"Mesmerism and the End of the Enlightenment in France","0674569512","Not Interested","NI"
"The Pregnancy Book: Month-by-Month, Everything You Need to Know From America's Baby Experts","0316779148","Not Interested","NI"
"MAYO CLINIC GUIDE TO A HEALTHY PREGNANCY","0060746378","Not Interested","NI"
"What to Expect: Eating Well When You're Expecting","0761133267","Not Interested","NI"
"The Man Who Knew Too Much: Alan Turing and the Invention of the Computer (Great Discoveries)","0393052362","Not Interested","NI"
"The Principia : Mathematical Principles of Natural Philosophy","0520088174","Not Interested","NI"
"The Flight of the Iguana: A Sidelong View of Science and Nature","0684836262","Not Interested","NI"
"Infinity: The Quest to Think the Unthinkable","0786712856","Not Interested","NI"
"Encyclopedia Prehistorica Dinosaurs : The Definitive Pop-Up","0763622281","Not Interested","NI"
"Ghosts of Manila: The Fateful Blood Feud Between Muhammad Ali and Joe Frazier","0060954809","Not Interested","NI"
"A Million Little Pieces","0307276902","Not Interested","NI"
"The Dirt: Confessions of the World's Most Notorious Rock Band","0060989157","Not Interested","NI"
"Newton's Gift: How Sir Isaac Newton Unlocked the System of the World","0743217764","Not Interested","NI"
"The Education of a Coach","1401301541","Not Interested","NI"
"The Life of Isaac Newton (Canto original series)","0521477379","Not Interested","NI"
"Spook: Science Tackles the Afterlife","0393059626","Not Interested","NI"
"E=mc2: A Biography of the World's Most Famous Equation","0425181642","Not Interested","NI"
"Toes, Ears, & Nose! A Lift-the-Flap Book","0689847122","Not Interested","NI"
"How I Became a Pirate","0152018484","Not Interested","NI"
"The Riddle and the Knight: In Search of Sir John Mandeville, the World's Greatest Traveller","031242129X","Not Interested","NI"
"Knuffle Bunny: A Cautionary Tale","0786818700","Not Interested","NI"
"The Red Book: A Caldecott Honor Award Winner (Caldecott Honor Book)","0618428585","Not Interested","NI"
"Kitten's First Full Moon","0060588284","Not Interested","NI"
"Olivia . . . and the Missing Toy","0689852916","Not Interested","NI"
"Olivia Saves the Circus","068982954X","Not Interested","NI"
"Olivia","0689829531","Not Interested","NI"
"The Mind Has No Sex?: Women in the Origins of Modern Science","067457625X","Not Interested","NI"
"Prostitution and Victorian Society: Women, Class, and the State","0521270642","Not Interested","NI"
"The Undercover Economist: Exposing Why the Rich Are Rich, the Poor Are Poor--and Why You Can Never Buy a Decent Used Car!","0195189779","Not Interested","NI"
"Dead Reckoning: The New Science of Catching Killers","0684852713","Not Interested","NI"
"The Politically Incorrect Guide to Islam (and the Crusades)","0895260131","Not Interested","NI"
"What Just Happened: A Chronicle from the Information Frontier","0375713913","Not Interested","NI"
"Faster: The Acceleration of Just About Everything","067977548X","Not Interested","NI"
"Corpse: Nature, Forensics, And The Struggle To Pinpoint Time Of Death","0738207713","Not Interested","NI"
"Unnatural Death: Confessions of a Medical Examiner","0804105995","Not Interested","NI"
"The Potato: How the Humble Spud Rescued the Western World","0865475784","Not Interested","NI"
"Bananas: An American History","1560989661","Not Interested","NI"
"The True History of Chocolate","0500282293","Not Interested","NI"
"1776","0743226712","Not Interested","NI"
"Consider the Lobster: And Other Essays","0316156116","Not Interested","GR"
"The Great Gatsby: The Only Authorized Edition","0743273567","Not Interested","GR"
"Olivia's Opposites","0689850883","Item Owner","Purchase"
"Olivia Counts","0689850875","Item Owner","Purchase"
"Diary of a Spider","0060001534","Item Owner","Purchase"
"Diary of a Worm","006000150X","Item Owner","Purchase"
"Three Uses of the Knife: On the Nature and Purpose of Drama","037570423X","Not Interested","NI"
"I Am Charlotte Simmons: A Novel","0374281580","Not Interested","NI"
"Naked Lunch","0802132952","Not Interested","LR"
"The Planets","0670034460","Not Interested","NI"
"The Longitude Prize","0374346364","Not Interested","NI"
"The Measure of All Things: The Seven-Year Odyssey and Hidden Error That Transformed the World","0743216768","Not Interested","NI"
"The Pencil: A History of Design and Circumstance","0679734155","Not Interested","NI"
"The Pirate Coast: Thomas Jefferson, the First Marines, and the Secret Mission of 1805","1401300030","Not Interested","NI"
"The Great American Detox Diet: 8 Weeks to Weight Loss and Well-Being","1594862311","Not Interested","NI"
"Don't Eat This Book","0399152601","Not Interested","NI"
"The Everything Pregnancy Organizer (Everything)","1580623360","Not Interested","NI"
"The Girlfriends' Guide to Pregnancy: Or everything your doctor won't tell you","0671524313","Not Interested","NI"
"What to Expect Pregnancy Planner","0761127453","Not Interested","NI"
"Belly Laughs: The Naked Truth About Pregnancy And Childbirth","073820949X","Not Interested","NI"
"What to Expect When You're Expecting: What to Expect the First Year : Gift","0761134603","Not Interested","NI"
"The Pregnancy Journal; A Day-To-Day Guide to a Healthy and Happy Pregnancy","0811811565","Not Interested","NI"
"What to Expect the First Year, Second Edition","0761129588","Not Interested","NI"
"The Mother of all Pregnancy Books (Mother of All, 8)","0764565168","Not Interested","NI"
"What To Expect When Your Wife Is Expanding","0836280180","Not Interested","NI"
"Your Pregnancy Week By Week, 5th Edition (Your Pregnancy Series)","1555613462","Not Interested","NI"
"Annapurna, First Conquest of an 8000-Meter Peak: (26,493 Feet)","1558215492","Not Interested","NI"
"Under the Black Flag: The Romance and the Reality of Life Among the Pirates (Harvest Book)","0156005492","Not Interested","NI"
"God on the Starting Line: The Triumph of a Catholic School Running Team and Its Jewish Coach (Working Classics)","1891369539","Not Interested","NI"
"Between a Rock and a Hard Place","0743492811","Not Interested","NI"
"Annapurna: A Woman's Place","1578050227","Not Interested","NI"
"Ultramarathon Man: Confessions of an All-Night Runner","1585422789","Not Interested","LR"
"A General History of the Pyrates (Dover Maritime)","0486404889","Not Interested","NI"
"Taken for a Ride: How Daimler-Benz Drove Off With Chrysler","0060934484","Not Interested","NI"
"In the Wake of Madness: The Murderous Voyage of the Whaleship Sharon","1565123476","Not Interested","NI"
"The Mountain Meadows Massacre","0806123184","Not Interested","NI"
"Chicano! the History of the Mexican American Civil Rights Movement (Hispanic Civil Rights)","1558852018","Not Interested","NI"
"The Prince (Bantam Classics)","0553212788","Not Interested","NI"
"Becoming Mexican American: Ethnicity, Culture, and Identity in Chicano Los Angeles, 1900-1945","0195096487","Not Interested","NI"
"Brave New World & Brave New World Revisited","0060901012","Not Interested","NI"
"From Out of the Shadows: Mexican Women in Twentieth-Century America","0195130995","Not Interested","NI"
"Albion's Seed: Four British Folkways in America (America: a cultural history) (VOLUME I)","0195069056","Not Interested","NI"
"Thirteen Days: A Memoir of the Cuban Missile Crisis","0393318346","Not Interested","NI"
"Zen and the Art of Motorcycle Maintenance: An Inquiry into Values","0060958324","Not Interested","NI"
"The World Is Flat: A Brief History of the Twenty-first Century","0374292884","Not Interested","NI"
"One Good Turn: A Natural History of the Screwdriver and the Screw","0684867303","Not Interested","NI"
"My Boys Can Swim!: The Official Guy's Guide to Pregnancy","0761521674","Not Interested","NI"
"The Expectant Father: Facts, Tips and Advice for Dads-to-Be, Second Edition","0789205386","Not Interested","NI"
"Crossworld: One Man's Journey into America's Crossword Obsession","076791757X","Not Interested","NI"
"American Crown: The Misadventures of Prince Johnny Washington-Bourbon","0595670830","Not Interested","NI"
"Lolita","0739322060","Not Interested","NI"
"YOU: The Owner's Manual","0060765313","Not Interested","NI"
"The Official Scrabble Players Dictionary","0877799296","Not Interested","NI"
"Everything Bad Is Good for You: How Today's Popular Culture Is Actually Making Us Smarter","1573223077","Not Interested","LR"
"What to Expect When You're Expecting Pregnancy Organizer","1563058723","Item Owner","Purchase"
"What to Expect When You're Expecting","0761121323","Item Owner","Purchase"
"Daniels' Running Formula - 2nd Edition","0736054928","Item Owner","Purchase"
"Nathaniel's Nutmeg (Turtleback School & Library Binding Edition)","0613365445","Not Interested","NI"
"Ordinary Men: Reserve Police Battalion 101 and the Final Solution in Poland","0060995068","Not Interested","NI"
"The Last Place on Earth: Scott and Amundsen's Race to the South Pole, Revised and Updated (Modern Library Exploration)","0375754741","Not Interested","NI"
"When Victims Become Killers: Colonialism, Nativism, and the Genocide in Rwanda","0691102805","Not Interested","NI"
"The Graves Are Not Yet Full: Race, Tribe and Power in the Heart of America","0465006426","Not Interested","NI"
"The Troubled Heart of Africa: A History of the Congo","0312304862","Not Interested","NI"
"In the Footsteps of Mr. Kurtz: Living on the Brink of Disaster in Mobutu's Congo","0060934433","Not Interested","NI"
"Songs of the Doomed: More Notes on the Death of the American Dream","0743240995","Not Interested","NI"
"Skeletons on the Zahara: A True Story of Survival","0316835145","Not Interested","NI"
"One Man's Wilderness: An Alaskan Odyssey","0882405136","Not Interested","NI"
"The Lavender Scare: The Cold War Persecution of Gays and Lesbians in the Federal Government","0226404811","Not Interested","NI"
"A Continent for the Taking: The Tragedy and Hope of Africa","0375414614","Not Interested","NI"
"Everything Scrabble","0671042181","Not Interested","NI"
"The Official Scrabble Page-A-Day Calendar 2005","0761133836","Not Interested","NI"
"The Official Scrabble Puzzle Book","0671569007","Not Interested","NI"
"Three Novels: Molloy, Malone Dies, The Unnamable (Beckett, Samuel)","0802150918","Not Interested","NI"
"Meditations in Green","0375712933","Not Interested","NI"
"Second Skin","0811200671","Not Interested","NI"
"The Essential Iliad","0872205428","Not Interested","NI"
"Lady Oracle","0385491085","Not Interested","NI"
"Moby-Dick (Bantam Classics)","0553213113","Not Interested","NI"
"The Edible Woman","0385491069","Not Interested","NI"
"Candide: Or Optimism (Penguin Classics)","0140440046","Not Interested","NI"
"The Sorrow of War: A Novel of North Vietnam","1573225436","Not Interested","NI"
"Adult Head","193202316X","Not Interested","NI"
"Vanity of Duluoz: An Adventurous Education, 1935-46","0140236392","Not Interested","LR"
"Satori in Paris (Kerouac, Jack)","0802130615","Not Interested","LR"
"Visions of Gerard: A Novel","0140144528","Not Interested","LR"
"Skinny Dip","0375411089","Not Interested","NI"
"Alias Grace: A Novel","0385490445","Not Interested","NI"
"Facing the Congo: A Modern-Day Journey into the Heart of Darkness","0609808265","Not Interested","NI"
"Shackleton's Forgotten Expedition: The Voyage of the Nimrod","1582344884","Not Interested","NI"
"The Selfish Gene (Popular Science)","0192860925","Not Interested","NI"
"Bittersweet: The Story of Sugar","1865086576","Not Interested","NI"
"A Problem from Hell: America and the Age of Genocide","0060541644","Not Interested","NI"
"The Scramble for Africa: White Man's Conquest of the Dark Continent from 1876 to 1912","0380719991","Not Interested","NI"
"Away Off Shore: Nantucket Island and Its People","0963891014","Not Interested","NI"
"The Congo from Leopold to Kabila: A People's History","1842770535","Not Interested","NI"
"The Histories","0140449086","Not Interested","NI"
"Paris 1919: Six Months That Changed the World","0375760520","Not Interested","NI"
"Plagues and Peoples","0385121229","Not Interested","NI"
"Dispatches","0679735259","Not Interested","NI"
"The Boys on the Bus","0812968204","Not Interested","NI"
"In Search of the Trojan War, Updated edition","0520215990","Not Interested","NI"
"History of the Peloponnesian War","0140440399","Not Interested","NI"
"Bury the Chains: Prophets and Rebels in the Fight to Free an Empire's Slaves","0618104690","Not Interested","NI"
"Maggie Cassidy","0140179062","Not Interested","LR"
"Kaddish and Other Poems, 1958-1960","0872860191","Not Interested","LR"
"Lonesome Traveler (Kerouac, Jack)","0802130747","Not Interested","LR"
"One Day in the Life of Ivan Denisovich (Signet Classics)","0451527097","Not Interested","NI"
"Subterraneans (Kerouac, Jack)","0802131867","Not Interested","LR"
"Junky: The Definitive Text of ""Junk"" (50th Anniversary Edition)","0142003166","Not Interested","GR"
"Junky: The Definitive Text of ""Junk"" (50th Anniversary Edition)","0142003166","Not Interested","LR"
"Big Sur","0140168125","Not Interested","GR"
"night, Mother: A Play (Mermaid Dramabook)","0374521387","Not Interested","NI"
"The Aeneid of Virgil (Bantam Classics)","0553210416","Not Interested","NI"
"Women with Men : Three Stories","0679776680","Not Interested","LR"
"Rock Springs","0394757009","Not Interested","NI"
"The Known World: A Novel","0060557559","Not Interested","NI"
"Beowulf: A New Verse Translation (Bilingual Edition)","0393320979","Not Interested","NI"
"Cat's Eye","0385491026","Not Interested","NI"
"The Tempest (Folger Shakespeare Library)","0743482832","Not Interested","NI"
"Daisy Miller (Penguin Classics)","0140432620","Not Interested","LR"
"As You Like It (Folger Shakespeare Library)","074348486X","Not Interested","NI"
"Pride and Prejudice (Bantam Classics)","0553213105","Not Interested","NI"
"Invitation to a Beheading","0679725318","Not Interested","NI"
"On the Road (Penguin Orange Collection)","0140042598","Not Interested","GR"
"Long Day's Journey into Night","0300093055","Not Interested","NI"
"Who's Afraid of Virginia Woolf?","0451158717","Not Interested","NI"
"Twelfth Night (Folger Shakespeare Library)","0743482778","Not Interested","NI"
"The Merchant of Venice (Folger Shakespeare Library)","0743477561","Not Interested","NI"
"Wuthering Heights (Bantam Classics)","0553212583","Not Interested","NI"
"The Nuclear Age","0140259104","Not Interested","NI"
"Much Ado About Nothing (Folger Shakespeare Library)","0743482751","Not Interested","NI"
"July, July","0142003387","Not Interested","NI"
"Northern Lights: A Novel","0767904419","Not Interested","NI"
"King Lear (Folger Shakespeare Library)","074348276X","Not Interested","NI"
"Macbeth (Folger Shakespeare Library)","0743477103","Not Interested","NI"
"Screwjack: A Short Story","0684873214","Not Interested","NI"
"Hey Rube: Blood Sport, the Bush Doctrine, and the Downward Spiral of Dumbness--Modern History from the Sports Desk","0684873192","Not Interested","NI"
"The Revolt of the Cockroach People","0679722122","Not Interested","NI"
"Autobiography of a Brown Buffalo","0679722130","Not Interested","NI"
"Fear and Loathing in Las Vegas and Other American Stories (Modern Library)","0679602984","Not Interested","NI"
"Generation of Swine: The Brutal Odyssey of an Outlaw Journalist","0743250443","Not Interested","NI"
"The Proud Highway: Saga of a Desperate Southern Gentleman, 1955-1967 (The Fear and Loathing Letters, Vol. 1)","0345377966","Not Interested","NI"
"Kingdom of Fear: Loathsome Secrets of a Star-Crossed Child in the Final Days of the American Century","0684873249","Not Interested","NI"
"Will in the World: How Shakespeare Became Shakespeare","0393050572","Not Interested","LR"
"My Movie Business: A Memoir","0345441303","Not Interested","NI"
"So You Wanna Be a Rock & Roll Star: How I Machine-Gunned a Roomful Of Record Executives and Other True Tales from a Drummer's Life","0767914708","Not Interested","NI"
"When Heaven and Earth Changed Places (Tie-In Edition)","0452271681","Not Interested","NI"
"Bound for Glory: The Hard-Driving, Truth-Telling, Autobiography of America's Great Poet-Folk Singer","0452264456","Not Interested","NI"
"No Other Road to Take: The Memoirs of Mrs. Nguyen Thi Dinh","087727102X","Not Interested","NI"
"The Wisdom of the Buddha (Abrams Discoveries)","0810928078","Not Interested","NI"
"The Assassination of Lumumba","1859844103","Not Interested","NI"
"Big Deal","0349115192","Not Interested","NI"
"The Anthrax Letters: A Medical Detective Story","030908881X","Not Interested","NI"
"Candyfreak: A Journey through the Chocolate Underbelly of America","1565124219","Not Interested","NI"
"Mind Wide Open: Your Brain and the Neuroscience of Everyday Life","0743241657","Not Interested","NI"
"The Fabric of the Cosmos: Space, Time, and the Texture of Reality","0375412883","Not Interested","NI"
"Mama Lola: A Vodou Priestess in Brooklyn Updated and Expanded Edition (Comparative Studies in Religion and Society)","0520224752","Not Interested","NI"
"African Perspectives on Colonialism (The Johns Hopkins Symposia in Comparative History)","0801839319","Not Interested","NI"
"One Stick Song","1882413768","Not Interested","NI"
"Herland (Dover Thrift Editions: Classic Novels)","0486404293","Not Interested","NI"
"Plato: Complete Works","0872203492","Not Interested","NI"
"Poetics (Dover Thrift Editions: Philosophy)","048629577X","Not Interested","NI"
"Mythology: Timeless Tales of Gods and Heroes","0446607258","Not Interested","NI"
"Slouching Towards Bethlehem: Essays","0374521727","Not Interested","NI"
"My Soul Is Rested: The Story of the Civil Rights Movement in the Deep South","0140067531","Not Interested","NI"
"Mark Lombardi: Global Networks","0916365670","Not Interested","NI"
"Utopia (Dover Thrift Editions: Philosophy)","0486295834","Not Interested","NI"
"Always Running: La Vida Loca: Gang Days in L.A.","0671882317","Not Interested","NI"
"The Leadership Secrets of Colin Powell","0071388591","Not Interested","NI"
"The Influentials: One American in Ten Tells the Other Nine How to Vote, Where to Eat, and What to Buy","0743227298","Not Interested","NI"
"The Merriam-Webster Dictionary","087779930X","Not Interested","NI"
"Count Down: Six Kids Vie for Glory at the World's Toughest Math Competition","0618251413","Not Interested","NI"
"The College Writer's Reference","0131787306","Not Interested","NI"
"We Wish to Inform You That Tomorrow We Will be Killed With Our Families: Stories from Rwanda","0312243359","Not Interested","NI"
"The Future of Ideas: The Fate of the Commons in a Connected World","0375726446","Not Interested","NI"
"Mythology","0316341517","Not Interested","NI"
"The Bhagavad-Gita : Krishna's Counsel in Time of War (Bantam Classics)","0553213652","Not Interested","NI"
"Zhuangzi Speaks: The Music of Nature","0691008825","Not Interested","NI"
"The Wealth and Poverty of Nations: Why Some Are So Rich and Some So Poor","0393318885","Not Interested","NI"
"Why Is Sex Fun?: The Evolution of Human Sexuality (Science Masters)","0465031269","Not Interested","NI"
"Third Chimpanzee, The","0060984031","Not Interested","NI"
"The Republic (Dover Thrift Editions: Philosophy)","0486411214","Not Interested","NI"
"The Wisdom of Crowds: Why the Many Are Smarter Than the Few and How Collective Wisdom Shapes Business, Economies, Societies and Nations","0385503865","Not Interested","NI"
"Scrabble Word Building Book","0671734563","Not Interested","NI"
"Reading Lolita in Tehran: A Memoir in Books","081297106X","Not Interested","NI"
"A Short History of Nearly Everything","076790818X","Not Interested","GR"
"Chaos: Making a New Science","0140092501","Not Interested","NI"
"Ebola: Through the Eyes of the People","0970337116","Not Interested","NI"
"Secret Agents: The Menace of Emerging Infections","0142002615","Not Interested","NI"
"Betrayal of Trust: The Collapse of Global Public Health","0786884401","Not Interested","NI"
"Dinosaur Friends!","1929927207","Not Interested","NI"
"First Light: The Search for the Edge of the Universe","0812991850","Not Interested","NI"
"The Coming Plague: Newly Emerging Diseases in a World Out of Balance","0140250913","Not Interested","NI"
"Mrs. Chippy's Last Expedition: The Remarkable Journal of Shackleton's Polar-Bound Cat","0060932619","Not Interested","NI"
"Dinosaur Stomp!","0525455914","Not Interested","NI"
"Out of Control: The New Biology of Machines, Social Systems, & the Economic World","0201483408","Not Interested","NI"
"DINOSAUR WORLD","0679882014","Not Interested","NI"
"Small Worlds: The Dynamics of Networks between Order and Randomness (Princeton Studies in Complexity)","0691117047","Not Interested","NI"
"Big Book of Dinosaurs","1564587185","Not Interested","NI"
