"Product Name","ASIN","Ownership Type","Ownership Subtype"
"ANGELA S ASHES PB","0007205236","Not Interested","GR"
"One Summer: America, 1927","B00C8S9VKM","Item Owner","PublicLibraryLending"
"Not Available","B0DWTVHT8T","Not Interested","GR"
"Not Available","B0D7LQMF4N","Not Interested","GR"
"Anne Frank: The Diary of a Young Girl By Anne Frank","B007Z332A0","Not Interested","GR"
"Fahrenheit 451: A Novel","B0064CPN7I","Not Interested","GR"
"The Silence: A Novel","1982164557","Not Interested","GR"
"The Finisher (A Detective Peter Diamond Mystery)","1641291818","Not Interested","GR"
"Belfry Hockey","1629378011","Not Interested","GR"
"We Ride Upon Sticks: A Novel","1524748099","Not Interested","GR"
"Exercised: Why Something We Never Evolved to Do Is Healthy and Rewarding","1524746983","Not Interested","GR"
"All the Light We Cannot See","1476746583","Not Interested","GR"
"Unbroken: A World War II Story of Survival, Resilience, and Redemption","1400064163","Not Interested","GR"
"Project Hail Mary: A Novel","0593135202","Not Interested","GR"
"The Hunger Games","0439023483","Not Interested","GR"
"A Children's Bible: A Novel","0393867382","Not Interested","GR"
"A Clockwork Orange","0393341763","Not Interested","GR"
"Pizza Girl: A Novel","038554572X","Not Interested","GR"
"The Catcher in the Rye","0316769177","Not Interested","GR"
"Nick","0316529761","Not Interested","GR"
"Of Mice and Men (Steinbeck Centennial Edition)","0142000671","Not Interested","GR"
"Lord of the Flies (Penguin Great Books of the 20th Century)","0140283331","Not Interested","GR"
"Wobble to Death","0140055576","Not Interested","GR"
"Leave the World Behind: A Read with Jenna Pick","0062667637","Not Interested","GR"
"To Kill a Mockingbird","0060935464","Not Interested","GR"
"The Finisher (A Detective Peter Diamond Mystery Book 19)","B081Y4J7LD","Item Owner","PublicLibraryLending"
"Transcendent Kingdom: A Read with Jenna Pick: A novel","B07ZC6W6SV","Item Owner","PublicLibraryLending"
"Sprinting Through No Man's Land: Endurance, Tragedy, and Rebirth in the 1919 Tour de France","B08DHSFM4Q","Not Interested","RC"
"You Never Forget Your First: A Biography of George Washington","B07TPFTG1S","Item Owner","PublicLibraryLending"
"Leave the World Behind: A Read with Jenna Pick","B083JKGK15","Item Owner","PublicLibraryLending"
"The Office of Historical Corrections: A Novella and Stories","B084V823SR","Item Owner","PublicLibraryLending"
"The Kingdom: A novel","B08478T2CK","Item Owner","PublicLibraryLending"
"A Children's Bible: A Novel","B07ZTTH5VD","Item Owner","PublicLibraryLending"
"Pizza Girl: A Novel","B07YRWHGYD","Item Owner","PublicLibraryLending"
"Interior Chinatown: A Novel (National Book Award Winner)","B07R5KC59C","Item Owner","PublicLibraryLending"
"I Am Malala: The Girl Who Stood Up for Education and Was Shot by the Taliban","B00CH3DBNQ","Item Owner","PublicLibraryLending"
"The Power Within: Discovering the Path to Elite Goaltending","B00O2RPEE4","Item Owner","KindleUnlimited"
"It's Not About You: A Brief Guide to a Meaningful Life","B082BHDYWS","Item Owner","KindleUnlimited"
"It's Not About You: A Brief Guide to a Meaningful Life","B07YXSLVX7","Item Owner","KindleUnlimited"
"This Van Could Be Your Life","B082BJMVKR","Item Owner","KindleUnlimited"
"This Van Could Be Your Life","B07YXS82KD","Item Owner","KindleUnlimited"
"Practical Stoicism: Exercises for Doing the Right Thing Right Now","B0764BV94D","Item Owner","KindleUnlimited"
"366 Stoic Quotes: A Year Of Stoicism From Ancient And Modern Stoics - A Daily Guide Of Stoic Meditations","B081ZXQB52","Item Owner","KindleUnlimited"
"When We Were Vikings","B07THQLGBT","Item Owner","PublicLibraryLending"
"The Glass Hotel: A novel","B07RL58ZDG","Not Interested","RC"
"Hamnet","B07ZN51NL3","Item Owner","PublicLibraryLending"
"The China Study Quick & Easy Cookbook: Cook Once, Eat All Week with Whole Food, Plant-Based Recipes","B00U27BMT4","Item Owner","PublicLibraryLending"
"A Journal of the Plague Year, written by a citizen who continued all the while in London","B0084B57VO","Item Owner","PublicLibraryLending"
"The Pull of the Stars: A Novel","B086JN68M6","Item Owner","PublicLibraryLending"
"The Darwin Affair: A Novel","B07GNX99VJ","Item Owner","PublicLibraryLending"
"Blue Moon: A Jack Reacher Novel","B07NCNVZ5P","Item Owner","PublicLibraryLending"
"Worth Dying For: A Jack Reacher Novel","B003EY7IWC","Item Owner","PublicLibraryLending"
"The Affair: A Jack Reacher Novel","B004P8JPS6","Item Owner","PublicLibraryLending"
"Why Fish Don't Exist: A Story of Loss, Love, and the Hidden Order of Life","B07THBZ4VD","Item Owner","PublicLibraryLending"
"61 Hours: A Reacher Novel (Jack Reacher Book 14)","B0036S4CWA","Item Owner","PublicLibraryLending"
"Gone Tomorrow: A Jack Reacher Novel","B001NLL8LA","Item Owner","PublicLibraryLending"
"The Splendid and the Vile: A Saga of Churchill, Family, and Defiance During the Blitz","B07TRVW6VX","Item Owner","PublicLibraryLending"
"So You Want to Talk About Race","B07QBNKJTZ","Not Interested","RC"
"Nothing to Lose: A Jack Reacher Novel","B000YJ54DU","Item Owner","PublicLibraryLending"
"Bad Luck and Trouble: A Jack Reacher Novel","B000QCQ8Y4","Item Owner","PublicLibraryLending"
"The Hard Way: A Reacher Novel (Jack Reacher Book 10)","B000GCFG7E","Item Owner","PublicLibraryLending"
"One Shot: A Reacher novel (Jack Reacher Book 9)","B000FCK5PI","Item Owner","PublicLibraryLending"
"Persuader: A Jack Reacher Novel","B000FBJDF2","Item Owner","PublicLibraryLending"
"The Enemy: A Reacher Novel (Jack Reacher Book 8)","B000FC1MBO","Item Owner","PublicLibraryLending"
"The Lager Queen of Minnesota: A Novel","B07L2J8P4S","Item Owner","PublicLibraryLending"
"The People of Sparks (The City of Ember Book 2)","B000FC1R1O","Item Owner","PublicLibraryLending"
"Maybe You Should Talk to Someone: A Therapist, HER Therapist, and Our Lives Revealed","B07BZ4F75T","Item Owner","PublicLibraryLending"
"Weather: A novel","B077WWXZ41","Item Owner","PublicLibraryLending"
"The Prophet of Yonwood (The City of Ember Book 4)","B000QCS932","Item Owner","PublicLibraryLending"
"Lee Child's Jack Reacher Books 1-6","B004DI7JNG","Item Owner","PublicLibraryLending"
"Tripwire (Jack Reacher Book 3)","B001FXK8XU","Item Owner","PublicLibraryLending"
"Grant","B06W2J89PV","Item Owner","PublicLibraryLending"
"Killing Floor (Jack Reacher, Book 1)","B000OZ0NXA","Item Owner","PublicLibraryLending"
"Knife: A Harry Hole Novel (12)","B07JDX5LF6","Item Owner","PublicLibraryLending"
"Dave Hill Doesn't Live Here Anymore","B01EXBB9EM","Item Owner","Purchase"
"Now I Know: The Revealing Stories Behind the World's Most Interesting Facts","B00GHYCH0O","Item Owner","KindleUnlimited"
"Sing, Unburied, Sing: A Novel","B072QC83QZ","Item Owner","Purchase"
"The Gene: An Intimate History","B01D3BXLP8","Item Owner","Purchase"
"Pachinko","B01MU4SLKN","Item Owner","Purchase"
"$2.00 A Day: Living on Almost Nothing in America","B00QPHNUFO","Item Owner","Prime"
"Asymmetry: A Novel","B074ZDRGBC","Item Owner","PublicLibraryLending"
"The Winter Soldier","B078W5XGZD","Item Owner","PublicLibraryLending"
"Asymmetry: A Novel","B0786SZL5V","Not Interested","RC"
"Noir: A Darkly Humorous Mystery with a Touch of the Supernatural in Post-WWII San Francisco","B07192GP7F","Item Owner","PublicLibraryLending"
"Winter Loon: A Novel","B07BDKJVWS","Not Interested","RC"
"The Coaching Mindset: 8 Ways to Think Like a Coach","B0143V938Q","Item Owner","Prime"
"Introducing Quantum Theory: A Graphic Guide (Graphic Guides)","B00KFEK0I8","Item Owner","Prime"
"Darkness Visible: A Memoir of Madness","B00BBPVYUS","Item Owner","PublicLibraryLending"
"Essential Elements for Band – Percussion/Keyboard Book 2 with EEi Access | Percussion and Keyboard Method Songbook and Sheet Music for School Band ... Band Method (Percussion, Book 2)","0634013017","Item Owner","Purchase"
"Instant Pot® Electric Pressure Cooker Cookbook (An Authorized Instant Pot® Cookbook): Quick & Easy Recipes for Everyday Eating","B01NAH8U2R","Item Owner","PublicLibraryLending"
"Feeling Good: Overcome Depression and Anxiety with Proven Techniques","B009UW5X4C","Item Owner","PublicLibraryLending"
"Percy Jackson and the Olympians, Book Four: The Battle of the Labyrinth","B00280LYIM","Item Owner","PublicLibraryLending"
"Leonardo da Vinci","B071Y385Q1","Item Owner","PublicLibraryLending"
"Marathon (A Jonathan Stride Novel Book 8)","B01LXZZ1L5","Item Owner","PublicLibraryLending"
"Bodyweight Strength Training: 12 Weeks to Build Muscle and Burn Fat","B077MW3P57","Item Owner","KindleUnlimited"
"Patient H.M.: A Story of Memory, Madness, and Family Secrets","B01208O00K","Item Owner","PublicLibraryLending"
"Killers of the Flower Moon: The Osage Murders and the Birth of the FBI","B01CWZFBZ4","Item Owner","PublicLibraryLending"
"Vegan Instant Pot Cookbook: 5 Ingredients or Less - The Essential Quick and Simple Plant Based Cookbook for the Everyday Home (Vegan Instant Pot Recipes)","B076FVTJ2K","Item Owner","KindleUnlimited"
"Vegan Instant Pot Cookbook: 5 Ingredients or Less - Quick, Easy, & Healthy Mediterranean Plant Based Recipes (Vegan Instant Pot Recipes)","B0785RD48N","Item Owner","KindleUnlimited"
"Instant Pot Electric Pressure Cooker Cookbook: Top 500 Chef-Proved Super Quick, Easy And Delicious Instant Pot Recipes For Weight Loss And Overall Health(Low Carb Ketogenic Diet Instant Pot Cookbook)","B079JSYK92","Item Owner","KindleUnlimited"
"The Evolution of Beauty: How Darwin's Forgotten Theory of Mate Choice Shapes the Animal World - and Us","B01KE61LPW","Item Owner","PublicLibraryLending"
"18 and Life on Skid Row","B00NLLYN4Y","Item Owner","PublicLibraryLending"
"Astrophysics for People in a Hurry (Astrophysics for People in a Hurry Series)","B01MAWT2MO","Item Owner","PublicLibraryLending"
"The Last Days of Night: A Novel","B01A4AXM3W","Item Owner","PublicLibraryLending"
"The Geography of Genius: A Search for the World's Most Creative Places from Ancient Athens to Silicon Valley (Creative Lessons in History)","B00UDCJ18M","Item Owner","PublicLibraryLending"
"Who Is Rich?: A Novel","B01M3413A8","Item Owner","PublicLibraryLending"
"Waiting for Godot: A Tragicomedy in Two Acts (Beckett, Samuel)","B008UX3QU0","Item Owner","PublicLibraryLending"
"Camino Island: A Novel","B01N2ABE60","Item Owner","PublicLibraryLending"
"Commonwealth: A Novel","B019C40Z7M","Item Owner","PublicLibraryLending"
"Who Is Rich?: A Novel","B0735KF7SS","Not Interested","RC"
"The Vegetable Butcher: How to Select, Prep, Slice, Dice, and Masterfully Cook Vegetables from Artichokes to Zucchini","B00U0OBRS0","Item Owner","PublicLibraryLending"
"I'm Just a Person","B015MNHTN0","Item Owner","PublicLibraryLending"
"Janesville: An American Story (A Business Award-Winner)","B01MT2X3AD","Item Owner","PublicLibraryLending"
"All the Light We Cannot See: A Novel","B00DPM7TIG","Item Owner","PublicLibraryLending"
"So Sad Today: Personal Essays","B011J4H1NO","Item Owner","PublicLibraryLending"
"A Spy's Guide to Thinking (Kindle Single)","B00XZCYHRW","Item Owner","KindleUnlimited"
"A Man Called Ove: A Novel","B00GEEB730","Item Owner","PublicLibraryLending"
"Now I Know: The Revealing Stories Behind the World's Most Interesting Facts (Now I Know Series)","B00ESIQJTQ","Item Owner","KindleUnlimited"
"Pete Magill's 25 Keys to Running a Faster 5K","B01NCY6F1M","Item Owner","KindleUnlimited"
"Chasing the Dragon: Running to Get High","B00E8RDFOE","Item Owner","KindleUnlimited"
"Between Two Worlds: Discovering New Realms of Goalie Development","B019HB3YZU","Item Owner","KindleUnlimited"
"The Passage: A Novel (Book One of The Passage Trilogy)","B003F3PM7A","Item Owner","PublicLibraryLending"
"Wolf in White Van: A Novel","B00IWVELRC","Item Owner","PublicLibraryLending"
"The Sage Running Secret: A Guide to Speedy Ultras: How to run faster on any surface at any distance","B010J003F2","Item Owner","KindleUnlimited"
"Reinvent Yourself","B01NAM6W70","Item Owner","KindleUnlimited"
"Hillbilly Elegy: A Memoir of a Family and Culture in Crisis","B0166ISAS8","Item Owner","PublicLibraryLending"
"The Underground Railroad (Pulitzer Prize Winner) (National Book Award Winner) (Oprah's Book Club): A Novel","B01A4ATV0A","Item Owner","PublicLibraryLending"
"Bartleby, the Scrivener A Story of Wall-Street","B000JML2Z6","Item Owner","Purchase"
"Seveneves: A Novel","B00LZWV8JO","Item Owner","PublicLibraryLending"
"The Sixth Extinction: An Unnatural History","B00EGJE4G2","Item Owner","PublicLibraryLending"
"The Best American Series: 14 Short Stories & Essays","B017RLXECU","Not Interested","RC"
"The Secret History: A Novel (Vintage Contemporaries)","B005PRJT9Q","Item Owner","PublicLibraryLending"
"Just Mercy: A Story of Justice and Redemption (One World Essentials)","B00JYWVYLY","Item Owner","PublicLibraryLending"
"Year of No Sugar: A Memoir","B00IT6C2SU","Item Owner","PublicLibraryLending"
"Piano Adventures: Performance Book Primer Level - 2nd Edition | Beginner Piano Sheet Music for Kids | Educational Piano Songbook for Young Learners | Early Piano Method for Children and Students","1616770775","Item Owner","Purchase"
"Piano Adventures: Theory Book - Primer Level, 2nd Edition | Beginner Piano Theory Workbook | Faber Piano Book with Music Note Reading and Rhythm Practice | Piano Sheet Music Book for Ear Training","1616770767","Item Owner","Purchase"
"Piano Adventures: Lesson Book - Primer Level, 2nd Edition | Beginner Piano Method Book for Kids and Adults | Sheet Music for Learning Notes Rhythm and C 5-Finger Patterns | Faber Piano Teaching Book","1616770759","Item Owner","Purchase"
"Dead Wake: The Last Crossing of the Lusitania","B00N6PD3GE","Item Owner","PublicLibraryLending"
"The Invisible History of the Human Race: How DNA and History Shape Our Identities and Our Futures","B00ISEP2BM","Item Owner","PublicLibraryLending"
"Future Crimes: Everything Is Connected, Everyone Is Vulnerable and What We Can Do About It","B00N6PCZMC","Item Owner","PublicLibraryLending"
"The Monuments Men: Allied Heroes, Nazi Thieves, and the Greatest Treasure Hunt in History","B002LHRLNE","Item Owner","PublicLibraryLending"
"The Power of Habit: Why We Do What We Do in Life and Business","B0055PGUYU","Item Owner","PublicLibraryLending"
"How to Cook Everything Fast: A Better Way to Cook Great Food (How to Cook Everything Series Book 6)","B00HK3EVK0","Item Owner","PublicLibraryLending"
"Understories","B007UPDCD0","Item Owner","PublicLibraryLending"
"Moon Wisconsin (Moon Handbooks)","B00IHGV8VO","Item Owner","PublicLibraryLending"
"Marketplace of the Marvelous: The Strange Origins of Modern Medicine","B00DXKG9RW","Item Owner","PublicLibraryLending"
"The Martian: A Novel","B00EMXBDMA","Item Owner","PublicLibraryLending"
"The Good Lord Bird (National Book Award Winner): A Novel","B00AEDDPU0","Item Owner","PublicLibraryLending"
"The Men Who United the States: America's Explorers, Inventors, Eccentrics and Mavericks, and the Creation of One Nation, Indivisible","B00BATEINA","Item Owner","PublicLibraryLending"
"Iggy Loomis, Superkid in Training","B007HU7NBU","Item Owner","PublicLibraryLending"
"On Such a Full Sea: A Novel","B00C5R722A","Item Owner","PublicLibraryLending"
"The Interestings: A Novel","B008U4HH54","Item Owner","PublicLibraryLending"
"The Fault in Our Stars","B005ZOBNOI","Item Owner","PublicLibraryLending"
"Mr. Peanut (Vintage Contemporaries)","B0036S4A1S","Item Owner","PublicLibraryLending"
"How to Get Filthy Rich in Rising Asia: A Novel","B008ON449S","Item Owner","PublicLibraryLending"
"Let Me Off at the Top!: My Classy Life and Other Musings","B00EIGS388","Item Owner","PublicLibraryLending"
"What Color Is Your Parachute? 2014: A Practical Manual for Job-Hunters and Career-Changers","B00BH0VU2E","Item Owner","PublicLibraryLending"
"Zealot: The Life and Times of Jesus of Nazareth","B00BRUQ7ZY","Item Owner","PublicLibraryLending"
"Everything Is Perfect When You're a Liar","B007HBLNII","Item Owner","PublicLibraryLending"
"Salt Sugar Fat: How the Food Giants Hooked Us","B00985E3UG","Item Owner","PublicLibraryLending"
"Double Cross: The True Story of the D-Day Spies","B0075WP9MK","Item Owner","PublicLibraryLending"
"God Is Not Great: How Religion Poisons Everything","B000QUCO4Y","Item Owner","PublicLibraryLending"
"The Teleportation Accident: A Novel","B009K5093O","Item Owner","PublicLibraryLending"
"The Dinner","B008ZPGDX0","Item Owner","PublicLibraryLending"
"Best Food Writing 2012","B0091LLAU8","Item Owner","PublicLibraryLending"
"No Country for Old Men (Vintage International)","B000WJSB4Q","Item Owner","PublicLibraryLending"
"A Game of Thrones (A Song of Ice and Fire, Book 1)","B000QCS8TW","Item Owner","PublicLibraryLending"
"Running the Rift: A Novel","B0061S3W28","Item Owner","PublicLibraryLending"
"The Golden Sayings of Epictetus","B0082ZJFCO","Not Interested","RC"
"The Age of Miracles: A Novel","B005SHPWQC","Item Owner","PublicLibraryLending"
"Meditations","B0082XJGRK","Not Interested","RC"
"1Q84 (Vintage International)","B004LROUW2","Item Owner","PublicLibraryLending"
"Vegan Sandwiches Save the Day!: Revolutionary New Takes on Everyone's Favorite Anytime Meal","B00968R5M8","Item Owner","PublicLibraryLending"
"Heads in Beds: A Reckless Memoir of Hotels, Hustles, and So-Called Hospitality","B0086MKQSU","Item Owner","PublicLibraryLending"
"Tell the Wolves I'm Home: A Novel","B005QPI9ZW","Item Owner","PublicLibraryLending"
"Dear Life: Stories (Vintage International)","B0084TWN9K","Item Owner","PublicLibraryLending"
"Ski-running","B0084C5DZ8","Not Interested","RC"
"Consider the Fork: A History of How We Cook and Eat","B00918JMYM","Item Owner","PublicLibraryLending"
"30 Easy Vegetarian Recipes For Weeknights – Unique Easy Vegetarian Meals (Quick and Easy Dinner Recipes – The Easy Weeknight Dinners Collection)","B009OWM3EG","Not Interested","RC"
"Eat & Run: My Unlikely Journey to Ultramarathon Greatness","B005OCHOZS","Item Owner","PublicLibraryLending"
"Zeitoun","B0036S4ALS","Item Owner","PublicLibraryLending"
"Quiet: The Power of Introverts in a World That Can't Stop Talking","B004J4WNL2","Item Owner","PublicLibraryLending"
"Wild: From Lost to Found on the Pacific Crest Trail (Oprah's Book Club 2.0)","B005IQZB14","Item Owner","PublicLibraryLending"
"Phantom: A Harry Hole Novel (9)","B007QPFGJW","Item Owner","PublicLibraryLending"
"Tiny Beautiful Things: Reese's Book Club: Advice from Dear Sugar","B005V2DUP4","Item Owner","PublicLibraryLending"
"The End of Money: Counterfeiters, Preachers, Techies, Dreamers--and the Coming Cashless Society","B006YTPR2W","Item Owner","PublicLibraryLending"
"A Hologram for the King","B008FZWLMW","Item Owner","PublicLibraryLending"
"Tubes: A Journey to the Center of the Internet","B006FOHWDI","Item Owner","PublicLibraryLending"
"Book Lust: Recommended Reading for Every Mood, Moment, and Reason","B003WUYEES","Item Owner","PublicLibraryLending"
"Why Can't Elephants Jump?: And 113 Other Tantalizing Science Questions Answered","B005LW2IMA","Item Owner","PublicLibraryLending"
"Not Available","B005LDBI6G","Not Interested","RC"
"Madison (WI): History of a Model City","B005H3LC0C","Item Owner","PublicLibraryLending"
"Headhunters (Vintage Crime/Black Lizard)","B005EGXRVE","Item Owner","PublicLibraryLending"
"Na Pule Kahiko: Ancient Hawaiian Prayers","0960793860","Item Owner","Purchase"
"Hi Herbal Medicine Kakuna Laau","0896103307","Item Owner","Purchase"
"Around the World in 80 Dinners","B0014Y09O8","Item Owner","PublicLibraryLending"
"The Night Night Book (Marianne Richmond)","B004Q9TXF4","Item Owner","PublicLibraryLending"
"This Side of Paradise","B000JQUXOS","Not Interested","RC"
"Backroads of Minnesota: Your Guide to Scenic Getaways & Adventures (A Pictorial Discovery Guide)","B004ZEK8KO","Item Owner","PublicLibraryLending"
"Knives at Dawn: America's Quest for Culinary Glory at the Legendary Bocuse d'Or Competition","1439153078","Item Owner","Purchase"
"What Do People Do All Day?","0394818237","Item Owner","Purchase"
"Richard Scarry's Busy, Busy Town","0307168034","Item Owner","Purchase"
"Richard Scarry's Best Storybook Ever (Giant Little Golden Book)","0307165485","Item Owner","Purchase"
"Saxons, Vikings, and Celts: The Genetic Roots of Britain and Ireland","0393330753","Not Interested","NI"
"The Embarrassment of Riches: An Interpretation of Dutch Culture in the Golden Age","0679781242","Not Interested","NI"
"Mothers of Invention: Women of the Slaveholding South in the American Civil War (The Fred W. Morrison Series in Southern Studies)","0807855731","Not Interested","NI"
"Wake Up: A Life of the Buddha","0670019577","Not Interested","NI"
"2009 Tulips Wall Calendar","3832728295","Not Interested","NI"
"Home: A Novel","0374299102","Not Interested","NI"
"Richard Scarry's The Great Pie Robbery and Other Mysteries","1402758235","Not Interested","NI"
"The Last Theorem","0345470214","Not Interested","NI"
"Richard Scarry's Great Big Schoolhouse","1402758200","Not Interested","NI"
"Indignation","054705484X","Not Interested","NI"
"Proust Was A Neuroscientist","0547085907","Not Interested","NI"
"How Fiction Works","0374173400","Not Interested","NI"
"Satan's Circus: Murder, Vice, Police Corruption, and New York's Trial of the Century","1400054729","Not Interested","NI"
"Brother, I'm Dying: National Book Award Finalist (Vintage Contemporaries)","1400034302","Not Interested","NI"
"Extraordinary Popular Delusions and the Madness of Crowds","1604594411","Not Interested","NI"
"Tulipmania: Money, Honor, and Knowledge in the Dutch Golden Age","0226301265","Not Interested","NI"
"Tree of Smoke","0312427743","Not Interested","LR"
"Where the Wild Things Are","0064431789","Item Owner","Purchase"
"Harold and the Purple Crayon (Purple Crayon Books)","0064430227","Item Owner","Purchase"
"What Do You Do with a Tail Like This?: A Caldecott Honor Award Winner (Caldecott Honor Book)","0618256288","Item Owner","Purchase"
"Your Pregnancy: A Week by Week Guide: What to expect at every stage, from conception to birth and post-natal care; Expert advice and guidance for a healthy, happy pregnancy and baby","1844764419","Not Interested","NI"
"The Canon: A Whirligig Tour of the Beautiful Basics of Science","0547053460","Not Interested","LR"
"A Walk in the Woods: Rediscovering America on the Appalachian Trail","0307279464","Not Interested","GR"
"Cliffs Notes on Kafka's The Metamorphosis & Other Stories","0822007002","Not Interested","NI"
"Oedipus the King, Oedipus at Colonus, and Antigone (Cliffs Notes)","0822007088","Not Interested","NI"
"In Defense of Food: An Eater's Manifesto","1594201455","Not Interested","GR"
"Alice Waters and Chez Panisse: The Romantic, Impractical, Often Eccentric, Ultimately Brilliant Making of a Food Revolution","0143113089","Not Interested","NI"
"What to Expect When the New Baby Comes Home (What to Expect Kids)","0694013277","Not Interested","NI"
"I'm a Big Sister","B0012F9VSO","Not Interested","NI"
"The Cheese Plate","0609604961","Item Owner","Purchase"
"Richard Scarry's Cars and Trucks and Things That Go","0307157857","Item Owner","Purchase"
"Let's Count (Bob the Builder)","0689846355","Not Interested","RC"
"Excuse Me: A Little Book of Manners (Lift-the-Flap Book)","0448425858","Item Owner","Purchase"
"I Am a Dump Truck","0439916178","Item Owner","Purchase"
"Richard Scarry's Please and Thank You Book (Pictureback)","0394826817","Item Owner","Purchase"
"Climbing the Mango Trees: A Memoir of a Childhood in India","1400078202","Not Interested","NI"
"The Life and Times of the Thunderbolt Kid: A Memoir","076791936X","Not Interested","NI"
"My Life in France","1400043468","Not Interested","NI"
"The Gift - A Runner's Story","1411669258","Not Interested","NI"
"The journals of William Fraser Tolmie,: Physician and fur trader","B0006BLPK2","Item Owner","Purchase"
"Chuck Klosterman IV: A Decade of Curious People and Dangerous Ideas","0743284887","Not Interested","NI"
"Marathon Woman: Running the Race to Revolutionize Women's Sports","0786719672","Not Interested","NI"
"Henry IV, Part 1 (Folger Shakespeare Library)","0743485041","Not Interested","NI"
"Sexual Perversity in Chicago and the Duck Variations: Two Plays (Mamet, David)","080215011X","Not Interested","NI"
"Runner's World The Runner's Diet: The Ultimate Eating Plan That Will Make Every Runner (and Walker) Leaner, Faster, and Fitter","1594862052","Not Interested","NI"
"The Runner's Book of Daily Inspiration : A Year of Motivation, Revelation, and Instruction","0809229625","Not Interested","NI"
"Women Who Run","1580051839","Not Interested","NI"
"Sole Sisters: Stories of Women and Running","0740757113","Not Interested","NI"
"What to Eat","0865477388","Not Interested","NI"
"The Complete Runner's Day-by-Day Log and Calendar 2007","1400063396","Not Interested","NI"
"Insatiable: Tales from a Life of Delicious Excess","0446695106","Not Interested","NI"
"Isaac Newton: The Last Sorcerer (British Commonwealth, United States, United Nations, 1993)","073820143X","Not Interested","NI"
"Superstud: Or How I Became a 24-Year-Old Virgin","1400051754","Not Interested","NI"
"Garlic and Sapphires: The Secret Life of a Critic in Disguise","0143036610","Not Interested","NI"
"The Extra Mile: One Woman's Personal Journey to UltraRunning Greatness","1594864152","Not Interested","NI"
"The Family of Women : Voices Across the Generations","0789203383","Not Interested","NI"
"Women in Mathematics (Mit Press)","0262650096","Not Interested","NI"
"The God Delusion","0618680004","Not Interested","LR"
"Duel in the Sun: Alberto Salazar, Dick Beardsley, and America's Greatest Marathon","1594862621","Not Interested","GR"
"Cheese: A Connoisseur's Guide to the World's Best","1400050340","Item Owner","Purchase"
"Counting Kisses","0689834705","Item Owner","Purchase"
