"Product Name","ASIN","Ownership Type","Ownership Subtype"
"Heartwood (A Read with Jenna Pick): A Novel","1668063603","Not Interested","GR"
"Heartwood (A Read with Jenna Pick): A Novel","1668063603","Not Interested","GR"
"Vera, or Faith: A Novel","0593595092","Not Interested","GR"
"Life as No One Knows It: The Physics of Life's Emergence","0593191897","Not Interested","GR"
"Vera, or Faith: A Novel","0593595092","Not Interested","GR"
"Life as No One Knows It: The Physics of Life's Emergence","0593191897","Not Interested","GR"
"All That Man Is: Shortlisted for the Man Booker Prize 2016","0224099779","Not Interested","GR"
"All That Man Is: Shortlisted for the Man Booker Prize 2016","0224099779","Not Interested","GR"
"Turbulence: A Novel","1982122730","Not Interested","GR"
"Turbulence: A Novel","1982122730","Not Interested","GR"
"The Woman in Suite 11: A Novel","B0DJM99D77","Item Owner","PublicLibraryLending"
"The Woman in Suite 11: A Novel","B0DJM99D77","Item Owner","PublicLibraryLending"
"The Last One at the Wedding: A Novel","1250895782","Not Interested","GR"
"The Last One at the Wedding: A Novel","1250895782","Not Interested","GR"
"London and the South-East","0224081586","Not Interested","GR"
"London and the South-East","0224081586","Not Interested","GR"
"The Maid's Secret: A Maid Novel (Molly the Maid Book 3)","B0D9F3KFPM","Item Owner","PublicLibraryLending"
"King of Ashes: A Novel","B0DJ7XG2MQ","Sample Owner","Sample"
"The River Is Waiting (Oprah's Book Club): A Novel","B0DHDF2RDL","Item Owner","PublicLibraryLending"
"The River Is Waiting (Oprah's Book Club): A Novel","B0DHDF2RDL","Item Owner","PublicLibraryLending"
"So Far Gone: A Novel","B0DGY7NRZJ","Not Interested","GR"
"A Few Seconds of Panic: A 5-Foot-8, 170-Pound, 43-Year-Old Sportswriter Plays in the NFL","1594201781","Not Interested","GR"
"The Game","0470835842","Not Interested","GR"
"So Far Gone: A Novel","B0DGY7NRZJ","Not Interested","GR"
"A Few Seconds of Panic: A 5-Foot-8, 170-Pound, 43-Year-Old Sportswriter Plays in the NFL","1594201781","Not Interested","GR"
"The Game","0470835842","Not Interested","GR"
"Aldo Leopold: A Sand County Almanac & Other Writings on Conservation and Ecology (LOA #238) (Library of America)","B00BUP18U0","Item Owner","PublicLibraryLending"
"Goalie Mindset Secrets: 7 Must Have Goalie Mindset Secrets You Don't Learn in School!","B07LGLF1JG","Item Owner","Purchase"
"So You Want to Talk About Race","B07QBNKJTZ","Item Owner","Purchase"
"The Rider","1582342903","Not Interested","GR"
"The Rider","1582342903","Not Interested","GR"
"The Wedding People: A Novel","B0CJ839C56","Item Owner","PublicLibraryLending"
"The Emperor of Gladness: Oprah's Book Club: A Novel","059383187X","Not Interested","GR"
"On the Calculation of Volume (Book I): Shortlisted for the 2025 International Booker Prize","0811237257","Not Interested","GR"
"Run for the Hills: From the NYT Bestselling Author of Nothing to See Here","0063317516","Not Interested","GR"
"Ruth Run: A Novel","0593832647","Not Interested","GR"
"Flesh: A Novel","198212279X","Not Interested","GR"
"Tilt: A Novel","B0CWFMT5SC","Item Owner","PublicLibraryLending"
"The Murder of Roger Ackroyd","B09SKWT6SF","Sample Owner","Sample"
"Gone Gone","B0DLLGPNMQ","Sample Owner","Sample"
"Careless People: A Cautionary Tale of Power, Greed, and Lost Idealism","B0DY9TZD8Z","Item Owner","PublicLibraryLending"
"Audition: A Novel","059385232X","Not Interested","GR"
"Win the Inside Game: How to Move from Surviving to Thriving, and Free Yourself Up to Perform","B0D3CBLLPH","Sample Owner","Sample"
"The Hedgehog’s Dilemma","B0D57LWBM6","Item Owner","PublicLibraryLending"
"The Murder Show","1250325722","Not Interested","GR"
"CABIN: Off the Grid Adventures with a Clueless Craftsman","B0CQHL1XV7","Sample Owner","Sample"
"I See You've Called in Dead: A Novel","B0DC7V6RMG","Not Interested","GR"
"CABIN: Off the Grid Adventures with a Clueless Craftsman","1250285704","Not Interested","GR"
"Kills Well with Others","0593638514","Not Interested","GR"
"The Passenger Seat","1771966300","Not Interested","GR"
"Rental House: A Novel","0593545540","Not Interested","GR"
"Fifty in Reverse: A Novel","1982152672","Not Interested","GR"
"Hansons Marathon Method: Run Your Fastest Marathon the Hansons Way","B0CDDCJ6P2","Not Interested","GR"
"Martin Dressler: The Tale of an American Dreamer (Vintage Contemporaries)","B004089I6A","Not Interested","GR"
"The Botany of Desire: A Plant's-Eye View of the World","B000FC1H14","Not Interested","GR"
"Beartooth: A Novel","1954118023","Not Interested","GR"
"Peak Performance: Elevate Your Game, Avoid Burnout, and Thrive with the New Science of Success","162336793X","Not Interested","GR"
"Banana: The Fate of the Fruit That Changed the World","1594630380","Not Interested","GR"
"The Ghost Map: The Story of London's Most Terrifying Epidemic and How It Changed Science, Cities, and the Modern World","1594489254","Not Interested","GR"
"Out of Thin Air: Running Wisdom and Magic from Above the Clouds in Ethiopia: Winner of the Margaret Mead Award 2022","1472975324","Not Interested","GR"
"The Incomplete Book of Running","1451696248","Not Interested","GR"
"Longitude: The True Story of a Lone Genius Who Solved the Greatest Scientific Problem of His Time","0802714625","Not Interested","GR"
"North Woods: A Novel","0593597036","Not Interested","GR"
"Somebody's Fool: A novel (North Bath Trilogy)","0593317890","Not Interested","GR"
"My Year of Running Dangerously: A Dad, a Daughter, and a Ridiculous Plan","0399175474","Not Interested","GR"
"The Sportswriter","0394743253","Not Interested","GR"
"James (Pulitzer Prize Winner): A Novel","0385550367","Not Interested","GR"
"Memoirs of Hadrian (FSG Classics)","0374529264","Not Interested","GR"
"Then We Came to the End: A Novel","0316016381","Not Interested","GR"
"Independence Day","0099447126","Not Interested","GR"
"Fast Girl: A Life Spent Running from Madness","0062346229","Not Interested","GR"
"No Room at the Morgue","B081M4F8GH","Item Owner","PublicLibraryLending"
"Stoner (New York Review Books Classics)","B003K15IF8","Item Owner","PublicLibraryLending"
"Dead Money: A Novel","0593726707","Not Interested","GR"
"The Miraculous from the Material: Understanding the Wonders of Nature","0593701488","Not Interested","GR"
"Frostbite: How Refrigeration Changed Our Food, Our Planet, and Ourselves","B0CJTKZCTR","Item Owner","PublicLibraryLending"
"The Bones of Bascom Hall (A Nora Barnes and Toby Sandler Mystery)","B0DMDYK6Y6","Item Owner","PublicLibraryLending"
"Everything Is Predictable: How Bayesian Statistics Explain Our World","1668052601","Not Interested","GR"
"Hansons Half-Marathon Method: Run Your Best Half-Marathon the Hansons Way","B00JV2H5I8","Item Owner","PublicLibraryLending"
"The Last Ranger: A novel","B0BL6YQ61Y","Item Owner","PublicLibraryLending"
"Embers of the Hands: Hidden Histories of the Viking Age","1324089237","Not Interested","GR"
"The Wide Wide Sea: Imperial Ambition, First Contact and the Fateful Final Voyage of Captain James Cook","B0CC1J32NG","Item Owner","PublicLibraryLending"
"The Wide Wide Sea: Imperial Ambition, First Contact and the Fateful Final Voyage of Captain James Cook","0385544766","Not Interested","GR"
"Godwin: A Novel","0593701321","Not Interested","GR"
"Godwin: A Novel","B0CH9KQYHS","Sample Owner","Sample"
"Blackouts: A Novel","B0BQGDMFH6","Item Owner","PublicLibraryLending"
"To the Limit: The Meaning of Endurance from Mexico to the Himalayas","1399403427","Not Interested","GR"
"The Frontrunner","B0CZXNTCFX","Sample Owner","Sample"
"Burn: A novel","B0CN8TPKSP","Sample Owner","Sample"
"The Secret Lives of Booksellers and Librarians: True Stories of the Magic of Reading (Heroes Among Us Book 4)","B0CDWDLCNS","Item Owner","PublicLibraryLending"
"Orbital: A Novel (Booker Prize Winner)","B0BZ5Y513V","Item Owner","PublicLibraryLending"
"The God of the Woods: A Novel","B0CL1YQLB5","Not Interested","GR"
"The Heart in Winter: A Novel","0385550596","Item Owner","Purchase"
"Burn: A novel","0593801628","Item Owner","Purchase"
"Martyr!: A novel","0593537610","Item Owner","Purchase"
"The God of the Woods: A Novel","0593418913","Item Owner","Purchase"
"Getting to Know Death: A Meditation","1639734449","Not Interested","GR"
"The Ministry of Time: A Novel","1668045141","Not Interested","GR"
"Safe Enough: Crime Stories by the Author of Jack Reacher","B0CW1J3Y5G","Item Owner","PublicLibraryLending"
"Not Available","B0B9Q44R96","Not Interested","GR"
"Blood Test: A Comedy","0593700856","Not Interested","GR"
"Not Available","Not Available","Pdoc Owner","PDocs"
"Not Available","Not Available","Pdoc Owner","PDocs"
"Not Available","Not Available","Pdoc Owner","PDocs"
"That Librarian: The Fight Against Book Banning in America","B0CQFXKTPW","Item Owner","PublicLibraryLending"
"The Life Impossible: A Novel","B0CGZFPKTZ","Item Owner","PublicLibraryLending"
"Checkout 19: A Novel","B097XBXQ1T","Item Owner","PublicLibraryLending"
"The Sequel: A Novel (The Book Series 2)","B0CQHM2KL5","Item Owner","PublicLibraryLending"
"Not Available","Not Available","Pdoc Owner","PDocs"
"Here One Moment","0593798600","Not Interested","GR"
"We Solve Murders: A Novel","B0CQJHF3HQ","Item Owner","PublicLibraryLending"
"Not Available","Not Available","Pdoc Owner","PDocs"
"Not Available","Not Available","Pdoc Owner","PDocs"
"Creation Lake: A Novel","1982116528","Not Interested","GR"
"Not Available","Not Available","Pdoc Owner","PDocs"
"Not Available","Not Available","Pdoc Owner","PDocs"
"Not Available","Not Available","Pdoc Owner","PDocs"
"Not Available","Not Available","Pdoc Owner","PDocs"
"Not Available","Not Available","Pdoc Owner","PDocs"
"Not Available","Not Available","Pdoc Owner","PDocs"
"Not Available","Not Available","Pdoc Owner","PDocs"
"Not Available","Not Available","Pdoc Owner","PDocs"
"Not Available","Not Available","Pdoc Owner","PDocs"
"The Kind Worth Killing: A Novel","0062267523","Not Interested","GR"
"Not Available","Not Available","Pdoc Owner","PDocs"
"A Talent for Murder: A Novel","0063205033","Not Interested","GR"
"Not Available","Not Available","Pdoc Owner","PDocs"
"The Examined Run: Why Good People Make Better Runners","0197678696","Not Interested","GR"
"A (Very) Short History of Life on Earth: 4.6 Billion Years in 12 Pithy Chapters","B092T8QDYW","Item Owner","PublicLibraryLending"
"Invitation to a Banquet: A History of Chinese Food","B0BWGKNK7G","Item Owner","PublicLibraryLending"
"I Cheerfully Refuse","B0CH1NHWNW","Item Owner","PublicLibraryLending"
"The Midnight Feast: An NPR Best Book of the Year","B0CL3FMNKJ","Item Owner","PublicLibraryLending"
"End of Story: An Enthralling Thriller with a Suspenseful Plot, Get Lost in the Pages and Unravel the Mystery","B078R46LCY","Item Owner","PublicLibraryLending"
"Not Available","Not Available","Pdoc Owner","PDocs"
"Cold Victory","B0CQ38FNR9","Sample Owner","Sample"
"The Hunter: A Novel","B0C7729CF8","Item Owner","PublicLibraryLending"
"The Hunter: A Novel","0593493435","Not Interested","GR"
"The Pale Blue Eye: A Novel","B000GCFX6S","Item Owner","PublicLibraryLending"
"The Demon of Unrest: A Saga of Hubris, Heartbreak, and Heroism at the Dawn of the Civil War","B0CDKLBD2W","Item Owner","PublicLibraryLending"
"Who Owns This Sentence?: A History of Copyrights and Wrongs","B0C97F8KPY","Item Owner","PublicLibraryLending"
"Not Available","Not Available","Pdoc Owner","PDocs"
"Not Available","Not Available","Pdoc Owner","PDocs"
"Outsider: An Old Man, a Mountain and the Search for a Hidden Past","B0B7NZHCKR","Not Interested","GR"
"Not Available","Not Available","Pdoc Owner","PDocs"
"Not Available","Not Available","Pdoc Owner","PDocs"
"The Winner: A Novel","0063353598","Not Interested","GR"
"Not Available","Not Available","Pdoc Owner","PDocs"
"Still Waters: A Novel","1250325692","Not Interested","GR"
"Not Available","Not Available","Pdoc Owner","PDocs"
"The Body in Question: A Novel","B07RT71Z48","Not Interested","GR"
"One Perfect Couple","B0CL5G23ZF","Item Owner","PublicLibraryLending"
"The Denial of Death","B002C7Z57C","Sample Owner","Sample"
"The Winner: A Novel","B0CGTHLBT9","Sample Owner","Sample"
"The Golden Spoon: A Novel","B0B3Y9JVMK","Item Owner","PublicLibraryLending"
"The Ferryman: A Novel","B0B8GZ58DK","Item Owner","PublicLibraryLending"
"Balloon Dog","B09X34KMRM","Item Owner","PublicLibraryLending"
"The Aosawa Murders","B07QN87LQB","Item Owner","PublicLibraryLending"
"I Hope This Finds You Well: A Novel","B0CJ9TSSYB","Item Owner","PublicLibraryLending"
"Tokyo Ueno Station (National Book Award Winner): A Novel","B081914PR7","Item Owner","PublicLibraryLending"
"A Travel Guide to the Middle Ages: The World Through Medieval Eyes","B0C97G1ZR6","Item Owner","PublicLibraryLending"
"A Young People's History of the United States (For Young People Series)","B003B4IW2U","Item Owner","PublicLibraryLending"
"The Heaven & Earth Grocery Store: A Novel","B0BPNP7YQB","Item Owner","PublicLibraryLending"
"The Covenant of Water (Oprah's Book Club)","B0BJSGV831","Item Owner","PublicLibraryLending"
"The Day Tripper: A Powerful Time Travel Redemption Story of Small Actions Leading to Big Consequences","B0C4PX8RD7","Item Owner","PublicLibraryLending"
"Knowing What We Know: The Transmission of Knowledge: From Ancient Wisdom to Modern Magic","B0B7NGCGHG","Sample Owner","Sample"
"Shape: The Hidden Geometry of Information, Biology, Strategy, Democracy, and EverythingElse","B08PF965W9","Item Owner","PublicLibraryLending"
"Wandering Stars: A novel","B0C772ZLMQ","Item Owner","PublicLibraryLending"
"The Upstairs Delicatessen: On Eating, Reading, Reading About Eating, and Eating While Reading","B0BQGHJM5L","Item Owner","PublicLibraryLending"
"Salvation of a Saint: A Detective Galileo Novel (Detective Galileo Series Book 2)","B007RMYE9M","Item Owner","PublicLibraryLending"
"Zero at the Bone: Fifty Entries Against Despair","B0BQGJVCMT","Item Owner","PublicLibraryLending"
"The Fury","B0BXTB6HSN","Item Owner","PublicLibraryLending"
"Ordinary Grace: A Novel","B008J2G5Y6","Item Owner","PublicLibraryLending"
"Scenes from a Childhood — WINNER OF THE 2023 NOBEL PRIZE IN LITERATURE","B07BX82VS9","Item Owner","PublicLibraryLending"
"The Clementine Complex","B0BTZRQHJM","Item Owner","PublicLibraryLending"
"Everyone on This Train Is a Suspect: A Novel (The Ernest Cunningham Mysteries Book 2)","B0C6KMGND1","Item Owner","PublicLibraryLending"
"Northwoods: A Novel","B0C7RPT9B3","Item Owner","PublicLibraryLending"
"I Know What You Did: A Novel","B0BJP5QFFM","Item Owner","PublicLibraryLending"
"Heart Sutra","B0B72HGHW8","Item Owner","PublicLibraryLending"
"You Dreamed of Empires: A Novel","B0C1YCKNK1","Item Owner","PublicLibraryLending"
"Northwoods: A Novel","B0C7RQ8Y2F","Not Interested","GR"
"The Devotion of Suspect X: A Detective Galileo Novel (Detective Galileo Series Book 1)","B0044781ZQ","Item Owner","PublicLibraryLending"
"Prophet Song: A Novel (Booker Prize Winner)","B0CLQVQSVL","Item Owner","PublicLibraryLending"
"Someone Who Will Love You in All Your Damaged Glory: Stories","B07HDT9JFX","Item Owner","PublicLibraryLending"
"Loneliness Of The Long Distance Runner","0007255608","Not Interested","GR"
"None of This Is True: A Novel","B0BDMPQ2FC","Item Owner","PublicLibraryLending"
"Diary of a Void: A Novel","B09LHBX5KV","Item Owner","PublicLibraryLending"
"None of This Is True: A Novel","1982179007","Not Interested","GR"
"The MANIAC","0593654471","Not Interested","GR"
"True North: A Novel","B0C592RHNC","Item Owner","PublicLibraryLending"
"The Librarianist: A Novel","B0BH4QWM85","Item Owner","PublicLibraryLending"
"Martyr!: A novel","B0C3C886FY","Item Owner","PublicLibraryLending"
"Last Acts: A Novel","B0C7RK8P8K","Sample Owner","Sample"
"Martyr!: A novel","B0C3C886FY","Sample Owner","Sample"
"The End of August: A Novel","B0BL6271NP","Sample Owner","Sample"
"The Restaurant Inspector","B0927NRBFB","Item Owner","PublicLibraryLending"
"The Guest List: A Novel","B07WG8L7WC","Item Owner","PublicLibraryLending"
"The Killing Hills (The Mick Hardin Novels Book 1)","B08TF1VTGX","Item Owner","PublicLibraryLending"
"Aliss at the Fire — WINNER OF THE 2023 NOBEL PRIZE IN LITERATURE","B09RMQJCZJ","Item Owner","PublicLibraryLending"
"Shutter Island","B000JMKNV0","Item Owner","PublicLibraryLending"
"Good Bad Girl: A Novel","B0BST5X6GS","Item Owner","PublicLibraryLending"
"Hello Beautiful (Oprah's Book Club): A Novel","B0B7R4Q5DJ","Item Owner","PublicLibraryLending"
"The Day of the Jackal","0553266306","Not Interested","GR"
"Ninth House (Ninth House Series Book 1)","B07LF64DZ2","Item Owner","PublicLibraryLending"
"Blood Meridian: Or the Evening Redness in the West (Vintage International)","B003XT60E0","Sample Owner","Sample"
"The Soulmate: A Novel","B09Y467GZY","Item Owner","PublicLibraryLending"
"The Purple Runner","B09S3WWY98","Sample Owner","Sample"
"Everyone in My Family Has Killed Someone: A Novel (The Ernest Cunningham Mysteries Book 1)","B09Y94K74X","Item Owner","PublicLibraryLending"
"The Stranger (Camus Novel)","B09Q2F1X14","Sample Owner","Sample"
"Blood Meridian: Or the Evening Redness in the West","0679728759","Item Owner","Purchase"
"Babel: Or the Necessity of Violence: An Arcane History of the Oxford Translators’ Revolution—An Historic Fantasy of Dark Academia, Perfect for Fans of ... Fiction and Nineteenth Century England","B09MD95S5V","Item Owner","PublicLibraryLending"
"Lay Your Body Down: A Novel of Suspense","B09721CTG1","Item Owner","PublicLibraryLending"
"The Plotters: A Novel","B07CWDMQ45","Item Owner","PublicLibraryLending"
"The Upstairs Delicatessen: On Eating, Reading, Reading About Eating, and Eating While Reading","B0BQGHJM5L","Sample Owner","Sample"
"Smarter Not Harder: The Biohacker's Guide to Getting the Body and Mind You Want","B0B399L6KP","Item Owner","PublicLibraryLending"
"Four Thousand Weeks: Time Management for Mortals","B08FGV64B1","Item Owner","PublicLibraryLending"
"Yellowface: A Chilling Novel of Racism and Cultural Appropriation from the author of Katabasis","B0B9SN8K6H","Item Owner","PublicLibraryLending"
"Wellness: A Novel (Oprah's Book Club)","B0BR511292","Item Owner","PublicLibraryLending"
"Eastbound","B0B6B4WPSF","Sample Owner","Sample"
"The Mystery Guest: A Maid Novel (Molly the Maid Book 2)","B0C5LRCM2F","Item Owner","PublicLibraryLending"
"Fast After 50: How to Race Strong for the Rest of Your Life","1937715264","Not Interested","GR"
"The Spy Who Came in from the Cold: A George Smiley Novel (George Smiley Novels Book 3)","B006CUDDUG","Item Owner","PublicLibraryLending"
"I Have Some Questions for You: A Novel","B09ZRWP8DS","Item Owner","PublicLibraryLending"
"What's Gotten Into You: The Story of Your Body's Atoms, from the Big Bang Through Last Night's Dinner","B09YRR8DB6","Sample Owner","Sample"
"The Longest Race: Inside the Secret World of Abuse, Doping, and Deception on Nike's Elite Running Team","1982179147","Not Interested","GR"
"Beastie Boys Book","0812995546","Not Interested","GR"
"North Woods: A Novel","B0BPX7SF89","Item Owner","PublicLibraryLending"
"Chain Gang All Stars: A Read with Jenna Pick: National Book Award Finalist","B0B5ST3XX4","Item Owner","PublicLibraryLending"
"Starter Villain","B0B9KVXCQ6","Item Owner","PublicLibraryLending"
"Breaking and Entering","B0BKH7G2X8","Item Owner","PublicLibraryLending"
"The Awesome Game: One Man's Incredible, Globe-Crushing Hockey Odyssey","B0CHWJCN94","Sample Owner","Sample"
"The Theory of Everything Else: A Voyage Into the World of the Weird","B0BGJ3W5D3","Sample Owner","Sample"
"Slow Horses (Slough House Book 1)","B004HW7DZ2","Item Owner","PublicLibraryLending"
"Trust (Pulitzer Prize Winner)","B09BV2JNWV","Item Owner","PublicLibraryLending"
"Fever House: A Novel (Fever House Duology Book 1)","B0BP6S1S57","Sample Owner","Sample"
"Hope: A Novel","B0BHY38ZPH","Sample Owner","Sample"
"No One Will Miss Her: A Dark and Compelling Mystery with a Devious Plot, Get Ready to Unravel the Secrets!","B08SMFSLVQ","Item Owner","PublicLibraryLending"
"The Sullivanians: Sex, Psychotherapy, and the Wild Life of an American Commune","B0BBC769LV","Item Owner","PublicLibraryLending"
"Somebody's Fool: A novel (North Bath Trilogy Book 3)","B0BKKVQPLB","Item Owner","PublicLibraryLending"
"The Rise: A Short Story","B0CBW58P3J","Item Owner","Purchase"
"The Rise: A Short Story","B0CBW58P3J","Not Interested","RC"
"The Fraud: A Novel","B0BP66G6B7","Item Owner","PublicLibraryLending"
"How Can I Help You","B0BJNKTFGH","Item Owner","PublicLibraryLending"
"The Last Devil to Die: A Thursday Murder Club Mystery (Thursday Murder Club Mysteries Book 4)","B0BQLKNTYR","Item Owner","PublicLibraryLending"
"The Vaster Wilds: A Novel","B0BTVBH6G3","Item Owner","PublicLibraryLending"
"Not Available","B0DT439M77","Not Interested","GR"
"The Girl in the Eagle's Talons: A Lisbeth Salander Novel (The Girl with the Dragon Tattoo (Lisbeth Salander / Millennium) Book 7)","B0BLY7J9DC","Item Owner","PublicLibraryLending"
"What You Are Looking For Is in the Library: A Touching Narrative of Self-Discovery, Community Bonds and the Joys of Reading in Tokyo's Libraries","B0BT82YGGF","Item Owner","PublicLibraryLending"
"Small World: A Novel","B08T6CL58V","Item Owner","PublicLibraryLending"
"The Golden Couple: A Novel","B092T947PJ","Item Owner","PublicLibraryLending"
"Ella Minnow Pea: A Novel in Letters","0385722435","Not Interested","GR"
"How Minds Change: The Surprising Science of Belief, Opinion, and Persuasion","B093R2CP2V","Not Interested","GR"
"Path Lit by Lightning: The Life of Jim Thorpe","B09JPFYQY2","Item Owner","PublicLibraryLending"
"Tom Lake: A Reese’s Book Club Pick","B0BL126WSH","Item Owner","PublicLibraryLending"
"Good Family","1250810175","Not Interested","GR"
"The School of Hard Talks: How to Have Real Conversations with Your (Almost Grown) Kids","1632174707","Not Interested","GR"
"I Am Homeless If This Is Not My Home: A novel","B0BG13PH57","Item Owner","PublicLibraryLending"
"National Geographic Guide to National Parks of the United States, 8th Edition (National Geographic Guide to the National Parks of the United States)","B016TG0SAK","Item Owner","Prime"
"Mac's Problem","B07GJBCLHN","Item Owner","PublicLibraryLending"
"One by One","B084G9Z5C3","Item Owner","PublicLibraryLending"
"30 Easy Vegetarian Recipes For Weeknights – Unique Easy Vegetarian Meals (Quick and Easy Dinner Recipes – The Easy Weeknight Dinners Collection)","B009OWM3EG","Item Owner","Purchase"
"Ski-running","B0084C5DZ8","Item Owner","Purchase"
"The Golden Sayings of Epictetus","B0082ZJFCO","Item Owner","Purchase"
"Meditations","B0082XJGRK","Item Owner","Purchase"
"Not Available","B005LDBI6G","Item Owner","Purchase"
"Not Available","B000JQUXOS","Item Owner","Purchase"
"Not Available","B09QCX4JK7","Item Owner","Purchase"
"Not Available","B09Q1SQ567","Item Owner","Purchase"
"Not Available","B09DTHWW83","Item Owner","Purchase"
"Not Available","B09DT9P11L","Item Owner","Purchase"
"Not Available","B093B4BGRK","Item Owner","Purchase"
"Not Available","B0DWV8NJDF","Not Interested","GR"
"The Art Thief: A True Story of Love, Crime, and a Dangerous Obsession","0525657320","Not Interested","GR"
"Rabbits for Food","B07GD51NCJ","Item Owner","PublicLibraryLending"
"Choosing to Run: A Memoir","0593186648","Not Interested","GR"
"Zero Days","B0BHTN6TL6","Item Owner","PublicLibraryLending"
"Small Mercies: A Detective Mystery","B0B7NDZNDV","Item Owner","PublicLibraryLending"
"Going Zero: A Novel","006322707X","Not Interested","GR"
"Code Name Blue Wren: The True Story of America's Most Dangerous Female Spy—and the Sister She Betrayed","B09XBGYWSR","Item Owner","PublicLibraryLending"
"Gone to the Wolves: A Novel","0374603332","Not Interested","GR"
"My Murder: A Novel","B0BHCXVWGT","Item Owner","PublicLibraryLending"
"Sprinting Through No Man's Land: Endurance, Tragedy, and Rebirth in the 1919 Tour de France","B08DHSFM4Q","Item Owner","Purchase"
"Running Is a Kind of Dreaming: A Memoir","B08RZ4PTSF","Item Owner","Purchase"
"The Glass Hotel: A novel","B07RL58ZDG","Item Owner","Purchase"
"Palm Beach, Finland","B07HB5DKQX","Item Owner","Purchase"
"Winter Loon: A Novel","B07BDKJVWS","Item Owner","Purchase"
"The Man Who Died","B075SPBQDV","Item Owner","Purchase"
"The Best American Series: 14 Short Stories & Essays","B017RLXECU","Item Owner","Purchase"
"How to Survive: Self-Reliance in Extreme Circumstances","B08D4QJRY2","Item Owner","PublicLibraryLending"
"The Celebrants: A Read with Jenna Pick: A Novel","B0B9WRWFH6","Item Owner","PublicLibraryLending"
"The Dirty Tricks Department: Stanley Lovell, the OSS, and the Masterminds of World War II Secret Warfare","1250280249","Not Interested","GR"
"Lipsmackin' Vegetarian Backpackin'","0762725311","Item Owner","Purchase"
"The Trackers: A Search for a Fugitive in Depression-Era America","B0B6JSJQLH","Item Owner","PublicLibraryLending"
"The It Girl","1982155264","Not Interested","GR"
"Apples Never Fall","B08PG6CKZJ","Item Owner","PublicLibraryLending"
"We Share the Sun: The Incredible Journey of Kenya's Legendary Running Coach Patrick Sang and the Fastest Runners on Earth","B0B3Y4RYX6","Not Interested","GR"
"The Appeal: A Novel","B098433CGQ","Not Interested","GR"
"A Calendar of Wisdom: Daily Thoughts to Nourish the Soul, Written and Se","B003L77UKC","Item Owner","KindleUnlimited"
"Mrs. Ted Bliss","B00AG8GXVQ","Item Owner","PublicLibraryLending"
"The Marriage Portrait: Reese's Book Club: A novel","B09RTYQW2S","Item Owner","PublicLibraryLending"
"Birnam Wood: A Novel","B09Y46DSD7","Item Owner","PublicLibraryLending"
"Lapvona: A Novel","B09GW3P1KJ","Item Owner","PublicLibraryLending"
"Blaze Me a Sun: A Novel About a Crime (Halland Suite)","B09XL59MJX","Item Owner","PublicLibraryLending"
