"Product Name","ASIN","Genre"
"The Modern Classics Myth of Sisyphus (Penguin Modern Classics)","0141182008","Politics & Social Sciences"
"Rush Limbaugh Is a Big Fat Idiot : And Other Observations","0141018410","Humor & Entertainment"
"Rush Limbaugh Is a Big Fat Idiot : And Other Observations","0141018410","Literature & Fiction"
"Subdivision: A Novel","1644450488","Mystery, Thriller & Suspense"
"Subdivision: A Novel","1644450488","Literature & Fiction"
"Klara and the Sun: A GMA Book Club Pick: A novel","059331817X","Science Fiction & Fantasy"
"Klara and the Sun: A GMA Book Club Pick: A novel","059331817X","Literature & Fiction"
"Walden or, Life in the Woods","B0059EFI4U","Biographies & Memoirs"
"Walden or, Life in the Woods","B0059EFI4U","Politics & Social Sciences"
"The Lion, the Witch and the Wardrobe (Chronicles of Narnia)","B000QQKTGI","Children's Books"
"The Lion, the Witch and the Wardrobe (Chronicles of Narnia)","B000QQKTGI","Literature & Fiction"
"The Jungle: The Uncensored Original Edition","1884365302","Literature & Fiction"
"Sub 4:00: Alan Webb and the Quest for the Fastest Mile","1594860564","Sports & Outdoors"
"The Last Lecture","1401323251","Biographies & Memoirs"
"The Last Lecture","1401323251","Self-Help"
"A Thousand Acres: A Novel","1400033837","Literature & Fiction"
"The Alienist","0812976142","Mystery, Thriller & Suspense"
"The Alienist","0812976142","Literature & Fiction"
"Cold Mountain: A Novel","0802142842","Literature & Fiction"
"Ficciones","0802130305","Literature & Fiction"
"Red Harvest","0752852612","Mystery, Thriller & Suspense"
"Red Harvest","0752852612","Literature & Fiction"
"The Beautiful and Damned","0743451503","Literature & Fiction"
"Jonathan Livingston Seagull","0743278909","Literature & Fiction"
"Assassination Vacation","074326004X","History"
"Assassination Vacation","074326004X","Biographies & Memoirs"
"John Adams","0743223136","History"
"John Adams","0743223136","Biographies & Memoirs"
"The Old Man And The Sea (Scribner Classics) (Hemingway Library Edition)","0684830493","Literature & Fiction"
"Oh, the Places You'll Go!","0679805273","Children's Books"
"American Sphinx: The Character of Thomas Jefferson","0679764410","History"
"American Sphinx: The Character of Thomas Jefferson","0679764410","Biographies & Memoirs"
"In Cold Blood","0679745580","Biographies & Memoirs"
"In Cold Blood","0679745580","Literature & Fiction"
"The Grifters","0679732489","Mystery, Thriller & Suspense"
"The Grifters","0679732489","Literature & Fiction"
"Ada, or Ardor: A Family Chronicle","0679725229","Literature & Fiction"
"I, Claudius From the Autobiography of Tiberius Claudius Born 10 B.C. Murdered and Deified A.D. 54 (Vintage International)","067972477X","Literature & Fiction"
"Double Indemnity","0679723226","Mystery, Thriller & Suspense"
"Double Indemnity","0679723226","Literature & Fiction"
"Running Dog","0679722947","Mystery, Thriller & Suspense"
"Running Dog","0679722947","Literature & Fiction"
"The Thin Man","0679722637","Mystery, Thriller & Suspense"
"The Thin Man","0679722637","Literature & Fiction"
"1919: Volume Two of the U.S.A. Trilogy (U.S.A. Trilogy, 2)","0618056823","Mystery, Thriller & Suspense"
"1919: Volume Two of the U.S.A. Trilogy (U.S.A. Trilogy, 2)","0618056823","Literature & Fiction"
"The 42nd Parallel: Volume One of the U.S.A. Trilogy (U.S.A. Trilogy, 1)","0618056815","Literature & Fiction"
"Tortilla Flat","0582461502","Literature & Fiction"
"The Bell Jar","0571268862","Literature & Fiction"
"The Clan of the Cave Bear: Earth's Children, Book One","0553381679","Science Fiction & Fantasy"
"The Clan of the Cave Bear: Earth's Children, Book One","0553381679","Literature & Fiction"
"The Tell-Tale Heart (Bantam Classics)","0553212281","Literature & Fiction"
"Prayer for Owen Meany (Export Ed.)","0552135399","Mystery, Thriller & Suspense"
"Prayer for Owen Meany (Export Ed.)","0552135399","Literature & Fiction"
"Rabbit at Rest","0449911942","Literature & Fiction"
"Rabbit, Run","0449911659","Literature & Fiction"
"The Cat in the Hat","039480001X","Children's Books"
"The Big Sleep (A Philip Marlowe Novel)","0394758285","Mystery, Thriller & Suspense"
"The Big Sleep (A Philip Marlowe Novel)","0394758285","Literature & Fiction"
"The Long Goodbye","0394757688","Mystery, Thriller & Suspense"
"Breakfast of Champions: A Novel","0385334206","Science Fiction & Fantasy"
"Breakfast of Champions: A Novel","0385334206","Literature & Fiction"
"Crossing to Safety (Modern Library Classics)","037575931X","Literature & Fiction"
"Lincoln: A Novel (The American Chronicle Series)","0375708766","Literature & Fiction"
"The World According to Garp","0345915593","Literature & Fiction"
"The Killer Angels: The Classic Novel of the Civil War","0345348109","Literature & Fiction"
"Franny and Zooey","0316769029","Literature & Fiction"
"Running with Scissors: A Memoir","031242227X","Biographies & Memoirs"
"Flowers for Algernon","015603008X","Science Fiction & Fantasy"
"Flowers for Algernon","015603008X","Literature & Fiction"
"The Kitchen God's Wife: A Novel","0143038109","Literature & Fiction"
"The Canterbury Tales","0140424385","Literature & Fiction"
"Freakonomics [Revised and Expanded]: A Rogue Economist Explores the Hidden Side of Everything","0061234001","Science & Math"
"Freakonomics [Revised and Expanded]: A Rogue Economist Explores the Hidden Side of Everything","0061234001","Business & Money"
"Freakonomics [Revised and Expanded]: A Rogue Economist Explores the Hidden Side of Everything","0061234001","Politics & Social Sciences"
"Ham on Rye: A Novel","006117758X","Literature & Fiction"
"Their Eyes Were Watching God","0061120065","Literature & Fiction"
"I Know This Much Is True (Oprah's Book Club)","0060987561","Mystery, Thriller & Suspense"
"I Know This Much Is True (Oprah's Book Club)","0060987561","Literature & Fiction"
"Where the Sidewalk Ends","0060513039","Children's Books"
"Malibu Rising: A Novel","B08L9QD4NH","Literature & Fiction"
"The Midnight Library: A GMA Book Club Pick (A Novel)","B085S8BSYS","Literature & Fiction"
"Alice in Wonderland: The Original 1865 Edition With Complete Illustrations By Sir John Tenniel (A Classic Novel of Lewis Carroll)","B0948LPG76","Children's Books"
"Alice in Wonderland: The Original 1865 Edition With Complete Illustrations By Sir John Tenniel (A Classic Novel of Lewis Carroll)","B0948LPG76","Literature & Fiction"
"A People's History of The United States 1492- Present","B007CDYGTO","History"
"A People's History of The United States 1492- Present","B007CDYGTO","Politics & Social Sciences"
"Malibu Rising: A Read with Jenna Pick: A Novel","1524798657","Literature & Fiction"
"Tropic of Capricorn (Miller, Henry)","0802151825","Literature & Fiction"
"The Electric Kool-Aid Acid Test","0553380648","History"
"The Midnight Library: A GMA Book Club Pick: A Novel","0525559477","Literature & Fiction"
"Hamlet (Cambridge School Shakespeare)","0521618746","Literature & Fiction"
"80/20 Running: Run Stronger and Race Faster by Training Slower","0451470885","Sports & Outdoors"
"80/20 Running: Run Stronger and Race Faster by Training Slower","0451470885","Health, Fitness & Dieting"
"A Supposedly Fun Thing I'll Never Do Again: Essays and Arguments","0316925284","Literature & Fiction"
"Charlotte's Web","0064410935","Children's Books"
"The Crying of Lot 49 (Perennial Fiction Library)","006091307X","Mystery, Thriller & Suspense"
"The Crying of Lot 49 (Perennial Fiction Library)","006091307X","Literature & Fiction"
"The 4-Hour Body: An Uncommon Guide to Rapid Fat-Loss, Incredible Sex, and Becoming Superhuman","B003EI2EH2","Health, Fitness & Dieting"
"The Science of Running: How to find your limit and train to maximize your performance","B00II6SY4W","Sports & Outdoors"
"Raft of Stars: A Novel","B08BLMJ576","Mystery, Thriller & Suspense"
"Raft of Stars: A Novel","B08BLMJ576","Literature & Fiction"
"God Carlos","B008TY8BQ4","Literature & Fiction"
"The Picture of Dorian Gray (Annotated): Oscar Wilde's 1891 Original Novel Length Version","B0CPCB8FJQ","Literature & Fiction"
"The Picture of Dorian Gray (Annotated): Oscar Wilde's 1891 Original Novel Length Version","B0CPCB8FJQ","LGBTQ+ Books"
"Fleishman Is in Trouble: A Novel","B07RGXBTNW","Literature & Fiction"
"The Christmas Scorpion: A Jack Reacher Story","B07H1YMCRW","Mystery, Thriller & Suspense"
"The Christmas Scorpion: A Jack Reacher Story","B07H1YMCRW","Literature & Fiction"
"Stiff: The Curious Lives of Human Cadavers","B07D1FY27M","Science & Math"
"Outside Looking In: A Novel","B07C2FQ8GQ","Literature & Fiction"
"The Runner: Four Years Living and Running in the Wilderness","B07BSH3F8H","Biographies & Memoirs"
"The Oracle Year: A Novel","B072HLSHDY","Science Fiction & Fantasy"
"The Oracle Year: A Novel","B072HLSHDY","Mystery, Thriller & Suspense"
"The Oracle Year: A Novel","B072HLSHDY","Literature & Fiction"
"Endure: Mind, Body, and the Curiously Elastic Limits of Human Performance","B0716GZX33","Sports & Outdoors"
"Endure: Mind, Body, and the Curiously Elastic Limits of Human Performance","B0716GZX33","Self-Help"
"Endure: Mind, Body, and the Curiously Elastic Limits of Human Performance","B0716GZX33","Health, Fitness & Dieting"
"The Woman in the Window: A Novel","B06Y55Z36S","Mystery, Thriller & Suspense"
"The Woman in the Window: A Novel","B06Y55Z36S","Literature & Fiction"
"The Thirst: A Harry Hole Novel (Harry Hole Series Book 11)","B01M1FJTB5","Mystery, Thriller & Suspense"
"Blitzed: Drugs in the Third Reich","B01IAS9G94","History"
"Before the Fall","B0196KVVGQ","Mystery, Thriller & Suspense"
"Before the Fall","B0196KVVGQ","Literature & Fiction"
"The Stranger by Albert Camus (1989) Paperback","B01181UBSU","Literature & Fiction"
"When Breath Becomes Air: Pulitzer Prize Finalist","B00XSSYR50","Biographies & Memoirs"
"Trouble Boys: The True Story of the Replacements","B00B3M3VMI","Arts & Photography"
"Trouble Boys: The True Story of the Replacements","B00B3M3VMI","Biographies & Memoirs"
"Worth Dying For: A Jack Reacher Novel","B009IJ0GSA","Mystery, Thriller & Suspense"
"Worth Dying For: A Jack Reacher Novel","B009IJ0GSA","Literature & Fiction"
"Nickel and Dimed","B0075OQY3Q","History"
"Nickel and Dimed","B0075OQY3Q","Politics & Social Sciences"
"Othello (Folger Shakespeare Library)","B006U1QW78","Literature & Fiction"
"The Sun Also Rises","B005PYJ9S0","Literature & Fiction"
"Why We Run: A Natural History","B001O7ESCE","Science & Math"
"Why We Run: A Natural History","B001O7ESCE","Sports & Outdoors"
"How Bad Do You Want It?: Mastering the Psychology of Mind over Muscle","1937715418","Sports & Outdoors"
"Poverty Creek Journal (Tupelo Press's Life in Art)","193679750X","Sports & Outdoors"
"Poverty Creek Journal (Tupelo Press's Life in Art)","193679750X","Literature & Fiction"
"Heart of Darkness (Green Integer)","1892295490","Literature & Fiction"
"Again to Carthage","1891369776","Sports & Outdoors"
"Again to Carthage","1891369776","Literature & Fiction"
"Ghost Wall","1783784458","Literature & Fiction"
"Ego is the Enemy: The Fight to Master Our Greatest Opponent","1781257027","Business & Money"
"Ego is the Enemy: The Fight to Master Our Greatest Opponent","1781257027","Self-Help"
"Running the Dream: One Summer Living, Training, and Racing with a Team of World-Class Runners Half My Age","164313762X","Sports & Outdoors"
"The Passion Paradox: A Guide to Going All In, Finding Success, and Discovering the Benefits of an Unbalanced Life","1635653436","Business & Money"
"The Passion Paradox: A Guide to Going All In, Finding Success, and Discovering the Benefits of an Unbalanced Life","1635653436","Self-Help"
"Milk!: A 10,000-Year Food Fracas","1632863820","History"
"Milk!: A 10,000-Year Food Fracas","1632863820","Cookbooks, Food & Wine"
"American Fire: Love, Arson, and Life in a Vanishing Land","1631490516","Biographies & Memoirs"
"The North Water: A Novel","1627795944","Mystery, Thriller & Suspense"
"The North Water: A Novel","1627795944","Literature & Fiction"
"Runner's World Train Smart, Run Forever: How to Become a Fit and Healthy Lifelong Runner by Following The Innovative 7-Hour Workout Week","1623367468","Sports & Outdoors"
"Runner's World Train Smart, Run Forever: How to Become a Fit and Healthy Lifelong Runner by Following The Innovative 7-Hour Workout Week","1623367468","Health, Fitness & Dieting"
"My Marathon: Reflections on a Gold Medal Life","1623367247","Sports & Outdoors"
"My Marathon: Reflections on a Gold Medal Life","1623367247","Biographies & Memoirs"
"Running Is My Therapy: Relieve Stress and Anxiety, Fight Depression, Ditch Bad Habits, and Live Happier","1615194444","Sports & Outdoors"
"Running Is My Therapy: Relieve Stress and Anxiety, Fight Depression, Ditch Bad Habits, and Live Happier","1615194444","Health, Fitness & Dieting"
"The Messiah Method: The Seven Disciplines of the Winningest College Soccer Program in America","1613790252","Sports & Outdoors"
"The Messiah Method: The Seven Disciplines of the Winningest College Soccer Program in America","1613790252","Religion & Spirituality"
"I Swear I'll Make It Up to You: A Life on the Low Road","1610395581","Biographies & Memoirs"
"I Swear I'll Make It Up to You: A Life on the Low Road","1610395581","Self-Help"
"I Swear I'll Make It Up to You: A Life on the Low Road","1610395581","Health, Fitness & Dieting"
"Fates and Furies: A Novel","1594634475","Literature & Fiction"
"The Girl on the Train","1594633665","Mystery, Thriller & Suspense"
"The Girl on the Train","1594633665","Literature & Fiction"
"The Kite Runner","159463193X","Literature & Fiction"
"The Brief Wondrous Life of Oscar Wao (Pulitzer Prize Winner)","1594489580","Literature & Fiction"
"How Not to Be Wrong: The Power of Mathematical Thinking","1594205221","Science & Math"
"The Poison Squad: One Chemist's Single-Minded Crusade for Food Safety at the Turn of the Twentieth Century","1594205140","History"
"The Poison Squad: One Chemist's Single-Minded Crusade for Food Safety at the Turn of the Twentieth Century","1594205140","Biographies & Memoirs"
"Redeployment","1594204993","Literature & Fiction"
"Eats, Shoots & Leaves: The Zero Tolerance Approach to Punctuation","1592402038","Reference"
"The Sports Gene: Inside the Science of Extraordinary Athletic Performance","1591845114","Sports & Outdoors"
"Comfortable with Uncertainty: 108 Teachings on Cultivating Fearlessness and Compassion","1590300785","Self-Help"
"Comfortable with Uncertainty: 108 Teachings on Cultivating Fearlessness and Compassion","1590300785","Religion & Spirituality"
"Comfortable with Uncertainty: 108 Teachings on Cultivating Fearlessness and Compassion","1590300785","Health, Fitness & Dieting"
"Ultramarathon Man: Confessions of an All-Night Runner","1585424803","Sports & Outdoors"
"Ultramarathon Man: Confessions of an All-Night Runner","1585424803","Biographies & Memoirs"
"Oedipus Rex: Literary Touchstone Edition","1580495931","Literature & Fiction"
"Today We Die a Little!: The Inimitable Emil Zátopek, the Greatest Olympic Runner of All Time","1568585497","Sports & Outdoors"
"Today We Die a Little!: The Inimitable Emil Zátopek, the Greatest Olympic Runner of All Time","1568585497","Biographies & Memoirs"
"Stephen Florida","1566894646","Literature & Fiction"
"Water for Elephants: A Novel","1565125606","Literature & Fiction"
"A Christmas Carol (Great Stories)","1561797464","Literature & Fiction"
"The Adventures of Alexander Von Humboldt (Pantheon Graphic Library)","1524747378","History"
"The Adventures of Alexander Von Humboldt (Pantheon Graphic Library)","1524747378","Comics & Graphic Novels"
"Mrs. Fletcher: A Novel","1501144022","Literature & Fiction"
"Zero K: A Novel","1501135392","Literature & Fiction"
"Loner: A Novel","1501107895","Mystery, Thriller & Suspense"
"Loner: A Novel","1501107895","Literature & Fiction"
"The Happy Runner: Love the Process, Get Faster, Run Longer","1492567647","Sports & Outdoors"
"Roughneck","1476773998","Comics & Graphic Novels"
"Racing the Rain: A Novel","1476769869","Literature & Fiction"
"The Mars Room: A Novel","1476756554","Mystery, Thriller & Suspense"
"The Mars Room: A Novel","1476756554","Literature & Fiction"
"The Dorito Effect: The Surprising New Truth About Food and Flavor","1476724210","Cookbooks, Food & Wine"
"The Dorito Effect: The Surprising New Truth About Food and Flavor","1476724210","Health, Fitness & Dieting"
"Two Hours: The Quest to Run the Impossible Marathon","145168584X","Sports & Outdoors"
"Faster Road Racing: 5K to Half Marathon","1450470459","Sports & Outdoors"
"Enter Night: Metallica: The Biography","1409112950","Arts & Photography"
"Enter Night: Metallica: The Biography","1409112950","Biographies & Memoirs"
"Salt Sugar Fat: How the Food Giants Hooked Us","1400069807","Health, Fitness & Dieting"
"The Power of Habit: Why We Do What We Do in Life and Business","1400069289","Business & Money"
"The Power of Habit: Why We Do What We Do in Life and Business","1400069289","Self-Help"
"The Power of Habit: Why We Do What We Do in Life and Business","1400069289","Health, Fitness & Dieting"
"Blood, Bones & Butter: The Inadvertent Education of a Reluctant Chef","140006872X","Biographies & Memoirs"
"Blood, Bones & Butter: The Inadvertent Education of a Reluctant Chef","140006872X","Cookbooks, Food & Wine"
"Behind the Beautiful Forevers: Life, Death, and Hope in a Mumbai Undercity","1400067553","History"
"The Thousand Autumns of Jacob De Zoet, A Novel","1400065453","Literature & Fiction"
"The Immortal Life of Henrietta Lacks","1400052173","Biographies & Memoirs"
"Beloved: Pulitzer Prize Winner","1400033411","Literature & Fiction"
"The Secret History","1400031702","Mystery, Thriller & Suspense"
"The Secret History","1400031702","Literature & Fiction"
"Maybe You Should Talk To Someone: A Therapist, HER Therapist, and Our Lives Revealed","1328662055","Self-Help"
"Maybe You Should Talk To Someone: A Therapist, HER Therapist, and Our Lives Revealed","1328662055","Health, Fitness & Dieting"
"Fire and Fury: Inside the Trump White House","1250158060","History"
"Fire and Fury: Inside the Trump White House","1250158060","Biographies & Memoirs"
"Fire and Fury: Inside the Trump White House","1250158060","Politics & Social Sciences"
"Northmen: The Viking Saga, AD 793-1241","1250106141","History"
"Marathon Man: My 26.2-Mile Journey from Unknown Grad Student to the Top of the Running World","1250016983","Sports & Outdoors"
"Marathon Man: My 26.2-Mile Journey from Unknown Grad Student to the Top of the Running World","1250016983","Biographies & Memoirs"
"The Nix: A novel","110194661X","Literature & Fiction"
"Running & Being: The Total Experience","0966631803","Sports & Outdoors"
"Running & Being: The Total Experience","0966631803","Health, Fitness & Dieting"
"Factotum","0876852630","Literature & Fiction"
"Pre: The Story of America's Greatest Running Legend, Steve Prefontaine","0875964575","Sports & Outdoors"
"Pre: The Story of America's Greatest Running Legend, Steve Prefontaine","0875964575","Biographies & Memoirs"
"Howl and Other Poems (City Lights Pocket Poets Series)","0872863107","Literature & Fiction"
"Black Hawk Down: A Story of Modern War","0871137380","History"
"10:04: A Novel","0865478104","Literature & Fiction"
"Who Is Rich?: A Novel","0812997980","Literature & Fiction"
"Lake Success: A Novel","0812997417","Literature & Fiction"
"Thunder & Lightning: Weather Past, Present, Future","0812993179","Comics & Graphic Novels"
"The Largesse of the Sea Maiden: Stories","0812988639","Literature & Fiction"
"The Age of Miracles","0812983602","Science Fiction & Fantasy"
"The Age of Miracles","0812983602","Literature & Fiction"
"The Sorrows of Young Werther (Modern Library Classics)","0812969901","Literature & Fiction"
"The Castle","0805211063","Literature & Fiction"
"We Sinners: A Novel","0805095330","Literature & Fiction"
"Being Mortal: Medicine and What Matters in the End","0805095152","Medical Books"
"Personal (Jack Reacher)","0804178747","Mystery, Thriller & Suspense"
"Personal (Jack Reacher)","0804178747","Literature & Fiction"
"Olympic Collision: The Story of Mary Decker and Zola Budd","0803290845","Sports & Outdoors"
"Olympic Collision: The Story of Mary Decker and Zola Budd","0803290845","History"
"Olympic Collision: The Story of Mary Decker and Zola Budd","0803290845","Biographies & Memoirs"
"At Home: A Short History of Private Life","0767919386","History"
"Barkskins: A Novel","0743288785","Literature & Fiction"
"Benjamin Franklin: An American Life","074325807X","History"
"Benjamin Franklin: An American Life","074325807X","Biographies & Memoirs"
"The Parade","0735277524","Mystery, Thriller & Suspense"
"The Parade","0735277524","Literature & Fiction"
"You're on an Airplane: A Self-Mythologizing Memoir","0735218196","Biographies & Memoirs"
"Range: Why Generalists Triumph in a Specialized World","0735214484","Sports & Outdoors"
"Range: Why Generalists Triumph in a Specialized World","0735214484","Medical Books"
"Range: Why Generalists Triumph in a Specialized World","0735214484","Health, Fitness & Dieting"
"The Daily Show with Jon Stewart Presents America (The Book): A Citizen's Guide to Democracy Inaction","0713998946","Humor & Entertainment"
"The Daily Show with Jon Stewart Presents America (The Book): A Citizen's Guide to Democracy Inaction","0713998946","Literature & Fiction"
"Tender Is the Night (Cover May Vary)","068480154X","Literature & Fiction"
"The Order of Things: An Archaeology of the Human Sciences","0679753354","Literature & Fiction"
"The Order of Things: An Archaeology of the Human Sciences","0679753354","Politics & Social Sciences"
"All the Pretty Horses (The Border Trilogy, Book 1)","0679744398","Literature & Fiction"
"Darkness Visible: A Memoir of Madness","0679736395","Biographies & Memoirs"
"Darkness Visible: A Memoir of Madness","0679736395","Health, Fitness & Dieting"
"American Psycho","0679735771","Mystery, Thriller & Suspense"
"American Psycho","0679735771","Literature & Fiction"
"Notes from Underground (Vintage Classics)","067973452X","Literature & Fiction"
"The Rise & Fall of Great Powers","0679643656","Literature & Fiction"
"End Zone","0671820125","Literature & Fiction"
"The Outsiders","0670532576","Teen & Young Adult"
"The Outsiders","0670532576","Children's Books"
"The Outsiders","0670532576","Literature & Fiction"
"The Girl with the Dragon Tattoo: Book One Of The Millenium Trilogy (Millennium Series)","0670069019","Science Fiction & Fantasy"
"The Girl with the Dragon Tattoo: Book One Of The Millenium Trilogy (Millennium Series)","0670069019","Mystery, Thriller & Suspense"
"A Tale for the Time Being (ALA Notable Books for Adults)","0670026638","Literature & Fiction"
"Every Love Story Is a Ghost Story: A Life of David Foster Wallace","0670025925","Biographies & Memoirs"
"Every Love Story Is a Ghost Story: A Life of David Foster Wallace","0670025925","Literature & Fiction"
"When the Killing's Done: A Novel","0670022322","Literature & Fiction"
"The Grapes of Wrath: 75th Anniversary Edition","067001690X","Literature & Fiction"
"Extremely Loud And Incredibly Close: A Novel","0618711651","Literature & Fiction"
"The Perfect Mile: Three Athletes, One Goal, and Less Than Four Minutes to Achieve It","0618562095","Sports & Outdoors"
"The Perfect Mile: Three Athletes, One Goal, and Less Than Four Minutes to Achieve It","0618562095","History"
"The Perfect Mile: Three Athletes, One Goal, and Less Than Four Minutes to Achieve It","0618562095","Biographies & Memoirs"
"The Devil in the White City: Murder, Magic, and Madness at the Fair That Changed America","0609608444","History"
"The Devil in the White City: Murder, Magic, and Madness at the Fair That Changed America","0609608444","Biographies & Memoirs"
"Gone Tomorrow","0593057058","Mystery, Thriller & Suspense"
"Gone Tomorrow","0593057058","Literature & Fiction"
"The Unbearable Lightness of Being","0571224385","Literature & Fiction"
"Evicted: Poverty and Profit in the American City","0553447432","Politics & Social Sciences"
"Weapons of Math Destruction: How Big Data Increases Inequality and Threatens Democracy","0553418815","Science & Math"
"Weapons of Math Destruction: How Big Data Increases Inequality and Threatens Democracy","0553418815","Business & Money"
"Weapons of Math Destruction: How Big Data Increases Inequality and Threatens Democracy","0553418815","Politics & Social Sciences"
"The House of the Spirits: A Novel","0553383809","Literature & Fiction"
"A Brief History of Time","0553380168","Science & Math"
"Journey to the Centre of the Earth (Bantam Classics)","0553213970","Science Fiction & Fantasy"
"Journey to the Centre of the Earth (Bantam Classics)","0553213970","Literature & Fiction"
"Eat & Run: My Unlikely Journey to Ultramarathon Greatness","0547569653","Sports & Outdoors"
"Eat & Run: My Unlikely Journey to Ultramarathon Greatness","0547569653","Health, Fitness & Dieting"
"What If?: Serious Scientific Answers to Absurd Hypothetical Questions","0544272994","Science & Math"
"What If?: Serious Scientific Answers to Absurd Hypothetical Questions","0544272994","Humor & Entertainment"
"Stuff Matters: Exploring the Marvelous Materials That Shape Our Man-Made World","0544236041","Science & Math"
"Stuff Matters: Exploring the Marvelous Materials That Shape Our Man-Made World","0544236041","History"
"How Not to Die Alone","0525539883","Literature & Fiction"
"Stillness Is the Key","0525538585","Business & Money"
"Stillness Is the Key","0525538585","Self-Help"
"Stillness Is the Key","0525538585","Politics & Social Sciences"
"My Year of Rest and Relaxation: A Novel","0525522131","Literature & Fiction"
"The River: A novel","0525521879","Mystery, Thriller & Suspense"
"The River: A novel","0525521879","Literature & Fiction"
