"Product Name","ASIN","Genre"
"Heartwood (A Read with Jenna Pick): A Novel","1668063603","Mystery, Thriller & Suspense"
"Heartwood (A Read with Jenna Pick): A Novel","1668063603","Literature & Fiction"
"Heartwood (A Read with Jenna Pick): A Novel","1668063603","Mystery, Thriller & Suspense"
"Heartwood (A Read with Jenna Pick): A Novel","1668063603","Literature & Fiction"
"Life as No One Knows It: The Physics of Life's Emergence","0593191897","Science & Math"
"Life as No One Knows It: The Physics of Life's Emergence","0593191897","Science & Math"
"Turbulence: A Novel","1982122730","Literature & Fiction"
"Turbulence: A Novel","1982122730","Literature & Fiction"
"The Woman in Suite 11: A Novel","B0DJM99D77","Mystery, Thriller & Suspense"
"The Woman in Suite 11: A Novel","B0DJM99D77","Mystery, Thriller & Suspense"
"The Last One at the Wedding: A Novel","1250895782","Mystery, Thriller & Suspense"
"The Last One at the Wedding: A Novel","1250895782","Mystery, Thriller & Suspense"
"The Maid's Secret: A Maid Novel (Molly the Maid Book 3)","B0D9F3KFPM","Mystery, Thriller & Suspense"
"The Maid's Secret: A Maid Novel (Molly the Maid Book 3)","B0D9F3KFPM","Literature & Fiction"
"The River Is Waiting (Oprah's Book Club): A Novel","B0DHDF2RDL","Mystery, Thriller & Suspense"
"The River Is Waiting (Oprah's Book Club): A Novel","B0DHDF2RDL","Literature & Fiction"
"The River Is Waiting (Oprah's Book Club): A Novel","B0DHDF2RDL","Mystery, Thriller & Suspense"
"The River Is Waiting (Oprah's Book Club): A Novel","B0DHDF2RDL","Literature & Fiction"
"The Game","0470835842","Sports & Outdoors"
"The Game","0470835842","Sports & Outdoors"
"Aldo Leopold: A Sand County Almanac & Other Writings on Conservation and Ecology (LOA #238) (Library of America)","B00BUP18U0","Science & Math"
"Aldo Leopold: A Sand County Almanac & Other Writings on Conservation and Ecology (LOA #238) (Library of America)","B00BUP18U0","Biographies & Memoirs"
"The Rider","1582342903","Sports & Outdoors"
"The Rider","1582342903","Biographies & Memoirs"
"The Rider","1582342903","Sports & Outdoors"
"The Rider","1582342903","Biographies & Memoirs"
"The Wedding People: A Novel","B0CJ839C56","Literature & Fiction"
"The Emperor of Gladness: Oprah's Book Club: A Novel","059383187X","Literature & Fiction"
"On the Calculation of Volume (Book I): Shortlisted for the 2025 International Booker Prize","0811237257","Science Fiction & Fantasy"
"Run for the Hills: From the NYT Bestselling Author of Nothing to See Here","0063317516","Literature & Fiction"
"Flesh: A Novel","198212279X","Literature & Fiction"
"Tilt: A Novel","B0CWFMT5SC","Literature & Fiction"
"Careless People: A Cautionary Tale of Power, Greed, and Lost Idealism","B0DY9TZD8Z","Biographies & Memoirs"
"Audition: A Novel","059385232X","Mystery, Thriller & Suspense"
"Audition: A Novel","059385232X","Literature & Fiction"
"The Hedgehog’s Dilemma","B0D57LWBM6","Literature & Fiction"
"The Murder Show","1250325722","Mystery, Thriller & Suspense"
"The Murder Show","1250325722","Literature & Fiction"
"I See You've Called in Dead: A Novel","B0DC7V6RMG","Literature & Fiction"
"CABIN: Off the Grid Adventures with a Clueless Craftsman","1250285704","Biographies & Memoirs"
"Kills Well with Others","0593638514","Mystery, Thriller & Suspense"
"Kills Well with Others","0593638514","Literature & Fiction"
"The Passenger Seat","1771966300","Mystery, Thriller & Suspense"
"The Passenger Seat","1771966300","Literature & Fiction"
"Rental House: A Novel","0593545540","Literature & Fiction"
"Fifty in Reverse: A Novel","1982152672","Science Fiction & Fantasy"
"Fifty in Reverse: A Novel","1982152672","Literature & Fiction"
"Hansons Marathon Method: Run Your Fastest Marathon the Hansons Way","B0CDDCJ6P2","Sports & Outdoors"
"Martin Dressler: The Tale of an American Dreamer (Vintage Contemporaries)","B004089I6A","Literature & Fiction"
"The Botany of Desire: A Plant's-Eye View of the World","B000FC1H14","Science & Math"
"Beartooth: A Novel","1954118023","Mystery, Thriller & Suspense"
"Beartooth: A Novel","1954118023","Literature & Fiction"
"Peak Performance: Elevate Your Game, Avoid Burnout, and Thrive with the New Science of Success","162336793X","Business & Money"
"Peak Performance: Elevate Your Game, Avoid Burnout, and Thrive with the New Science of Success","162336793X","Self-Help"
"Banana: The Fate of the Fruit That Changed the World","1594630380","Science & Math"
"Banana: The Fate of the Fruit That Changed the World","1594630380","History"
"The Ghost Map: The Story of London's Most Terrifying Epidemic and How It Changed Science, Cities, and the Modern World","1594489254","Science & Math"
"The Ghost Map: The Story of London's Most Terrifying Epidemic and How It Changed Science, Cities, and the Modern World","1594489254","History"
"The Ghost Map: The Story of London's Most Terrifying Epidemic and How It Changed Science, Cities, and the Modern World","1594489254","Biographies & Memoirs"
"Out of Thin Air: Running Wisdom and Magic from Above the Clouds in Ethiopia: Winner of the Margaret Mead Award 2022","1472975324","Sports & Outdoors"
"Out of Thin Air: Running Wisdom and Magic from Above the Clouds in Ethiopia: Winner of the Margaret Mead Award 2022","1472975324","Biographies & Memoirs"
"The Incomplete Book of Running","1451696248","Sports & Outdoors"
"The Incomplete Book of Running","1451696248","Biographies & Memoirs"
"North Woods: A Novel","0593597036","Literature & Fiction"
"Somebody's Fool: A novel (North Bath Trilogy)","0593317890","Literature & Fiction"
"My Year of Running Dangerously: A Dad, a Daughter, and a Ridiculous Plan","0399175474","Sports & Outdoors"
"My Year of Running Dangerously: A Dad, a Daughter, and a Ridiculous Plan","0399175474","Biographies & Memoirs"
"James (Pulitzer Prize Winner): A Novel","0385550367","Literature & Fiction"
"Memoirs of Hadrian (FSG Classics)","0374529264","Literature & Fiction"
"Fast Girl: A Life Spent Running from Madness","0062346229","Biographies & Memoirs"
"Fast Girl: A Life Spent Running from Madness","0062346229","Health, Fitness & Dieting"
"No Room at the Morgue","B081M4F8GH","Mystery, Thriller & Suspense"
"Stoner (New York Review Books Classics)","B003K15IF8","Literature & Fiction"
"Dead Money: A Novel","0593726707","Mystery, Thriller & Suspense"
"The Miraculous from the Material: Understanding the Wonders of Nature","0593701488","Science & Math"
"Frostbite: How Refrigeration Changed Our Food, Our Planet, and Ourselves","B0CJTKZCTR","Science & Math"
"Frostbite: How Refrigeration Changed Our Food, Our Planet, and Ourselves","B0CJTKZCTR","Politics & Social Sciences"
"The Bones of Bascom Hall (A Nora Barnes and Toby Sandler Mystery)","B0DMDYK6Y6","Mystery, Thriller & Suspense"
"Everything Is Predictable: How Bayesian Statistics Explain Our World","1668052601","Science & Math"
"Hansons Half-Marathon Method: Run Your Best Half-Marathon the Hansons Way","B00JV2H5I8","Sports & Outdoors"
"Hansons Half-Marathon Method: Run Your Best Half-Marathon the Hansons Way","B00JV2H5I8","Health, Fitness & Dieting"
"The Last Ranger: A novel","B0BL6YQ61Y","Mystery, Thriller & Suspense"
"The Last Ranger: A novel","B0BL6YQ61Y","Literature & Fiction"
"Embers of the Hands: Hidden Histories of the Viking Age","1324089237","History"
"The Wide Wide Sea: Imperial Ambition, First Contact and the Fateful Final Voyage of Captain James Cook","B0CC1J32NG","History"
"The Wide Wide Sea: Imperial Ambition, First Contact and the Fateful Final Voyage of Captain James Cook","B0CC1J32NG","Biographies & Memoirs"
"The Wide Wide Sea: Imperial Ambition, First Contact and the Fateful Final Voyage of Captain James Cook","0385544766","History"
"The Wide Wide Sea: Imperial Ambition, First Contact and the Fateful Final Voyage of Captain James Cook","0385544766","Biographies & Memoirs"
"Godwin: A Novel","0593701321","Literature & Fiction"
"Blackouts: A Novel","B0BQGDMFH6","Literature & Fiction"
"Blackouts: A Novel","B0BQGDMFH6","LGBTQ+ Books"
"To the Limit: The Meaning of Endurance from Mexico to the Himalayas","1399403427","Sports & Outdoors"
"The Secret Lives of Booksellers and Librarians: True Stories of the Magic of Reading (Heroes Among Us Book 4)","B0CDWDLCNS","Literature & Fiction"
"Orbital: A Novel (Booker Prize Winner)","B0BZ5Y513V","Literature & Fiction"
"The God of the Woods: A Novel","B0CL1YQLB5","Mystery, Thriller & Suspense"
"The God of the Woods: A Novel","B0CL1YQLB5","Literature & Fiction"
"The Heart in Winter: A Novel","0385550596","Literature & Fiction"
"Burn: A novel","0593801628","Mystery, Thriller & Suspense"
"Burn: A novel","0593801628","Literature & Fiction"
"Martyr!: A novel","0593537610","Literature & Fiction"
"The God of the Woods: A Novel","0593418913","Mystery, Thriller & Suspense"
"The God of the Woods: A Novel","0593418913","Literature & Fiction"
"Getting to Know Death: A Meditation","1639734449","Biographies & Memoirs"
"The Ministry of Time: A Novel","1668045141","Science Fiction & Fantasy"
"The Ministry of Time: A Novel","1668045141","Romance"
"The Ministry of Time: A Novel","1668045141","Literature & Fiction"
"Safe Enough: Crime Stories by the Author of Jack Reacher","B0CW1J3Y5G","Mystery, Thriller & Suspense"
"Safe Enough: Crime Stories by the Author of Jack Reacher","B0CW1J3Y5G","Literature & Fiction"
"Blood Test: A Comedy","0593700856","Literature & Fiction"
"That Librarian: The Fight Against Book Banning in America","B0CQFXKTPW","Biographies & Memoirs"
"That Librarian: The Fight Against Book Banning in America","B0CQFXKTPW","Politics & Social Sciences"
"The Life Impossible: A Novel","B0CGZFPKTZ","Literature & Fiction"
"Checkout 19: A Novel","B097XBXQ1T","Literature & Fiction"
"The Sequel: A Novel (The Book Series 2)","B0CQHM2KL5","Mystery, Thriller & Suspense"
"The Sequel: A Novel (The Book Series 2)","B0CQHM2KL5","Literature & Fiction"
"Here One Moment","0593798600","Mystery, Thriller & Suspense"
"Here One Moment","0593798600","Literature & Fiction"
"We Solve Murders: A Novel","B0CQJHF3HQ","Mystery, Thriller & Suspense"
"Creation Lake: A Novel","1982116528","Mystery, Thriller & Suspense"
"Creation Lake: A Novel","1982116528","Literature & Fiction"
"The Kind Worth Killing: A Novel","0062267523","Mystery, Thriller & Suspense"
"The Kind Worth Killing: A Novel","0062267523","Literature & Fiction"
"A Talent for Murder: A Novel","0063205033","Mystery, Thriller & Suspense"
"A Talent for Murder: A Novel","0063205033","Literature & Fiction"
"A (Very) Short History of Life on Earth: 4.6 Billion Years in 12 Pithy Chapters","B092T8QDYW","Science & Math"
"A (Very) Short History of Life on Earth: 4.6 Billion Years in 12 Pithy Chapters","B092T8QDYW","History"
"Invitation to a Banquet: A History of Chinese Food","B0BWGKNK7G","History"
"Invitation to a Banquet: A History of Chinese Food","B0BWGKNK7G","Cookbooks, Food & Wine"
"I Cheerfully Refuse","B0CH1NHWNW","Literature & Fiction"
"The Midnight Feast: An NPR Best Book of the Year","B0CL3FMNKJ","Mystery, Thriller & Suspense"
"The Midnight Feast: An NPR Best Book of the Year","B0CL3FMNKJ","Literature & Fiction"
"End of Story: An Enthralling Thriller with a Suspenseful Plot, Get Lost in the Pages and Unravel the Mystery","B078R46LCY","Mystery, Thriller & Suspense"
"End of Story: An Enthralling Thriller with a Suspenseful Plot, Get Lost in the Pages and Unravel the Mystery","B078R46LCY","Literature & Fiction"
"The Hunter: A Novel","B0C7729CF8","Mystery, Thriller & Suspense"
"The Hunter: A Novel","B0C7729CF8","Literature & Fiction"
"The Hunter: A Novel","0593493435","Mystery, Thriller & Suspense"
"The Hunter: A Novel","0593493435","Literature & Fiction"
"The Pale Blue Eye: A Novel","B000GCFX6S","Mystery, Thriller & Suspense"
"The Pale Blue Eye: A Novel","B000GCFX6S","Literature & Fiction"
"The Demon of Unrest: A Saga of Hubris, Heartbreak, and Heroism at the Dawn of the Civil War","B0CDKLBD2W","History"
"The Demon of Unrest: A Saga of Hubris, Heartbreak, and Heroism at the Dawn of the Civil War","B0CDKLBD2W","Biographies & Memoirs"
"Who Owns This Sentence?: A History of Copyrights and Wrongs","B0C97F8KPY","History"
"Outsider: An Old Man, a Mountain and the Search for a Hidden Past","B0B7NZHCKR","Biographies & Memoirs"
"The Winner: A Novel","0063353598","Mystery, Thriller & Suspense"
"The Winner: A Novel","0063353598","Literature & Fiction"
"Still Waters: A Novel","1250325692","Mystery, Thriller & Suspense"
"Still Waters: A Novel","1250325692","Literature & Fiction"
"The Body in Question: A Novel","B07RT71Z48","Mystery, Thriller & Suspense"
"The Body in Question: A Novel","B07RT71Z48","Literature & Fiction"
"One Perfect Couple","B0CL5G23ZF","Mystery, Thriller & Suspense"
"The Golden Spoon: A Novel","B0B3Y9JVMK","Mystery, Thriller & Suspense"
"The Golden Spoon: A Novel","B0B3Y9JVMK","Literature & Fiction"
"The Ferryman: A Novel","B0B8GZ58DK","Science Fiction & Fantasy"
"The Ferryman: A Novel","B0B8GZ58DK","Mystery, Thriller & Suspense"
"Balloon Dog","B09X34KMRM","Literature & Fiction"
"The Aosawa Murders","B07QN87LQB","Mystery, Thriller & Suspense"
"I Hope This Finds You Well: A Novel","B0CJ9TSSYB","Romance"
"I Hope This Finds You Well: A Novel","B0CJ9TSSYB","Literature & Fiction"
"Tokyo Ueno Station (National Book Award Winner): A Novel","B081914PR7","Literature & Fiction"
"A Travel Guide to the Middle Ages: The World Through Medieval Eyes","B0C97G1ZR6","History"
"A Young People's History of the United States (For Young People Series)","B003B4IW2U","History"
"The Heaven & Earth Grocery Store: A Novel","B0BPNP7YQB","Literature & Fiction"
"The Covenant of Water (Oprah's Book Club)","B0BJSGV831","Literature & Fiction"
"The Day Tripper: A Powerful Time Travel Redemption Story of Small Actions Leading to Big Consequences","B0C4PX8RD7","Science Fiction & Fantasy"
"The Day Tripper: A Powerful Time Travel Redemption Story of Small Actions Leading to Big Consequences","B0C4PX8RD7","Literature & Fiction"
"Shape: The Hidden Geometry of Information, Biology, Strategy, Democracy, and EverythingElse","B08PF965W9","Science & Math"
"Wandering Stars: A novel","B0C772ZLMQ","Literature & Fiction"
"The Upstairs Delicatessen: On Eating, Reading, Reading About Eating, and Eating While Reading","B0BQGHJM5L","Biographies & Memoirs"
"The Upstairs Delicatessen: On Eating, Reading, Reading About Eating, and Eating While Reading","B0BQGHJM5L","Cookbooks, Food & Wine"
"Salvation of a Saint: A Detective Galileo Novel (Detective Galileo Series Book 2)","B007RMYE9M","Mystery, Thriller & Suspense"
"Zero at the Bone: Fifty Entries Against Despair","B0BQGJVCMT","Literature & Fiction"
"The Fury","B0BXTB6HSN","Mystery, Thriller & Suspense"
"Ordinary Grace: A Novel","B008J2G5Y6","Mystery, Thriller & Suspense"
"Ordinary Grace: A Novel","B008J2G5Y6","Literature & Fiction"
"Scenes from a Childhood — WINNER OF THE 2023 NOBEL PRIZE IN LITERATURE","B07BX82VS9","Literature & Fiction"
"The Clementine Complex","B0BTZRQHJM","Humor & Entertainment"
"The Clementine Complex","B0BTZRQHJM","Mystery, Thriller & Suspense"
"The Clementine Complex","B0BTZRQHJM","Literature & Fiction"
"Everyone on This Train Is a Suspect: A Novel (The Ernest Cunningham Mysteries Book 2)","B0C6KMGND1","Mystery, Thriller & Suspense"
"Everyone on This Train Is a Suspect: A Novel (The Ernest Cunningham Mysteries Book 2)","B0C6KMGND1","Literature & Fiction"
"Northwoods: A Novel","B0C7RPT9B3","Mystery, Thriller & Suspense"
"Northwoods: A Novel","B0C7RPT9B3","Literature & Fiction"
"I Know What You Did: A Novel","B0BJP5QFFM","Mystery, Thriller & Suspense"
"Heart Sutra","B0B72HGHW8","Literature & Fiction"
"You Dreamed of Empires: A Novel","B0C1YCKNK1","Literature & Fiction"
"Northwoods: A Novel","B0C7RQ8Y2F","Mystery, Thriller & Suspense"
"Northwoods: A Novel","B0C7RQ8Y2F","Literature & Fiction"
"The Devotion of Suspect X: A Detective Galileo Novel (Detective Galileo Series Book 1)","B0044781ZQ","Mystery, Thriller & Suspense"
"The Devotion of Suspect X: A Detective Galileo Novel (Detective Galileo Series Book 1)","B0044781ZQ","Literature & Fiction"
"Prophet Song: A Novel (Booker Prize Winner)","B0CLQVQSVL","Literature & Fiction"
"Someone Who Will Love You in All Your Damaged Glory: Stories","B07HDT9JFX","Literature & Fiction"
"None of This Is True: A Novel","B0BDMPQ2FC","Mystery, Thriller & Suspense"
"None of This Is True: A Novel","B0BDMPQ2FC","Literature & Fiction"
"Diary of a Void: A Novel","B09LHBX5KV","Literature & Fiction"
"None of This Is True: A Novel","1982179007","Mystery, Thriller & Suspense"
"None of This Is True: A Novel","1982179007","Literature & Fiction"
"The MANIAC","0593654471","Literature & Fiction"
"True North: A Novel","B0C592RHNC","Literature & Fiction"
"The Librarianist: A Novel","B0BH4QWM85","Literature & Fiction"
"Martyr!: A novel","B0C3C886FY","Literature & Fiction"
"The Restaurant Inspector","B0927NRBFB","Literature & Fiction"
"The Guest List: A Novel","B07WG8L7WC","Mystery, Thriller & Suspense"
"The Guest List: A Novel","B07WG8L7WC","Literature & Fiction"
"The Killing Hills (The Mick Hardin Novels Book 1)","B08TF1VTGX","Mystery, Thriller & Suspense"
"The Killing Hills (The Mick Hardin Novels Book 1)","B08TF1VTGX","Literature & Fiction"
"Aliss at the Fire — WINNER OF THE 2023 NOBEL PRIZE IN LITERATURE","B09RMQJCZJ","Literature & Fiction"
"Shutter Island","B000JMKNV0","Mystery, Thriller & Suspense"
"Shutter Island","B000JMKNV0","Literature & Fiction"
"Good Bad Girl: A Novel","B0BST5X6GS","Mystery, Thriller & Suspense"
"Hello Beautiful (Oprah's Book Club): A Novel","B0B7R4Q5DJ","Literature & Fiction"
"The Day of the Jackal","0553266306","Mystery, Thriller & Suspense"
"The Day of the Jackal","0553266306","Literature & Fiction"
"Ninth House (Ninth House Series Book 1)","B07LF64DZ2","Science Fiction & Fantasy"
"The Soulmate: A Novel","B09Y467GZY","Mystery, Thriller & Suspense"
"The Soulmate: A Novel","B09Y467GZY","Literature & Fiction"
"Everyone in My Family Has Killed Someone: A Novel (The Ernest Cunningham Mysteries Book 1)","B09Y94K74X","Science Fiction & Fantasy"
"Everyone in My Family Has Killed Someone: A Novel (The Ernest Cunningham Mysteries Book 1)","B09Y94K74X","Mystery, Thriller & Suspense"
"Everyone in My Family Has Killed Someone: A Novel (The Ernest Cunningham Mysteries Book 1)","B09Y94K74X","Literature & Fiction"
"Blood Meridian: Or the Evening Redness in the West","0679728759","Literature & Fiction"
"Babel: Or the Necessity of Violence: An Arcane History of the Oxford Translators’ Revolution—An Historic Fantasy of Dark Academia, Perfect for Fans of ... Fiction and Nineteenth Century England","B09MD95S5V","Science Fiction & Fantasy"
"Babel: Or the Necessity of Violence: An Arcane History of the Oxford Translators’ Revolution—An Historic Fantasy of Dark Academia, Perfect for Fans of ... Fiction and Nineteenth Century England","B09MD95S5V","Literature & Fiction"
"Lay Your Body Down: A Novel of Suspense","B09721CTG1","Mystery, Thriller & Suspense"
"Lay Your Body Down: A Novel of Suspense","B09721CTG1","Literature & Fiction"
"The Plotters: A Novel","B07CWDMQ45","Mystery, Thriller & Suspense"
"The Plotters: A Novel","B07CWDMQ45","Literature & Fiction"
"Smarter Not Harder: The Biohacker's Guide to Getting the Body and Mind You Want","B0B399L6KP","Health, Fitness & Dieting"
"Four Thousand Weeks: Time Management for Mortals","B08FGV64B1","Self-Help"
"Yellowface: A Chilling Novel of Racism and Cultural Appropriation from the author of Katabasis","B0B9SN8K6H","Science Fiction & Fantasy"
"Yellowface: A Chilling Novel of Racism and Cultural Appropriation from the author of Katabasis","B0B9SN8K6H","Mystery, Thriller & Suspense"
"Yellowface: A Chilling Novel of Racism and Cultural Appropriation from the author of Katabasis","B0B9SN8K6H","Literature & Fiction"
"Wellness: A Novel (Oprah's Book Club)","B0BR511292","Literature & Fiction"
"The Mystery Guest: A Maid Novel (Molly the Maid Book 2)","B0C5LRCM2F","Mystery, Thriller & Suspense"
"The Mystery Guest: A Maid Novel (Molly the Maid Book 2)","B0C5LRCM2F","Literature & Fiction"
"Fast After 50: How to Race Strong for the Rest of Your Life","1937715264","Sports & Outdoors"
"Fast After 50: How to Race Strong for the Rest of Your Life","1937715264","Health, Fitness & Dieting"
"The Spy Who Came in from the Cold: A George Smiley Novel (George Smiley Novels Book 3)","B006CUDDUG","Science Fiction & Fantasy"
"The Spy Who Came in from the Cold: A George Smiley Novel (George Smiley Novels Book 3)","B006CUDDUG","Mystery, Thriller & Suspense"
"The Spy Who Came in from the Cold: A George Smiley Novel (George Smiley Novels Book 3)","B006CUDDUG","Literature & Fiction"
"I Have Some Questions for You: A Novel","B09ZRWP8DS","Mystery, Thriller & Suspense"
"I Have Some Questions for You: A Novel","B09ZRWP8DS","Literature & Fiction"
"The Longest Race: Inside the Secret World of Abuse, Doping, and Deception on Nike's Elite Running Team","1982179147","Sports & Outdoors"
"The Longest Race: Inside the Secret World of Abuse, Doping, and Deception on Nike's Elite Running Team","1982179147","Biographies & Memoirs"
"Beastie Boys Book","0812995546","Arts & Photography"
"Beastie Boys Book","0812995546","Biographies & Memoirs"
"North Woods: A Novel","B0BPX7SF89","Literature & Fiction"
"Chain Gang All Stars: A Read with Jenna Pick: National Book Award Finalist","B0B5ST3XX4","Science Fiction & Fantasy"
"Chain Gang All Stars: A Read with Jenna Pick: National Book Award Finalist","B0B5ST3XX4","Literature & Fiction"
"Starter Villain","B0B9KVXCQ6","Science Fiction & Fantasy"
"Starter Villain","B0B9KVXCQ6","Literature & Fiction"
"Breaking and Entering","B0BKH7G2X8","Mystery, Thriller & Suspense"
"Breaking and Entering","B0BKH7G2X8","Literature & Fiction"
"Slow Horses (Slough House Book 1)","B004HW7DZ2","Mystery, Thriller & Suspense"
"Trust (Pulitzer Prize Winner)","B09BV2JNWV","Literature & Fiction"
"No One Will Miss Her: A Dark and Compelling Mystery with a Devious Plot, Get Ready to Unravel the Secrets!","B08SMFSLVQ","Mystery, Thriller & Suspense"
"No One Will Miss Her: A Dark and Compelling Mystery with a Devious Plot, Get Ready to Unravel the Secrets!","B08SMFSLVQ","Literature & Fiction"
"The Sullivanians: Sex, Psychotherapy, and the Wild Life of an American Commune","B0BBC769LV","History"
"The Sullivanians: Sex, Psychotherapy, and the Wild Life of an American Commune","B0BBC769LV","Religion & Spirituality"
"The Sullivanians: Sex, Psychotherapy, and the Wild Life of an American Commune","B0BBC769LV","Politics & Social Sciences"
"Somebody's Fool: A novel (North Bath Trilogy Book 3)","B0BKKVQPLB","Literature & Fiction"
"The Rise: A Short Story","B0CBW58P3J","Mystery, Thriller & Suspense"
"The Fraud: A Novel","B0BP66G6B7","Literature & Fiction"
"How Can I Help You","B0BJNKTFGH","Mystery, Thriller & Suspense"
"How Can I Help You","B0BJNKTFGH","Literature & Fiction"
"The Last Devil to Die: A Thursday Murder Club Mystery (Thursday Murder Club Mysteries Book 4)","B0BQLKNTYR","Mystery, Thriller & Suspense"
"The Vaster Wilds: A Novel","B0BTVBH6G3","Literature & Fiction"
"The Girl in the Eagle's Talons: A Lisbeth Salander Novel (The Girl with the Dragon Tattoo (Lisbeth Salander / Millennium) Book 7)","B0BLY7J9DC","Mystery, Thriller & Suspense"
"What You Are Looking For Is in the Library: A Touching Narrative of Self-Discovery, Community Bonds and the Joys of Reading in Tokyo's Libraries","B0BT82YGGF","Science Fiction & Fantasy"
"What You Are Looking For Is in the Library: A Touching Narrative of Self-Discovery, Community Bonds and the Joys of Reading in Tokyo's Libraries","B0BT82YGGF","Literature & Fiction"
"Small World: A Novel","B08T6CL58V","Literature & Fiction"
"The Golden Couple: A Novel","B092T947PJ","Mystery, Thriller & Suspense"
"The Golden Couple: A Novel","B092T947PJ","Literature & Fiction"
"Ella Minnow Pea: A Novel in Letters","0385722435","Literature & Fiction"
"How Minds Change: The Surprising Science of Belief, Opinion, and Persuasion","B093R2CP2V","Science & Math"
"How Minds Change: The Surprising Science of Belief, Opinion, and Persuasion","B093R2CP2V","Business & Money"
"How Minds Change: The Surprising Science of Belief, Opinion, and Persuasion","B093R2CP2V","Self-Help"
"Path Lit by Lightning: The Life of Jim Thorpe","B09JPFYQY2","Sports & Outdoors"
"Path Lit by Lightning: The Life of Jim Thorpe","B09JPFYQY2","Biographies & Memoirs"
"Tom Lake: A Reese’s Book Club Pick","B0BL126WSH","Literature & Fiction"
"Good Family","1250810175","Mystery, Thriller & Suspense"
"The School of Hard Talks: How to Have Real Conversations with Your (Almost Grown) Kids","1632174707","Parenting & Relationships"
"The School of Hard Talks: How to Have Real Conversations with Your (Almost Grown) Kids","1632174707","Health, Fitness & Dieting"
"I Am Homeless If This Is Not My Home: A novel","B0BG13PH57","Literature & Fiction"
"National Geographic Guide to National Parks of the United States, 8th Edition (National Geographic Guide to the National Parks of the United States)","B016TG0SAK","Travel"
"National Geographic Guide to National Parks of the United States, 8th Edition (National Geographic Guide to the National Parks of the United States)","B016TG0SAK","Reference"
"Mac's Problem","B07GJBCLHN","Literature & Fiction"
"One by One","B084G9Z5C3","Mystery, Thriller & Suspense"
"One by One","B084G9Z5C3","Literature & Fiction"
"The Art Thief: A True Story of Love, Crime, and a Dangerous Obsession","0525657320","Biographies & Memoirs"
"Rabbits for Food","B07GD51NCJ","Literature & Fiction"
"Choosing to Run: A Memoir","0593186648","Sports & Outdoors"
"Choosing to Run: A Memoir","0593186648","Biographies & Memoirs"
"Zero Days","B0BHTN6TL6","Mystery, Thriller & Suspense"
"Zero Days","B0BHTN6TL6","Literature & Fiction"
