"Product Name","ASIN","Genre"
"The Know-It-All: One Man's Humble Quest to Become the Smartest Person in the World","0743250605","Biographies & Memoirs"
"The Know-It-All: One Man's Humble Quest to Become the Smartest Person in the World","0743250605","Literature & Fiction"
"Candyfreak: A Journey through the Chocolate Underbelly of America","1565124219","Biographies & Memoirs"
"Mind Wide Open: Your Brain and the Neuroscience of Everyday Life","0743241657","Science & Math"
"Mind Wide Open: Your Brain and the Neuroscience of Everyday Life","0743241657","Self-Help"
"The Fabric of the Cosmos: Space, Time, and the Texture of Reality","0375412883","Science & Math"
"African Perspectives on Colonialism (The Johns Hopkins Symposia in Comparative History)","0801839319","History"
"African Perspectives on Colonialism (The Johns Hopkins Symposia in Comparative History)","0801839319","Politics & Social Sciences"
"One Stick Song","1882413768","Literature & Fiction"
"Herland (Dover Thrift Editions: Classic Novels)","0486404293","Science Fiction & Fantasy"
"Herland (Dover Thrift Editions: Classic Novels)","0486404293","Literature & Fiction"
"Plato: Complete Works","0872203492","Politics & Social Sciences"
"Poetics (Dover Thrift Editions: Philosophy)","048629577X","Literature & Fiction"
"Poetics (Dover Thrift Editions: Philosophy)","048629577X","Politics & Social Sciences"
"Mythology: Timeless Tales of Gods and Heroes","0446607258","Literature & Fiction"
"Slouching Towards Bethlehem: Essays","0374521727","Literature & Fiction"
"My Soul Is Rested: The Story of the Civil Rights Movement in the Deep South","0140067531","Literature & Fiction"
"My Soul Is Rested: The Story of the Civil Rights Movement in the Deep South","0140067531","Politics & Social Sciences"
"Utopia (Dover Thrift Editions: Philosophy)","0486295834","Literature & Fiction"
"Utopia (Dover Thrift Editions: Philosophy)","0486295834","Politics & Social Sciences"
"Always Running: La Vida Loca: Gang Days in L.A.","0671882317","Biographies & Memoirs"
"Always Running: La Vida Loca: Gang Days in L.A.","0671882317","Politics & Social Sciences"
"The Leadership Secrets of Colin Powell","0071388591","Business & Money"
"The Merriam-Webster Dictionary","087779930X","Reference"
"We Wish to Inform You That Tomorrow We Will be Killed With Our Families: Stories from Rwanda","0312243359","History"
"We Wish to Inform You That Tomorrow We Will be Killed With Our Families: Stories from Rwanda","0312243359","Biographies & Memoirs"
"We Wish to Inform You That Tomorrow We Will be Killed With Our Families: Stories from Rwanda","0312243359","Politics & Social Sciences"
"Mythology","0316341517","Literature & Fiction"
"The Bhagavad-Gita : Krishna's Counsel in Time of War (Bantam Classics)","0553213652","Religion & Spirituality"
"The Bhagavad-Gita : Krishna's Counsel in Time of War (Bantam Classics)","0553213652","Literature & Fiction"
"The Bhagavad-Gita : Krishna's Counsel in Time of War (Bantam Classics)","0553213652","Politics & Social Sciences"
"Zhuangzi Speaks: The Music of Nature","0691008825","Religion & Spirituality"
"Zhuangzi Speaks: The Music of Nature","0691008825","Politics & Social Sciences"
"The Wealth and Poverty of Nations: Why Some Are So Rich and Some So Poor","0393318885","Business & Money"
"The Wealth and Poverty of Nations: Why Some Are So Rich and Some So Poor","0393318885","History"
"The Wealth and Poverty of Nations: Why Some Are So Rich and Some So Poor","0393318885","Politics & Social Sciences"
"Why Is Sex Fun?: The Evolution of Human Sexuality (Science Masters)","0465031269","Science & Math"
"Why Is Sex Fun?: The Evolution of Human Sexuality (Science Masters)","0465031269","Politics & Social Sciences"
"Third Chimpanzee, The","0060984031","Science & Math"
"Third Chimpanzee, The","0060984031","History"
"Third Chimpanzee, The","0060984031","Politics & Social Sciences"
"The Republic (Dover Thrift Editions: Philosophy)","0486411214","Literature & Fiction"
"The Republic (Dover Thrift Editions: Philosophy)","0486411214","Politics & Social Sciences"
"The Wisdom of Crowds: Why the Many Are Smarter Than the Few and How Collective Wisdom Shapes Business, Economies, Societies and Nations","0385503865","Science & Math"
"The Wisdom of Crowds: Why the Many Are Smarter Than the Few and How Collective Wisdom Shapes Business, Economies, Societies and Nations","0385503865","Business & Money"
"The Wisdom of Crowds: Why the Many Are Smarter Than the Few and How Collective Wisdom Shapes Business, Economies, Societies and Nations","0385503865","Politics & Social Sciences"
"Reading Lolita in Tehran: A Memoir in Books","081297106X","Biographies & Memoirs"
"Reading Lolita in Tehran: A Memoir in Books","081297106X","Literature & Fiction"
"Don't Let the Pigeon Drive the Bus!","078681988X","Children's Books"
"Guns, Germs, and Steel: The Fates of Human Societies","0393317552","Science & Math"
"Guns, Germs, and Steel: The Fates of Human Societies","0393317552","History"
"Guns, Germs, and Steel: The Fates of Human Societies","0393317552","Politics & Social Sciences"
"A Short History of Nearly Everything","076790818X","Science & Math"
"A Short History of Nearly Everything","076790818X","History"
"Betrayal of Trust: The Collapse of Global Public Health","0786884401","History"
"Betrayal of Trust: The Collapse of Global Public Health","0786884401","Medical Books"
"Betrayal of Trust: The Collapse of Global Public Health","0786884401","Politics & Social Sciences"
"Dinosaur Friends!","1929927207","Children's Books"
"First Light: The Search for the Edge of the Universe","0812991850","Science & Math"
"The Coming Plague: Newly Emerging Diseases in a World Out of Balance","0140250913","Science & Math"
"The Coming Plague: Newly Emerging Diseases in a World Out of Balance","0140250913","Medical Books"
"Mrs. Chippy's Last Expedition: The Remarkable Journal of Shackleton's Polar-Bound Cat","0060932619","Literature & Fiction"
"Out of Control: The New Biology of Machines, Social Systems, & the Economic World","0201483408","Science & Math"
"Out of Control: The New Biology of Machines, Social Systems, & the Economic World","0201483408","Business & Money"
"Out of Control: The New Biology of Machines, Social Systems, & the Economic World","0201483408","Politics & Social Sciences"
"Small Worlds: The Dynamics of Networks between Order and Randomness (Princeton Studies in Complexity)","0691117047","Science & Math"
"Big Book of Dinosaurs","1564587185","Children's Books"
"How Do Dinosaurs Count to Ten?","0439649498","Children's Books"
"Ten Terrible Dinosaurs","0525459057","Children's Books"
"Hidden Order: How Adaptation Builds Complexity (Helix Books)","0201442302","Science & Math"
"How Do Dinosaurs Clean Their Room?","0439649501","Children's Books"
"Dinosaur Roar! Board Book","0525458344","Children's Books"
"How Do Dinosaurs Get Well Soon?","0439241006","Children's Books"
"Sync: The Emerging Science of Spontaneous Order","0786868449","Science & Math"
"Moneyball: The Art of Winning an Unfair Game","0393057658","Sports & Outdoors"
"Moneyball: The Art of Winning an Unfair Game","0393057658","Business & Money"
"Patriot Reign: Bill Belichick, the Coaches, and the Players Who Built a Champion","0060757949","Sports & Outdoors"
"Patriot Reign: Bill Belichick, the Coaches, and the Players Who Built a Champion","0060757949","History"
"Patriot Reign: Bill Belichick, the Coaches, and the Players Who Built a Champion","0060757949","Biographies & Memoirs"
"Let Me Tell You a Story: A Lifetime in the Game","0316738239","Sports & Outdoors"
"Let Me Tell You a Story: A Lifetime in the Game","0316738239","Biographies & Memoirs"
"Sports Illustrated 50 Years: The Anniversary Book","1932273492","Sports & Outdoors"
"Sports Illustrated 50 Years: The Anniversary Book","1932273492","Arts & Photography"
"The Last Season: A Team In Search of Its Soul","1594200351","Sports & Outdoors"
"The Last Season: A Team In Search of Its Soul","1594200351","Biographies & Memoirs"
"Season of Life: A Football Star, a Boy, a Journey to Manhood","0743269748","Sports & Outdoors"
"*THE GAMES DO COUNT*: America's Best and Brightest on the Power of Sports","0060736739","Sports & Outdoors"
"*THE GAMES DO COUNT*: America's Best and Brightest on the Power of Sports","0060736739","History"
"*THE GAMES DO COUNT*: America's Best and Brightest on the Power of Sports","0060736739","Biographies & Memoirs"
"King Leopold's Ghost: A Story of Greed, Terror, and Heroism in Colonial Africa","0618001905","History"
"King Leopold's Ghost: A Story of Greed, Terror, and Heroism in Colonial Africa","0618001905","Biographies & Memoirs"
"Endurance: An Epic of Polar Adventure","0393319946","Travel"
"Endurance: An Epic of Polar Adventure","0393319946","History"
"Endurance: An Epic of Polar Adventure","0393319946","Biographies & Memoirs"
"Herodotus: The History","0226327728","Literature & Fiction"
"Cook : The Extraordinary Voyages of Captain James Cook","0802714129","History"
"Shackleton's Boat Journey","0393318648","Biographies & Memoirs"
"In Harm's Way: The Sinking of the USS Indianapolis and the Extraordinary Story of Its Survivors","0805066322","History"
"A Rumor of War","080504695X","History"
"A Rumor of War","080504695X","Biographies & Memoirs"
"The Enneagram Made Easy: Discover the 9 Types of People","0062510266","Self-Help"
"The Enneagram Made Easy: Discover the 9 Types of People","0062510266","Health, Fitness & Dieting"
"Virus X: Tracking the New Killer Plagues","0316763063","Science & Math"
"Virus X: Tracking the New Killer Plagues","0316763063","Medical Books"
"Angels in America: A Gay Fantasia on National Themes: Part One: Millennium Approaches Part Two: Perestroika","1559362316","Literature & Fiction"
"Virus Hunter: Thirty Years of Battling Hot Viruses Around the World","0385485581","Science & Math"
"Virus Hunter: Thirty Years of Battling Hot Viruses Around the World","0385485581","Medical Books"
"Virus Hunter: Thirty Years of Battling Hot Viruses Around the World","0385485581","Biographies & Memoirs"
"Blink: The Power of Thinking Without Thinking","0316172324","Business & Money"
"Blink: The Power of Thinking Without Thinking","0316172324","Self-Help"
"The Hot Zone: The Terrifying True Story of the Origins of the Ebola Virus","0385479565","Medical Books"
"Ten Things I Learned from Bill Porter: The Inspiring True Story of the Door-to-Door Salesman Who Changed Lives","157731459X","Self-Help"
"Unleashing the Ideavirus: Stop Marketing AT People! Turn Your Ideas into Epidemics by Helping Your Customers Do the Marketing thing for You.","0786887176","Business & Money"
"Unleashing the Ideavirus: Stop Marketing AT People! Turn Your Ideas into Epidemics by Helping Your Customers Do the Marketing thing for You.","0786887176","Self-Help"
"Marv Levy: Where Else Would You Rather Be?","158261797X","Sports & Outdoors"
"Marv Levy: Where Else Would You Rather Be?","158261797X","History"
"Marv Levy: Where Else Would You Rather Be?","158261797X","Biographies & Memoirs"
"Black Boy (The Restored Text Established by The Library of America) (Perennial Classics)","0060929782","Biographies & Memoirs"
"Black Boy (The Restored Text Established by The Library of America) (Perennial Classics)","0060929782","Literature & Fiction"
"Black Boy (The Restored Text Established by The Library of America) (Perennial Classics)","0060929782","Politics & Social Sciences"
"Anne Frank: The Diary of a Young Girl","0553296981","History"
"Anne Frank: The Diary of a Young Girl","0553296981","Biographies & Memoirs"
"St. Augustine Confessions (Oxford World's Classics)","0192833723","Religion & Spirituality"
"The Bad Guys Won! A Season of Brawling, Boozing, Bimbo-chasing, and Championship Baseball with Straw, Doc, Mookie, Nails, The Kid, and the Rest of the 1986 Mets, the Rowdiest Team Ever to Put on a New York Uniform--and Maybe the Best","0060507322","Sports & Outdoors"
"The Bad Guys Won! A Season of Brawling, Boozing, Bimbo-chasing, and Championship Baseball with Straw, Doc, Mookie, Nails, The Kid, and the Rest of the 1986 Mets, the Rowdiest Team Ever to Put on a New York Uniform--and Maybe the Best","0060507322","Biographies & Memoirs"
"Wait Till Next Year - A Memoir","0684847957","History"
"Wait Till Next Year - A Memoir","0684847957","Biographies & Memoirs"
"The Imaginary Girlfriend: A Memoir","0345458265","Biographies & Memoirs"
"Franz Kafka: A Biography","0306806703","Literature & Fiction"
"Passing Time: Memoir of a Vietnam Veteran Against the War","0870239589","History"
"Passing Time: Memoir of a Vietnam Veteran Against the War","0870239589","Biographies & Memoirs"
"A Child's Christmas In Wales and Five Poems","0060514671","Literature & Fiction"
"Shackleton","0786705442","Biographies & Memoirs"
"South: The Last Antarctic Expedition of Shackleton and the Endurance","1558217835","Travel"
"South: The Last Antarctic Expedition of Shackleton and the Endurance","1558217835","History"
"South: The Last Antarctic Expedition of Shackleton and the Endurance","1558217835","Biographies & Memoirs"
"Chronicles, Vol. 1","0743228154","Arts & Photography"
"Chronicles, Vol. 1","0743228154","Biographies & Memoirs"
"South: A Memoir of the Endurance Voyage","0786705973","Travel"
"South: A Memoir of the Endurance Voyage","0786705973","History"
"South: A Memoir of the Endurance Voyage","0786705973","Biographies & Memoirs"
"Wilco: Learning How to Die","0767915585","Arts & Photography"
"Wilco: Learning How to Die","0767915585","Biographies & Memoirs"
"Word Freak: Heartbreak, Triumph, Genius, and Obsession in the World of Competitive Scrabble Players","0142002267","Humor & Entertainment"
"Six Degrees: The Science of a Connected Age","0393041425","Science & Math"
"Six Degrees: The Science of a Connected Age","0393041425","Business & Money"
"Six Degrees: The Science of a Connected Age","0393041425","Politics & Social Sciences"
"Armageddon: The Battle for Germany, 1944-1945","0375414339","History"
"Deliver Us from Evil: Defeating Terrorism, Despotism, and Liberalism","0060582510","History"
"Deliver Us from Evil: Defeating Terrorism, Despotism, and Liberalism","0060582510","Politics & Social Sciences"
"Imperial Hubris: Why the West Is Losing the War on Terror","1574888498","History"
"Imperial Hubris: Why the West Is Losing the War on Terror","1574888498","Politics & Social Sciences"
"Biohazard: The Chilling True Story of the Largest Covert Biological Weapons Program in the World--Told from Inside by the Man Who Ran It","0385334966","History"
"Biohazard: The Chilling True Story of the Largest Covert Biological Weapons Program in the World--Told from Inside by the Man Who Ran It","0385334966","Politics & Social Sciences"
"Germs: Biological Weapons and America's Secret War","0684871599","History"
"Germs: Biological Weapons and America's Secret War","0684871599","Medical Books"
"Germs: Biological Weapons and America's Secret War","0684871599","Politics & Social Sciences"
"Plague Wars: The Terrifying Reality of Biological Warfare","0312263791","History"
"Julius Caesar (Folger Shakespeare Library)","0743482743","Literature & Fiction"
"Oh, Yuck! The Encyclopedia of Everything Nasty","0761107711","Children's Books"
"Guinness World Records 2005: Special 50th Anniversary Edition","1892051222","Reference"
"Can A Smart Person Believe In God","0785260242","Science & Math"
"Can A Smart Person Believe In God","0785260242","Religion & Spirituality"
"In the Shadow of No Towers (Pantheon Graphic Library)","0375423079","Comics & Graphic Novels"
"Living Terrors: What America Needs to Know to Survive the Coming Bioterrorist Catastrophe","0385334818","History"
"Living Terrors: What America Needs to Know to Survive the Coming Bioterrorist Catastrophe","0385334818","Politics & Social Sciences"
"The Moment of Complexity: Emerging Network Culture","0226791181","Politics & Social Sciences"
"The Million Word Crossword Dictionary","0060517565","Reference"
"The Million Word Crossword Dictionary","0060517565","Humor & Entertainment"
"The Tipping Point: How Little Things Can Make a Big Difference","0316346624","Business & Money"
"Small Pieces Loosely Joined: A Unified Theory Of The Web","0738208507","History"
"The Emergence of Everything: How the World Became Complex","019513513X","Science & Math"
"The Emergence of Everything: How the World Became Complex","019513513X","Politics & Social Sciences"
"A Room of One's Own (The Virginia Woolf Library)","0156787334","Literature & Fiction"
"Merriam-Webster's Collegiate Dictionary, 11th Edition, Jacketed Hardcover, Indexed","0877798095","Reference"
"At Home in the Universe: The Search for the Laws of Self-Organization and Complexity","0195111303","Science & Math"
"COMPLEXITY: THE EMERGING SCIENCE AT THE EDGE OF ORDER AND CHAOS","0671872346","Science & Math"
"COMPLEXITY: THE EMERGING SCIENCE AT THE EDGE OF ORDER AND CHAOS","0671872346","Politics & Social Sciences"
"Fry Me to the Moon","1879483580","History"
"The Official Scrabble Players Dictionary (Third Edition)","0877799156","Reference"
"Where Is Baby's Belly Button? A Lift-the-Flap Book","0689835604","Children's Books"
"How Do Dinosaurs Say Goodnight?","0590316818","Children's Books"
"Polar Bear Night","0439495245","Children's Books"
"The Trial and Death of Socrates","0872205541","Literature & Fiction"
"The Trial and Death of Socrates","0872205541","Politics & Social Sciences"
"Cliffsnotes on Homer's Iliad","076458586X","Literature & Fiction"
"Emergence: From Chaos To Order (Helix Books)","0738201421","Science & Math"
"Emergence: From Chaos To Order (Helix Books)","0738201421","Politics & Social Sciences"
"Speak, Memory: An Autobiography Revisited","0679723390","Literature & Fiction"
"The Odyssey","0374525749","Literature & Fiction"
"Ship Fever: Stories","0393316009","Literature & Fiction"
"CliffsNotes on Shakespeare's Othello (Cliffsnotes Literature Guides) (CliffsNotes on Literature)","0764585878","Literature & Fiction"
"The Wreck of the Whaleship Essex","0156006898","Literature & Fiction"
"Oleanna: A Play","067974536X","Literature & Fiction"
"The Loss of the Ship Essex, Sunk by a Whale: First-Person Accounts (Penguin Classics)","0140437967","History"
"The Loss of the Ship Essex, Sunk by a Whale: First-Person Accounts (Penguin Classics)","0140437967","Biographies & Memoirs"
"The Handmaid's Tale (Cliffs Notes)","0822005727","Literature & Fiction"
"Sam Shepard : Seven Plays (Buried Child, Curse of the Starving Class, The Tooth of Crime, La Turista, Tongues, Savage Love, True West)","0553346113","Literature & Fiction"
"American Buffalo","0802150578","Literature & Fiction"
"If I Die in a Combat Zone: Box Me Up and Ship Me Home","0767904435","History"
"If I Die in a Combat Zone: Box Me Up and Ship Me Home","0767904435","Biographies & Memoirs"
"Going After Cacciato: A Novel","0767904427","Literature & Fiction"
"Slow Learner","0316724432","Mystery, Thriller & Suspense"
"Slow Learner","0316724432","Literature & Fiction"
"The Oresteia: Agamemnon; The Libation Bearers; The Eumenides","0140443339","Literature & Fiction"
"The Three Theban Plays: Antigone; Oedipus the King; Oedipus at Colonus","0140444254","Literature & Fiction"
"CliffsNotes on Homer's The Odyssey (Cliffsnotes Literature Guides)","0764585991","Literature & Fiction"
"The Aeneid (Vintage Classics)","0679729526","Literature & Fiction"
"Medea (Dover Thrift Editions: Plays)","0486275485","Literature & Fiction"
"A Companion to V.","0820322512","Literature & Fiction"
"Antigone (Dover Thrift Editions: Plays)","0486278042","Literature & Fiction"
"CliffsNotes on Sophocles' Oedipus Trilogy (Cliffsnotes Literature Guides)","0764585819","Literature & Fiction"
"A Gravity's Rainbow Companion: Sources and Contexts for Pynchon's Novel","0820310263","Literature & Fiction"
"The Iliad","0140275363","Literature & Fiction"
"I'm Good Enough, I'm Smart Enough, and Doggone It, People Like Me!: Daily Affirmations By Stuart Smalley","0440504708","Humor & Entertainment"
"I'm Good Enough, I'm Smart Enough, and Doggone It, People Like Me!: Daily Affirmations By Stuart Smalley","0440504708","Literature & Fiction"
"The Things They Carried","0767902890","Literature & Fiction"
"The Handmaid's Tale","038549081X","Science Fiction & Fantasy"
"The Handmaid's Tale","038549081X","Literature & Fiction"
"Chain of Command: The Road from 9/11 to Abu Ghraib","0060195916","History"
"Chain of Command: The Road from 9/11 to Abu Ghraib","0060195916","Politics & Social Sciences"
"A Guide to Microsoft Office 2003 for Information and Communications Technologies","1580030785","Computers & Technology"
"Emergence: The Connected Lives of Ants, Brains, Cities, and Software","0684868768","Science & Math"
"Emergence: The Connected Lives of Ants, Brains, Cities, and Software","0684868768","Politics & Social Sciences"
"The Oh Really? Factor: Unspinning Fox News Channel's Bill O'Reilly","158322601X","History"
"The Oh Really? Factor: Unspinning Fox News Channel's Bill O'Reilly","158322601X","Politics & Social Sciences"
"Independence Day: Bascombe Trilogy 2 (Pulitzer Prize Winner)","0679735186","Literature & Fiction"
"That Old Ace in the Hole: A Novel","0743242483","Literature & Fiction"
"Brave New World Revisited","0060955511","Science Fiction & Fantasy"
"Brave New World Revisited","0060955511","Literature & Fiction"
"Brave New World Revisited","0060955511","Politics & Social Sciences"
"The Jane Austen Book Club","0399151613","Literature & Fiction"
"Four Great Plays by Henrik Ibsen (Bantam Classics)","055321280X","Literature & Fiction"
"In the Heart of the Sea: The Tragedy of the Whaleship Essex","0141001828","History"
"High Fidelity","1573225517","Literature & Fiction"
"The Collected Stories of Eudora Welty","0156189216","Literature & Fiction"
"Sophocles, The Oedipus Cycle: Oedipus Rex, Oedipus at Colonus, Antigone","015602764X","Literature & Fiction"
"Euripides I: Alcestis, The Medea, The Heracleidae, Hippolytus (The Complete Greek Tragedies)","0226307808","Literature & Fiction"
"Fasting Girls: The History of Anorexia Nervosa","0375724486","Self-Help"
"Fasting Girls: The History of Anorexia Nervosa","0375724486","Politics & Social Sciences"
"Lolita","0679723161","Literature & Fiction"
"The Annotated Lolita: Revised and Updated","0679727299","Literature & Fiction"
"The Odyssey","0140268863","Literature & Fiction"
"Angels in America, Part One: Millennium Approaches","1559360615","Literature & Fiction"
"James Joyce (Oxford Lives)","0195033817","Literature & Fiction"
"Martin Dressler: The Tale of an American Dreamer","0679781277","Literature & Fiction"
"Glengarry Glen Ross (An Evergreen Book)","0802130917","Literature & Fiction"
"The Birth of Venus","1400060737","Literature & Fiction"
"A Peterson Field Guide To Trees And Shrubs: Northeastern and north-central United States and southeastern and south-centralCanada (Peterson Field Guides)","039535370X","Science & Math"
"A Peterson Field Guide To Trees And Shrubs: Northeastern and north-central United States and southeastern and south-centralCanada (Peterson Field Guides)","039535370X","Sports & Outdoors"
"Lysistrata (Dover Thrift Editions: Plays)","0486282252","Literature & Fiction"
"A Companion to James Joyce's Ulysses: Biographical and Historical Contexts, Critical History, and Essays from Five Contemporary Critical Perspectives (Case Studies in Contemporary Criticism)","0312115989","Literature & Fiction"
"CliffsNotes on Shakespeare's Romeo and Juliet (Cliffsnotes Literature) (Cliffsnotes Literature Guides)","0764585924","Literature & Fiction"
"On Becoming a Novelist","0393320030","Reference"
"A Happy Death","0679764003","Literature & Fiction"
"Oedipus Rex (Dover Thrift Editions: Plays)","0486268772","Literature & Fiction"
"Sons and Lovers","0451518829","Literature & Fiction"
"James Joyce's Ulysses: A Study","0394700139","Children's Books"
"Othello","0743477553","Literature & Fiction"
"Over the Edge: Death in Grand Canyon","097009731X","Travel"
"Romeo and Juliet (Folger Shakespeare Library)","0743477111","Literature & Fiction"
"The Martian Chronicles (The Grand Master Editions)","0553278223","Science Fiction & Fantasy"
"The Martian Chronicles (The Grand Master Editions)","0553278223","Literature & Fiction"
"The New Bloomsday Book (Routledge International Studies in)","0415138582","Literature & Fiction"
"Stories of Anton Chekhov","0553381008","Literature & Fiction"
"What Einstein Told His Cook: Kitchen Science Explained","0393011836","Science & Math"
"What Einstein Told His Cook: Kitchen Science Explained","0393011836","Cookbooks, Food & Wine"
"Atonement: A Novel","038572179X","Mystery, Thriller & Suspense"
"Atonement: A Novel","038572179X","Literature & Fiction"
"Narrative of the Life of Frederick Douglass, An American Slave Written By Himself","0300087012","History"
"No Exit and Three Other Plays","0679725164","Literature & Fiction"
"No Exit and Three Other Plays","0679725164","Politics & Social Sciences"
"The Sound and the Fury: The Corrected Text","0679732241","Literature & Fiction"
"Rosencrantz and Guildenstern are Dead","0802132758","Literature & Fiction"
"Mrs. Dalloway: The Virginia Woolf Library Authorized Edition","0156628708","Literature & Fiction"
"The Rebel: An Essay on Man in Revolt","0679733841","Literature & Fiction"
"The Rebel: An Essay on Man in Revolt","0679733841","Politics & Social Sciences"
"To The Lighthouse: The Virginia Woolf Library Authorized Edition","0156907399","Literature & Fiction"
"Finnegans Wake (Classic, 20th-Century, Penguin)","0141181265","Literature & Fiction"
"Ulysses","0679722769","Literature & Fiction"
"Dubliners (Dover Thrift Editions: Short Stories)","0486268705","Literature & Fiction"
"Siddhartha: A Novel","0553208845","Literature & Fiction"
"The Myth of Sisyphus and Other Essays","0679733736","Literature & Fiction"
